Petition,URL,State,Signatures Count
Ban large public gatherings in the UK until the coronavirus has been contained,https://petition.parliament.uk/petitions/300885,open,171
Reinstate Percentage Threshold Scheme (PTS) for Statutory Sick Pay payments,https://petition.parliament.uk/petitions/300886,open,17
Make zero hour work contracts completely illegal for any employer to offer.,https://petition.parliament.uk/petitions/300887,open,243
Exclude small private pensions when calculating Pension Credit entitlement,https://petition.parliament.uk/petitions/300890,open,33
Allow Paracetamol to be sold in pack sizes of 100-250 again,https://petition.parliament.uk/petitions/300894,open,59
Close public transport down for an appropriate amount of time amidst COVID19,https://petition.parliament.uk/petitions/300900,open,138
Make schools allow GCSE students to take study leave before & during their exams,https://petition.parliament.uk/petitions/300903,open,29
Abolish the benefit in kind tax for company cars when its essential for the job,https://petition.parliament.uk/petitions/300904,open,48
Scrap the proposed ban on new petrol and diesel cars.,https://petition.parliament.uk/petitions/300907,open,88
Urge the Indian Government to revoke the Citizenship Amendment Act (CAA),https://petition.parliament.uk/petitions/300912,open,57
Make employers give a minimum number of hours to staff on Zero-hours contracts,https://petition.parliament.uk/petitions/300918,open,53
Ban the sale of artificial grass,https://petition.parliament.uk/petitions/300919,open,109
Ensure continued Universal health cover by legally committing to a minimum spend,https://petition.parliament.uk/petitions/300925,open,634
Require councils to provide Empty Property Premium details in property searches,https://petition.parliament.uk/petitions/300930,open,15
End Daylight Savings Time ,https://petition.parliament.uk/petitions/300931,open,73
Close down all UK airports & seaports to prevent further spreading of Covid-19.,https://petition.parliament.uk/petitions/300932,open,15470
Increase the rate of minimum wage for 16 year olds from £4.35 to at least £6.00,https://petition.parliament.uk/petitions/300938,open,74
Fund Vertebral Body Tethering (VBT) on the NHS for people with scoliosis,https://petition.parliament.uk/petitions/300957,open,482
Enforce Moderate Social Distancing to Contain & Delay Sars-Cov-2/Coronavirus,https://petition.parliament.uk/petitions/300965,open,909
Make LGBT conversion therapy illegal in the UK,https://petition.parliament.uk/petitions/300976,open,49530
Reduce 5 week wait for first Universal Credit payment to 2 weeks.,https://petition.parliament.uk/petitions/300980,open,219
Lower the fee for naturalisation as a British citizen,https://petition.parliament.uk/petitions/300981,open,90
Support Taiwan's membership of the WHO to help fight Coronavirus.,https://petition.parliament.uk/petitions/300991,open,835
Fund schools to provide GCSE textbooks free for all!,https://petition.parliament.uk/petitions/301004,open,25
Allow 'Personal Electric Vehicles' to use cycle lanes and walkways.,https://petition.parliament.uk/petitions/301014,open,365
Allow students to be exempted from RSE lessons to study their own religion,https://petition.parliament.uk/petitions/301016,open,15
Suspend school performance tables and make SATs tests optional (Coronavirus).,https://petition.parliament.uk/petitions/301021,open,35
Explore options for making NurOwn available to treat Motor Neurone Disease (MND),https://petition.parliament.uk/petitions/301033,open,33022
Keep the hard shoulder on Smart Motorways for emergency use only,https://petition.parliament.uk/petitions/301035,open,203
Any free trade agreement with US must be approved by UK referendum,https://petition.parliament.uk/petitions/301051,open,143
Prevent the use of driving aids during driving tests. ,https://petition.parliament.uk/petitions/301065,open,21
Make it a legal requirement to keep medical services proportionate to population,https://petition.parliament.uk/petitions/301075,open,13
Improve Maternal Mortality Rates and Health Care for Black Women in the U.K.,https://petition.parliament.uk/petitions/301079,open,53
Stop the spread of Covid-19. Stop making children sit on the floor at school. ,https://petition.parliament.uk/petitions/301082,open,42
"Allow for a gender neutral option on a passport, such as an ""X""",https://petition.parliament.uk/petitions/301083,open,128
Stop schools being closed unnecessarily over fears of coronavirus (Covid-19),https://petition.parliament.uk/petitions/301084,open,833
Change the law surrounding the display of private number plates on vehicles,https://petition.parliament.uk/petitions/301093,open,33
Extend £5000 grant to medical and dental students,https://petition.parliament.uk/petitions/301099,open,428
Review drink spiking and bring in provisions to protect people from spiking,https://petition.parliament.uk/petitions/301106,open,179
Extend ACM fund to include ALL types of flammable cladding in apartment blocks,https://petition.parliament.uk/petitions/301108,open,92
Scrap the right to vote in two separate constituencies at local elections,https://petition.parliament.uk/petitions/301117,open,151
Introduce Voter ID in every UK constituency for all Local & General Elections,https://petition.parliament.uk/petitions/301120,open,3614
Support Manchester Piccadilly 15/16 and associated Castlefield improvement works,https://petition.parliament.uk/petitions/301122,open,138
Encourage retailers to prioritise those over 70 shopping online for essentials,https://petition.parliament.uk/petitions/301126,open,28
Stop charging VAT on veterinary medications and services,https://petition.parliament.uk/petitions/301128,open,329
Add gender identity to the characteristics protected under the Equality Act 2010,https://petition.parliament.uk/petitions/301138,open,50
Make it law for hotels to provide accomodation for Severely Disabled People.,https://petition.parliament.uk/petitions/301139,open,17
Ban hunting the brown hare in its breeding season in England & Wales,https://petition.parliament.uk/petitions/301145,open,201
"Scrap 'On-Demand' Postal Voting, & Create Strict Eligibility Criteria",https://petition.parliament.uk/petitions/301157,open,2118
Impose sanctions on countries involved in the illegal tiger trade,https://petition.parliament.uk/petitions/301161,open,132
To legislate to enable routine video recording and broadcasting in civil courts,https://petition.parliament.uk/petitions/301165,open,38
Government to offer economic assistance to the events industry during COVID-19,https://petition.parliament.uk/petitions/301186,open,151344
Start screening every person who enters UK for Coronavirus,https://petition.parliament.uk/petitions/301188,open,540
Name a Railway Station after Sir Winston Churchill for VE Day,https://petition.parliament.uk/petitions/301194,open,86
Ensure safeguarding measures are in place for all UK escort review websites,https://petition.parliament.uk/petitions/301195,open,57
UKVI should refund application fees for a decision take more than 6 months.,https://petition.parliament.uk/petitions/301206,open,34
3 penalty points and £100 fine for not using indicators on the road.,https://petition.parliament.uk/petitions/301210,open,43
Extend the Mayor of London electoral vote to the workforce of Greater London .,https://petition.parliament.uk/petitions/301236,open,52
"A public enquiry into the RSPCA, and it's activities.",https://petition.parliament.uk/petitions/301241,open,685
Stop nitrous oxide (N2O / laughing gas) abuse in our communities.,https://petition.parliament.uk/petitions/301247,open,222
Protect benefits claimants from sanctions for missed appointments during COVID19,https://petition.parliament.uk/petitions/301251,open,100
Change the law on airport slots to favour ecological practices,https://petition.parliament.uk/petitions/301257,open,40
Free Prescriptions for diagnosed Mental Health Conditions,https://petition.parliament.uk/petitions/301271,open,203
Make the companion bus pass scheme a national statutory requirement.,https://petition.parliament.uk/petitions/301273,open,81
Publish guidance for schools and workplaces on how to deal with ADHD,https://petition.parliament.uk/petitions/301275,open,995
Reform PIP assessments,https://petition.parliament.uk/petitions/301286,open,91
Run a Public Awareness Campaign about the Climate and Ecological Emergency,https://petition.parliament.uk/petitions/301289,open,159
"Coronaviruses-Start Educational Campaign: Catch It,Bin It,Kill It When You Spit",https://petition.parliament.uk/petitions/301290,open,83
British Citizenship for UK-born children of European nationals living in the UK,https://petition.parliament.uk/petitions/301297,open,51
Force councils to repair potholes faster & get claims for damages paid quicker,https://petition.parliament.uk/petitions/301304,open,177
Occupation to be made a protected characteristic under the Equality Act 2010.,https://petition.parliament.uk/petitions/301307,open,215
Make employers provide full sick pay for 6 months,https://petition.parliament.uk/petitions/301313,open,39
Remove Universal Credit's 'Minimum Income Floor' for the self-employed.,https://petition.parliament.uk/petitions/301327,open,410
Give financial help to agency and zero hour workers during COVID-19 outbreak.,https://petition.parliament.uk/petitions/301328,open,20689
Extend the franchise for London mayoral elections to all UK residents,https://petition.parliament.uk/petitions/301332,open,174
Prevent late terminations of pregnancies where a baby would have Down's Syndrome,https://petition.parliament.uk/petitions/301335,open,120
Negotiate for Associate EU Citizenship for those who wish to keep EU rights,https://petition.parliament.uk/petitions/301343,open,1686
Require social media companies to retain data to prevent crimes,https://petition.parliament.uk/petitions/301344,open,38
Provide publicly accessible testing for the covid-19 virus around the UK now.,https://petition.parliament.uk/petitions/301354,open,2358
Make sanitary products more easily available for women and girls around the UK,https://petition.parliament.uk/petitions/301356,open,75
UK government to recognise the Armenian Genocide,https://petition.parliament.uk/petitions/301375,open,1962
Suspend VAT/Business Rates/PAYE Payments for three months amid outbreak COVID-19,https://petition.parliament.uk/petitions/301377,open,78
Give local residents right to object to HMO licence applications.,https://petition.parliament.uk/petitions/301394,open,17
Implement UK lockdown for preventing spread of COVID19,https://petition.parliament.uk/petitions/301397,open,408274
Extend maternity pay to 12 months,https://petition.parliament.uk/petitions/301414,open,1255
Exempt Commonwealth Service Personnel having to pay fees to remain in the UK,https://petition.parliament.uk/petitions/301422,open,23
Stop using student finance loans as an income when claiming universal credit,https://petition.parliament.uk/petitions/301431,open,138
For the Government to legislate to abolish the Benefits Cap.,https://petition.parliament.uk/petitions/301437,open,155
Businesses to work from home for an appropriate amount of time amidst COVID19,https://petition.parliament.uk/petitions/301439,open,2133
Require UK election results to be counted and reported at polling district level,https://petition.parliament.uk/petitions/301441,open,338
Require British Sign Language Interpreters for emergency announcements on TV.,https://petition.parliament.uk/petitions/301461,open,19661
Hand washing facilities should be made compulsory in all public places,https://petition.parliament.uk/petitions/301482,open,55
Cancel the £224 per year increase to the NHS Surcharge,https://petition.parliament.uk/petitions/301494,open,173
Ban counselling notes of rape survivors from being used in court,https://petition.parliament.uk/petitions/301500,open,30
Stop Proposed A303 Stonehenge Tunnel,https://petition.parliament.uk/petitions/301503,open,11
HMG implement the Home Affairs Select Committee report on Youth Violence in full,https://petition.parliament.uk/petitions/301512,open,11
Protect the childcare element of Universal Credit from deductions,https://petition.parliament.uk/petitions/301527,open,44
Government please fund free-of-charge Broadband for all over-75s.,https://petition.parliament.uk/petitions/301528,open,23
Make Remembrance Day a public holiday,https://petition.parliament.uk/petitions/301544,open,20
Fund paid leave for people with high risk conditions during COVID19,https://petition.parliament.uk/petitions/301559,open,85
Maintain the requirement for Top 14 Allergen listing,https://petition.parliament.uk/petitions/301562,open,74
Emergency National Unity Government,https://petition.parliament.uk/petitions/301563,open,1096
Make manufacturers use recyclable packaging by law,https://petition.parliament.uk/petitions/301572,open,48
Allow parents of vulnerable children to home educate temporarily during outbreak,https://petition.parliament.uk/petitions/301574,open,37
Make electric scooters legal to reduce our carbon footprint / cut emissions,https://petition.parliament.uk/petitions/301579,open,317
Allow families to prevent press reporting of a loved one’s suicide,https://petition.parliament.uk/petitions/301590,open,253
Limit yearly council tax increases to level of inflation,https://petition.parliament.uk/petitions/301594,open,44
Urgently set timeline and provide funding for roads to be repaired nationally.,https://petition.parliament.uk/petitions/301610,open,16
The NHS should provide free sanitary products for anyone,https://petition.parliament.uk/petitions/301619,open,26
Ban overseas funding for religious places of worship in the UK,https://petition.parliament.uk/petitions/301626,open,1515
Require Social Services to Record All Meetings,https://petition.parliament.uk/petitions/301637,open,55
Public Inquiry into the effectiveness of the DWP in relation to disabled people.,https://petition.parliament.uk/petitions/301648,open,45
Ensure employees are paid their full wage if they can't work due to coronavirus,https://petition.parliament.uk/petitions/301652,open,660
Create an earned amnesty route for migrants without leave to remain,https://petition.parliament.uk/petitions/301696,open,22552
Require Drs to give patient information leaflets prior to giving vaccinations.,https://petition.parliament.uk/petitions/301699,open,1432
Self employed people should be entitled to SSP and Paternal Leave,https://petition.parliament.uk/petitions/301703,open,20
All infrastructure projects be tested against the Net Zero Emissions 2050 Law,https://petition.parliament.uk/petitions/301709,open,33
Require a visual representation of sugar content on confectionery labels.,https://petition.parliament.uk/petitions/301737,open,348
Impose restrictions on television advertisements for charities,https://petition.parliament.uk/petitions/301739,open,18
Make the minimum wage equal for all ages and increase to at least £10,https://petition.parliament.uk/petitions/301749,open,68
Make Fire Safety a defined Material Consideration for Planning Applications,https://petition.parliament.uk/petitions/301762,open,19
Abolish of Value Added Tax (VAT) on Audiobooks,https://petition.parliament.uk/petitions/301766,open,32
Give Commonwealth members of British Armed Services right to remain indefinitely,https://petition.parliament.uk/petitions/301777,open,31
Pay self-employed for self-isolating due to corona virus,https://petition.parliament.uk/petitions/301793,open,3434
Reform rules for slaughter and compensation for cows with Bovine TB,https://petition.parliament.uk/petitions/301802,open,159
Publish estimated figures alongside confirmed cases of covid-19,https://petition.parliament.uk/petitions/301833,open,23
Give UK nurseries emergency funding if they have to close down amid COVID-19,https://petition.parliament.uk/petitions/301836,open,105499
Provide supplies and medical teams to support Italy.,https://petition.parliament.uk/petitions/301840,open,29
Provide live BSL interpretation for coronavirus briefings from the PM.,https://petition.parliament.uk/petitions/301844,open,144
Release the models underlying the government's response to COVID-19,https://petition.parliament.uk/petitions/301847,open,108
"Reduce tax on alcohol in pubs, clubs and restaurants",https://petition.parliament.uk/petitions/301850,open,26
Only release details of an individual when found guilty of a criminal offence,https://petition.parliament.uk/petitions/301875,open,34
Provide financial support to performers and creators during the COVID-19 crisis,https://petition.parliament.uk/petitions/301903,open,6648
Exempt overseas nurses from paying the Immigration Health Surcharge,https://petition.parliament.uk/petitions/301907,open,275
Create legislation requiring employers to have Mental Health First Aiders,https://petition.parliament.uk/petitions/301940,open,19
Reduce or scrap the immigration health surcharge for overseas NHS Staff.,https://petition.parliament.uk/petitions/301948,open,6051
Give school students free public transport to school,https://petition.parliament.uk/petitions/301962,open,37
Divide Child Benefit equally between separated parents who share equal care.,https://petition.parliament.uk/petitions/301972,open,18
Allow each child to have 5 days of permitted school vacation during term time,https://petition.parliament.uk/petitions/302021,open,16
"Give extra points in Points Based Immigration, if anyone has studied in the UK.",https://petition.parliament.uk/petitions/302050,open,500
Amend the IR35 Reforms to re-instate the 5% allowance for all contractors,https://petition.parliament.uk/petitions/302056,open,73
Cap and regulate service charge fees billed by managing companies to home owners,https://petition.parliament.uk/petitions/302120,open,63
Allow non-UK relatives to come to the UK to support families through coronavirus,https://petition.parliament.uk/petitions/302121,open,47
Provide immediate financial support to the Tourism Industry.,https://petition.parliament.uk/petitions/302139,open,668
Bring back the £1 note,https://petition.parliament.uk/petitions/302145,open,26
Encourage train companies to refund unused pre-booked train tickets,https://petition.parliament.uk/petitions/302148,open,30
Increase the state pension,https://petition.parliament.uk/petitions/302150,open,202
Economic assistance for the hospitality industry during the COVID-19 pandemic,https://petition.parliament.uk/petitions/302162,open,4287
Make restaurants state how they source their meat and how it was slaughtered.,https://petition.parliament.uk/petitions/302189,open,504
UK Government: issue care packages to the elderly and vulnerable,https://petition.parliament.uk/petitions/302190,open,89
Protect jobs and businesses in the travel and tourism industry during COVID-19,https://petition.parliament.uk/petitions/302233,open,55
Ban adverts for and sale of Asian elephant tours that do not meet set standards,https://petition.parliament.uk/petitions/302242,open,4328
Shorten the delayed local election time to at least August.,https://petition.parliament.uk/petitions/302247,open,25
"Encourage lenders, landlords and utilities to freeze payments during lockdown",https://petition.parliament.uk/petitions/302256,open,125512
Set a mandatory custodial sentence for people found guilty of sexual offences,https://petition.parliament.uk/petitions/302259,open,34
Launch an online system for people to report self-isolation for Covid-19,https://petition.parliament.uk/petitions/302267,open,59
Increase Statutory Sick Pay,https://petition.parliament.uk/petitions/302277,open,251
Implement Universal Basic Income to give home & food security through Covid-19,https://petition.parliament.uk/petitions/302284,open,111967
Extend ATOL protection to all flights booked within the UK.,https://petition.parliament.uk/petitions/302300,open,26
Postpone May Bank Holidays until Autumn when holidays and sports will be back on,https://petition.parliament.uk/petitions/302308,open,186
All prison sentences for all crimes are to be served in full before parole.,https://petition.parliament.uk/petitions/302312,open,15
Cancel 'Festival Of Britain' and give the money to our NHS,https://petition.parliament.uk/petitions/302318,open,569
Prevent perpetrators accessing children conceived through rape or sexual assault,https://petition.parliament.uk/petitions/302325,open,101
Require courts to make an attachment of earnings order where a debt is owed,https://petition.parliament.uk/petitions/302333,open,200
Make rooftop solar installations mandatory for all new homes valued over £400000,https://petition.parliament.uk/petitions/302355,open,38
Publish Government papers regarding COVID19 after 10 years.,https://petition.parliament.uk/petitions/302369,open,38
Fund the construction of a sea wall surrounding the whole of Great Britain,https://petition.parliament.uk/petitions/302395,open,28
Maintain elections during the Coronavirus crisis vía postal voting,https://petition.parliament.uk/petitions/302475,open,12
Ensure safe accommodation and care for homeless people with symptoms of COVID19,https://petition.parliament.uk/petitions/302485,open,146
Pay long-term supply teachers and support staff during mandatory closures.,https://petition.parliament.uk/petitions/302505,open,12921
Hold a Public Inquiry into the handling of the Covid-19 crisis,https://petition.parliament.uk/petitions/302576,open,11809
Provide a loan facility for self employed workers and directors of companies,https://petition.parliament.uk/petitions/302583,open,25
Fund the procurement of additional medical capacity from the private sector,https://petition.parliament.uk/petitions/302597,open,12
Commit to requisitioning private hospital beds amid the COVID-19 pandemic,https://petition.parliament.uk/petitions/302610,open,223
Award Covid-19 medals to all emergency services and involved armed forces ,https://petition.parliament.uk/petitions/302613,open,3904
Allow larger supermarkets to remain open without restricted hours on Sundays,https://petition.parliament.uk/petitions/302665,open,94
Abolish Council tax,https://petition.parliament.uk/petitions/302681,open,432
Encourage banks to delay 40% bank overdraft charges during the corona pandemic,https://petition.parliament.uk/petitions/302724,open,1387
Reimburse nurses for student loans and fund all fees for future student nurses,https://petition.parliament.uk/petitions/302732,open,5554
Work with other countries to coordinate an international lock down,https://petition.parliament.uk/petitions/302741,open,35
"The British government should set a net migration cap at 10,000 a year.",https://petition.parliament.uk/petitions/302744,open,2721
Halt work on HS2 and Stonehenge Tunnel until Coronavirus over,https://petition.parliament.uk/petitions/302756,open,564
Reduce the school leaving age to 13,https://petition.parliament.uk/petitions/302773,open,22
Require recipients of Covid 19 loans/grants to pay staff and freelancers first.,https://petition.parliament.uk/petitions/302781,open,29
Close the United Kingdom/Republic of Ireland border immediately.,https://petition.parliament.uk/petitions/302792,open,167
Lower Council tax and VAT,https://petition.parliament.uk/petitions/302793,open,33
Reimburse students on their year abroad who are affected by Coronavirus,https://petition.parliament.uk/petitions/302805,open,42
"Bring out ration books for food, everyday items and baby items",https://petition.parliament.uk/petitions/302823,open,91
Reimburse Nursing students who are prematurely called out into the workforce,https://petition.parliament.uk/petitions/302844,open,84
Reimburse all students of this year’s fees due to strikes and COVID-19,https://petition.parliament.uk/petitions/302855,open,339807
Support the beauty industry during the corona virus outbreak,https://petition.parliament.uk/petitions/302857,open,771
Fund basic funerals/cremations for Covid-19 Victims,https://petition.parliament.uk/petitions/302866,open,211
Introduce financial measures to support SMEs during Coronavirus outbreak,https://petition.parliament.uk/petitions/302889,open,82
We would like the government to consider social care as equally important to NHS,https://petition.parliament.uk/petitions/302897,open,42370
Reimburse contract termination fees,https://petition.parliament.uk/petitions/302921,open,23
Delay the TV License fees for the elderly for at least 12 months,https://petition.parliament.uk/petitions/302926,open,21
Provide all pensioners a survival pack containing essentials to last 30 days,https://petition.parliament.uk/petitions/302940,open,59
Negotiate for UK to remain part of the European Medicines Agency after 31 Dec,https://petition.parliament.uk/petitions/302950,open,90
Reduce the state pension age to 60 to better support the elderly,https://petition.parliament.uk/petitions/302965,open,208
Provide an Emergency fund for Health & Social Care Providers due to COVID-19,https://petition.parliament.uk/petitions/302969,open,60
Stop the Building of the Nuclear Power Plan at Bradwell on Sea,https://petition.parliament.uk/petitions/302971,open,5235
Extend sick pay and employment protection to those living with over 70s,https://petition.parliament.uk/petitions/302991,open,37
Decline any requests for bailouts from the airline industry,https://petition.parliament.uk/petitions/302992,open,4756
More funding to ensure the safety of patients in the mental health system,https://petition.parliament.uk/petitions/302995,open,79
Require schools and colleges to have gender neutral toilets,https://petition.parliament.uk/petitions/302997,open,301
Criminalise the publication of unfounded false statements by the media,https://petition.parliament.uk/petitions/303050,open,88
Restrict people stockpiling and reselling items at inflated prices,https://petition.parliament.uk/petitions/303070,open,206
