Petition,URL,State,Signatures Count
Support the British aviation industry during the COVID-19 outbreak,https://petition.parliament.uk/petitions/303081,open,101290
Reduce the speed limit of the A1 from 70mph to 60mph.,https://petition.parliament.uk/petitions/303118,open,15
Purchase more heart-lung machines to fight Covid-19 coronavirus,https://petition.parliament.uk/petitions/303128,open,33
Ban using fish as prizes at carnivals or other similar events.,https://petition.parliament.uk/petitions/303194,open,44
Include LGBT+ history and LGBT+ history month in National Curriculum,https://petition.parliament.uk/petitions/303195,open,28
Fund provision of internet and communication devices to over 70s during outbreak,https://petition.parliament.uk/petitions/303208,open,25
I wish for school to not be on Fridays.,https://petition.parliament.uk/petitions/303266,open,15
Require councils to suspend council tax payments during the coronavirus outbreak,https://petition.parliament.uk/petitions/303274,open,105209
Bonus for emergency services personnel working due to COVID-19,https://petition.parliament.uk/petitions/303306,open,467
Allow tax / NIC free notice periods and ex gratia payments  to freelance workers,https://petition.parliament.uk/petitions/303315,open,20
Pay self employed workers a wage due to lack of earnings caused by COVID-19.,https://petition.parliament.uk/petitions/303345,open,44553
Allow National Lottery revenue to be used to fund the NHS,https://petition.parliament.uk/petitions/303376,open,106
Make asthma prescriptions free for those in need.,https://petition.parliament.uk/petitions/303386,open,69
Prevent banks charging  fees for card payments to small businesses,https://petition.parliament.uk/petitions/303451,open,39
Fund free meals for NHS staff whilst on duty during the COVID19 Pandemic,https://petition.parliament.uk/petitions/303485,open,30
Change the legal age of being able to drive to 16,https://petition.parliament.uk/petitions/303592,open,12
Ban or limit bailouts for big businesses,https://petition.parliament.uk/petitions/303614,open,71
Remove citizenship fees for people born in the UK and from long term residents.,https://petition.parliament.uk/petitions/303625,open,16
"Financial support for the UK film industry employees, freelancers, contractors",https://petition.parliament.uk/petitions/303626,open,522
Introduce minimum fixed term sentencing for convicted murders of 25yrs to life.,https://petition.parliament.uk/petitions/303658,open,70
"Extend the transitional phase of Brexit by one year, to 31.12.21",https://petition.parliament.uk/petitions/303686,open,283
Reduce VAT for small businesses in the hospitality sector to 5%,https://petition.parliament.uk/petitions/303688,open,31
Call for Overhaul & Reform of the Driver and Vehicle Standards Agency & its Role,https://petition.parliament.uk/petitions/303705,open,7
Stop schools from giving over 30 minute detentions.,https://petition.parliament.uk/petitions/303766,open,13
Scrap The Bedroom Tax For People on SSP Due to Coronavirus.,https://petition.parliament.uk/petitions/303843,open,39
Seek to join Comprehensive & Progressive Agreement for Trans-Pacific Partnership,https://petition.parliament.uk/petitions/303861,open,45
Create a new Bank Holiday in recognition of the NHS and all its amazing workers.,https://petition.parliament.uk/petitions/303882,open,467
Reduce the cost of motor bike road tax,https://petition.parliament.uk/petitions/303926,open,310
Remove English literature from the national curriculum for Key Stage 4,https://petition.parliament.uk/petitions/303956,open,12
Make Covid-19 testing available for all healthcare professionals,https://petition.parliament.uk/petitions/304005,open,1076
Ban Animal Products,https://petition.parliament.uk/petitions/304078,open,769
Rename the Mental Health Act to the Mind Health Act.,https://petition.parliament.uk/petitions/304087,open,7
Allow charities to claim Gift Aid on all income during COVID19 crisis,https://petition.parliament.uk/petitions/304093,open,32
Government to offer economic assistance to the Leisure industry during COVID-19,https://petition.parliament.uk/petitions/304108,open,12
"Extend £10,000 small business grant to SMEs that do not have a property",https://petition.parliament.uk/petitions/304161,open,210
Pay salary for all who lose their jobs during this pandemic.,https://petition.parliament.uk/petitions/304185,open,87
"Require all public access toilet doors to be push to open, when exiting.",https://petition.parliament.uk/petitions/304237,open,17
Provide adequate PPE equipment for medical professionals working with COVID-19,https://petition.parliament.uk/petitions/304243,open,6156
Zero VAT during the Coronavirus Crisis.,https://petition.parliament.uk/petitions/304245,open,50
"Stop business rates, VAT and PAYE whilst government advise isolation for COVID19",https://petition.parliament.uk/petitions/304260,open,16
Make precautionary allergen labelling compulsory and more specific.,https://petition.parliament.uk/petitions/304265,open,61
Legislate to limit interest rates on lending during Covid-19 outbreak,https://petition.parliament.uk/petitions/304268,open,51
Allow full time students to claim universal credit during the Covid-19 pandemic,https://petition.parliament.uk/petitions/304298,open,68
Increase funding for coastal defence and compensate owners for lost properties,https://petition.parliament.uk/petitions/304349,open,52
Make it mandatory to wear a face mask in public during Covid-19 Pandemic,https://petition.parliament.uk/petitions/304397,open,11858
Implement in full the recommendations made by the UK Committee on Climate Change,https://petition.parliament.uk/petitions/304402,open,65
Use  money from the foreign aid budget to Support UK in the Covid 19 crisis,https://petition.parliament.uk/petitions/304418,open,2402
Extended Visas indefinitely for International Students.,https://petition.parliament.uk/petitions/304442,open,14396
Temporary nationalisation of private hospitals amid coronavirus pandemic - UK,https://petition.parliament.uk/petitions/304482,open,18
Introduce a 'one off' bank holiday after covid-19 pandemic to boost morale.,https://petition.parliament.uk/petitions/304513,open,87
Mandatory life sentences for child sexual abuse,https://petition.parliament.uk/petitions/304563,open,117
Incentivise NHS staff during the COVID19 outbreak by making wages untaxable,https://petition.parliament.uk/petitions/304595,open,3943
Give protection to renters during Corvid-19 Crisis. Ban evictions for one year.,https://petition.parliament.uk/petitions/304682,open,17
Make Home Help Services for the Elderly Exempt from VAT,https://petition.parliament.uk/petitions/304695,open,77
Allow pentalty-free withdrawals from Lifetime ISAs during the coronavirus.,https://petition.parliament.uk/petitions/304731,open,26
Provide food bank service as food banks close & hardship increases due to CV-19,https://petition.parliament.uk/petitions/304755,open,33
Support small manufacturers through COVID-19 with loans and business rate relief,https://petition.parliament.uk/petitions/304778,open,49
Bring back the death penalty,https://petition.parliament.uk/petitions/304809,open,7041
Close high street banks and building societies due to Coronavirus,https://petition.parliament.uk/petitions/304819,open,9
Implement a Covid-19 contact tracing app now.,https://petition.parliament.uk/petitions/304827,open,46
Work with breweries to provide financial help for Pub landlords during Covid-19 ,https://petition.parliament.uk/petitions/304847,open,3249
Refund university rent and tuition fees due to coronavirus,https://petition.parliament.uk/petitions/304855,open,13525
Enable and fund pay for special constables doing police duties during pandemic,https://petition.parliament.uk/petitions/304862,open,11
Government to waive all forms of taxation due to Coronavirus,https://petition.parliament.uk/petitions/304866,open,9
Extend visas for 3 more years for business applications under the Turkish ECAA.,https://petition.parliament.uk/petitions/304875,open,1773
Improve mental health services for young people (children and adolescents),https://petition.parliament.uk/petitions/304876,open,281
Impose an income tax holiday for UK tax payers during the Coronavirus crisis.,https://petition.parliament.uk/petitions/304905,open,15
Create a fund to reimburse money lost due to covid-19 travel cancellations,https://petition.parliament.uk/petitions/304912,open,190
Get HMRC to refund the Self-Employed their Jan 2020 1st Tax Payment on Account,https://petition.parliament.uk/petitions/304995,open,63
Reduce restrictions on access to private pensions during coronavirus,https://petition.parliament.uk/petitions/304996,open,38
Extend grants immediately to small businesses outside of SBRR,https://petition.parliament.uk/petitions/305024,open,24702
Set up a rebate scheme for contractors affected by planned IR35 reform,https://petition.parliament.uk/petitions/305027,open,25
Shutdown all construction sites with more than 50 workers due to COVID19.,https://petition.parliament.uk/petitions/305035,open,705
Extend the limitation period by 18 months for all personal injury matters.,https://petition.parliament.uk/petitions/305037,open,14
3 Days Off A Year To Let The World Rest,https://petition.parliament.uk/petitions/305055,open,127
COVID-19 tests for everyone working in Social Care.,https://petition.parliament.uk/petitions/305065,open,345
Set up National Helpline for non-medical services during Covid19 outbreak.,https://petition.parliament.uk/petitions/305098,open,16
Reimburse losses to pension funds resulting from Covid-19,https://petition.parliament.uk/petitions/305122,open,17
Give non-British citizens who are NHS workers automatic citizenship,https://petition.parliament.uk/petitions/305129,open,58648
Duty on alcohol sold in pubs should be temporarily suspended after the pandemic,https://petition.parliament.uk/petitions/305150,open,19
Eradicate the use of all coins in the UK,https://petition.parliament.uk/petitions/305155,open,14
Mandatory testing for all 3 Emergency Services for COVID-19,https://petition.parliament.uk/petitions/305163,open,31
Allow coronavirus victims to be buried according to their religious beliefs,https://petition.parliament.uk/petitions/305167,open,28
Make secondary schools start later (around 10 am),https://petition.parliament.uk/petitions/305181,open,16
Allow business to use Apprenticeship Levy pots for cash flow during Coronavirus,https://petition.parliament.uk/petitions/305190,open,14
Ban Facial Recognition Cameras within the UK,https://petition.parliament.uk/petitions/305194,open,18
Provide COVID19 financial assistance only to companies paying UK corporation tax,https://petition.parliament.uk/petitions/305203,open,7508
Open schools during the summer holidays,https://petition.parliament.uk/petitions/305213,open,265
Require all vulnerable and at risk people to stop going to work,https://petition.parliament.uk/petitions/305270,open,22
Tougher sentences for THEFT & BURGLARY In the wake of the Covid-19 outbreak,https://petition.parliament.uk/petitions/305271,open,31
Close all non essential shops during the Covid-19 crisis,https://petition.parliament.uk/petitions/305290,open,67
"Encourage lenders to suspend interest, fees and repayments during COVID-19",https://petition.parliament.uk/petitions/305297,open,115
Waive the duty on alcohol spirit to be used as an ingredient in hand sanitisers,https://petition.parliament.uk/petitions/305383,open,13
Make COVID19 testing available to teaching staff caring for pupils.,https://petition.parliament.uk/petitions/305423,open,34851
To give all parents with children food vouchers regardless of income.,https://petition.parliament.uk/petitions/305425,open,13
Make it illegal to use a disabled parking space without a Blue Badge,https://petition.parliament.uk/petitions/305511,open,43
Allow childminders to continue caring for children during the Coronavirus,https://petition.parliament.uk/petitions/305520,open,22
Allow schools to re-open in England!,https://petition.parliament.uk/petitions/305525,open,205
"Release HMP Prisoners due to COVID-19 - temporary release, licence, tag, curfew",https://petition.parliament.uk/petitions/305604,open,49074
To legislate so that Statutory Sick Pay covers the normal wage of the individual,https://petition.parliament.uk/petitions/305618,open,23
Stop 2 child tax credit limit so we can buy the things they need during Covid-19,https://petition.parliament.uk/petitions/305663,open,45
Require airlines to stop school holiday price hikes if they receive bail out,https://petition.parliament.uk/petitions/305685,open,25
Abolish the 6-month statutory time limit for prosecuting summary-only offences,https://petition.parliament.uk/petitions/305696,open,42
Government to fund parallel running of mass production for all Covid-19 trials.,https://petition.parliament.uk/petitions/305727,open,6
Temporarily suspend certain aspects of the Package Travel Regulations.,https://petition.parliament.uk/petitions/305746,open,903
Increase taxes on high earners to fund emergency Budget measures,https://petition.parliament.uk/petitions/305795,open,408
Fund Free Public Transport for all front line staff during COVID19 pandemic,https://petition.parliament.uk/petitions/305801,open,59
Scrap prescription charges during the Covid-19 outbreak.,https://petition.parliament.uk/petitions/305813,open,18
Make use of the EU Ventilator scheme for increased Corona Virus demand,https://petition.parliament.uk/petitions/305825,open,26
"Fund free Travel, Parking, Hotel & Childcare during COVID-19 for NHS staff",https://petition.parliament.uk/petitions/305854,open,188
Review the Equality Act as part of work on the National Disability Strategy.,https://petition.parliament.uk/petitions/305867,open,103
Fund and provide safety clothing for the supermarket staff on the frontline,https://petition.parliament.uk/petitions/305874,open,21
Pay Universal Credit from Day One,https://petition.parliament.uk/petitions/305875,open,90
Fund free TV for all patients in NHS hospitals. ,https://petition.parliament.uk/petitions/305879,open,20
Give all UK citizens access to their pension pots immediately tax free.,https://petition.parliament.uk/petitions/305886,open,122
Revoke emergency powers relevant to the coronavirus as soon as the crisis ends.,https://petition.parliament.uk/petitions/305889,open,29
Given the current situation suspend all Business Rates now to all business.,https://petition.parliament.uk/petitions/305899,open,25
Create the largest open wifi network for communities during Covid 19,https://petition.parliament.uk/petitions/305958,open,13
A yearly 2 week period where everything shuts down to let the world heal,https://petition.parliament.uk/petitions/306005,open,47
"Grant for the disabled people, to assist with social isolation.",https://petition.parliament.uk/petitions/306019,open,41
Mandatory custodial sentence and compensation for child neglect,https://petition.parliament.uk/petitions/306025,open,22
Force Newspapers to print their retractions on same page as the original story,https://petition.parliament.uk/petitions/306050,open,19
Restrict Government support for Covid-19 to dividend-paying companies,https://petition.parliament.uk/petitions/306053,open,24
"Cut beer duty for at least 12 months, so pubs can survive after the covid virus.",https://petition.parliament.uk/petitions/306054,open,22167
Ban landlords and estate agents discriminating against universal credit tenants,https://petition.parliament.uk/petitions/306091,open,36
Fund the NHS to provide increased reimbursement for community nurse mileage,https://petition.parliament.uk/petitions/306115,open,89
Government to pay rent or mortgage of all UK citizens during Covid-19 outbreak,https://petition.parliament.uk/petitions/306150,open,11
Abolish TV License Fee during the Corona Virus emergency.,https://petition.parliament.uk/petitions/306187,open,66
Refuse any request to suspend requirements for airlines to compensate customers,https://petition.parliament.uk/petitions/306197,open,13
Waive taxes on gift vouchers issued by independent businesses,https://petition.parliament.uk/petitions/306220,open,7
Raise the speed limit on UK motorways to 90 miles per hour,https://petition.parliament.uk/petitions/306312,open,15
Extend rights to access public funds and apply for Indefinite Leave to Remain,https://petition.parliament.uk/petitions/306335,open,44
Supply NHS key frontline staff working during Covid-19 healthy food hampers,https://petition.parliament.uk/petitions/306339,open,18
Give All Schools Protective Equipment to help protect staff from the Coronavirus,https://petition.parliament.uk/petitions/306347,open,102
Take immediate action to find and isolate COVID-19 cases and recent contacts,https://petition.parliament.uk/petitions/306369,open,67
Enable schools to pay overtime for lost holidays during Covid-19 quarantine,https://petition.parliament.uk/petitions/306385,open,9
Protect essential workers from contracting and spreading Covid-19.,https://petition.parliament.uk/petitions/306387,open,15
Please deliver basic food and other provisions to each person in UK during CV,https://petition.parliament.uk/petitions/306394,open,24
Bring back national service.,https://petition.parliament.uk/petitions/306432,open,27
Refund university students for 3rd Semester Tuition 2020,https://petition.parliament.uk/petitions/306494,open,101277
Reduce interest rate for Help to Buy scheme.,https://petition.parliament.uk/petitions/306566,open,16
Allow Gift Aid on charity donations made with loyalty points during COVID-19,https://petition.parliament.uk/petitions/306589,open,123
Protect the NHS and healthcare workers from legal action during COVID19,https://petition.parliament.uk/petitions/306608,open,61
Allow landlords full tax relief on finance costs such as mortgage interest,https://petition.parliament.uk/petitions/306655,open,11
Ensure that the national minimum wage is a living wage.,https://petition.parliament.uk/petitions/306660,open,118
Extend maternity leave by 3 months with pay in light of COVID-19,https://petition.parliament.uk/petitions/306691,open,216643
Introduce a ~5% SOCIAL RESPONSIBILITY tax to all workers and corporations,https://petition.parliament.uk/petitions/306697,open,10
DVSA to provide training Info of examiners conducting driving tests for disabled,https://petition.parliament.uk/petitions/306721,open,7
Review the decision to use previous data to calculate exam grades,https://petition.parliament.uk/petitions/306773,open,137
Offer Cat D licence holders (Bus & Coach) a free entitlement to Cat C LGV,https://petition.parliament.uk/petitions/306835,open,61
Give all key workers a 100% tax and Nat. Ins. holiday through COVID-19 crisis,https://petition.parliament.uk/petitions/306845,open,141723
No Extensions to the Brexit Transition Period,https://petition.parliament.uk/petitions/306862,open,10482
Frontline pharmacy staff given same protective wear as hospital frontline.,https://petition.parliament.uk/petitions/306886,open,27
Supply surgical masks to be used by the general public,https://petition.parliament.uk/petitions/306950,open,24
Require schools and universities to start the academic year in January 2021,https://petition.parliament.uk/petitions/306954,open,54
Remove requirement to make joint claims for Universal Credit during Covid-19,https://petition.parliament.uk/petitions/306965,open,42
Pass into law a windfall tax for all businesses that profit from coronavirus.,https://petition.parliament.uk/petitions/306971,open,22
Stop advanced and budgeting repayments on universal credit until Covid-19 goes,https://petition.parliament.uk/petitions/307011,open,24
Free school meals for children of key workers who still need to attend school,https://petition.parliament.uk/petitions/307016,open,22
Allow gyms and leisure centres to reopen,https://petition.parliament.uk/petitions/307146,open,23560
Limit Universal Credit & Working Tax Credit increases to those affected by virus,https://petition.parliament.uk/petitions/307149,open,8
Fund a seed pack for everyone in the UK so they can be self sufficient.,https://petition.parliament.uk/petitions/307167,open,21
"List all UK security personnel as ""Key Workers"" during the current crisis.",https://petition.parliament.uk/petitions/307202,open,23
Pay bonus to all key workers,https://petition.parliament.uk/petitions/307215,open,5299
Repatriate all UK residents stranded abroad,https://petition.parliament.uk/petitions/307260,open,1017
Close all unnecessary businesses including takeaways to safeguard health,https://petition.parliament.uk/petitions/307294,open,31
Stop the planned increase to the Immigration Health Surcharge,https://petition.parliament.uk/petitions/307321,open,1085
Omit the NHS from any future trade deal with the US,https://petition.parliament.uk/petitions/307339,open,20
Make any bailouts for UK airlines conditional on reducing emissions,https://petition.parliament.uk/petitions/307345,open,290
Bank holiday to thank those who helped during the COVID-19 crisis,https://petition.parliament.uk/petitions/307364,open,162
Fund free broadband for vulnerable households during social distancing.,https://petition.parliament.uk/petitions/307371,open,24
Reimburse health care professionals for professional registration fees,https://petition.parliament.uk/petitions/307399,open,45
"Create a symptom reporting site, where people with Covid-19 symptoms self-report",https://petition.parliament.uk/petitions/307405,open,16
Extend theory expiry dates due to COVID-19 (Coronavirus),https://petition.parliament.uk/petitions/307479,open,252
Award immigrant key workers with permanent residency after coronavirus crisis,https://petition.parliament.uk/petitions/307483,open,221
Coordinate rigorous world effort to end live wild animal markets,https://petition.parliament.uk/petitions/307504,open,1012
Fund increased death in service benefits for NHS staff who die during Covid-19,https://petition.parliament.uk/petitions/307592,open,210
Having one type of motorcycle licence in the UK like there is in the USA.,https://petition.parliament.uk/petitions/307616,open,20
Make hazard pay mandatory for key workers in the midst of COVID 19.,https://petition.parliament.uk/petitions/307619,open,7241
Allow DVLA to restart Motorcycle tests,https://petition.parliament.uk/petitions/307630,open,60
Ensure care workers get full pay from day one of Coronavirus-related absence.,https://petition.parliament.uk/petitions/307650,open,123
Extend rights to publicly funded care during coronavirus outbreak,https://petition.parliament.uk/petitions/307718,open,7
Emergency funding increase for mental health services due to Covid -19 pandemic,https://petition.parliament.uk/petitions/307724,open,16
Reform England's education system based on the Finnish education system.,https://petition.parliament.uk/petitions/307753,open,8
Specialist Cleaners to be added as Critical or Key Workers COVID-19 pandemic,https://petition.parliament.uk/petitions/307778,open,95
"Put appliance engineers, plumbers and electricians into the key workers category",https://petition.parliament.uk/petitions/307785,open,26
"Raise the (SBBR) small business COVID-19 grant to  £25,000 help small businesses",https://petition.parliament.uk/petitions/307846,open,18
End income tax on minimum wage earners during Covid-19 crisis.,https://petition.parliament.uk/petitions/307851,open,20
Keep vaping shops open in total COVID-19 lockdown to stop ex-smokers relapsing,https://petition.parliament.uk/petitions/307865,open,54
Provide all workers dealing with the public PPE to be protected from COVID-19 ,https://petition.parliament.uk/petitions/307866,open,28
Bring forward the plans to abolish VAT on e-books and other online publications.,https://petition.parliament.uk/petitions/307870,open,12
Make parking for all NHS staff free all of the time.,https://petition.parliament.uk/petitions/307909,open,87
Requisition Coronavirus Test Kits from private providers and redirect to the NHS,https://petition.parliament.uk/petitions/307917,open,40
Temporarily suspend the 20 hour term time work rule for international students.,https://petition.parliament.uk/petitions/307938,open,22
Business Rate Relief to be extended to all small businesses in healthcare.,https://petition.parliament.uk/petitions/307959,open,10322
Encourage local authorities and private car parks to suspend parking fines,https://petition.parliament.uk/petitions/307972,open,7
Ban the sale and use of all cigarettes (including e-cigarettes) by 2030.,https://petition.parliament.uk/petitions/307977,open,11
Forgive student debt of all key workers after Pandemic crisis.,https://petition.parliament.uk/petitions/307985,open,98
"Shut schools completely to stop putting teachers, TAs and pupils at risk",https://petition.parliament.uk/petitions/308013,open,166
A  medal to honour the fortitude of people working in essential occupations,https://petition.parliament.uk/petitions/308035,open,142
Complete UK lockdown of all business but those essential to our survival,https://petition.parliament.uk/petitions/308122,open,164
Ration gluten-free food to protect those with particular dietary requirements,https://petition.parliament.uk/petitions/308138,open,25
Consider how to compensate key workers for their efforts during Covid-19 crisis,https://petition.parliament.uk/petitions/308172,open,91
Extend Equality Act 2010 protections to all job applicants for seafarer roles,https://petition.parliament.uk/petitions/308183,open,68
Increase the budget for the UK Space Agency to £5 billion by 2024,https://petition.parliament.uk/petitions/308198,open,7
Call for an immediate end to the Israeli blockade on the people of Gaza,https://petition.parliament.uk/petitions/308206,open,5924
Supply and mandate the use of face masks and gloves,https://petition.parliament.uk/petitions/308209,open,28
