Petition,URL,State,Signatures Count
Protect the Environment – support carbon neutral energy alternatives,https://petition.parliament.uk/petitions/300000,open,1109
Give holiday caravan/lodge owners the same statutory protection as mobile homes.,https://petition.parliament.uk/petitions/300007,open,8657
"Fern’s Law: Compulsory to scan & check microchips to reunite stolen dogs, cats.",https://petition.parliament.uk/petitions/300010,open,24851
Sol’s Law – Create a new offence and tougher penalties for attacking animals. ,https://petition.parliament.uk/petitions/300015,open,1556
Return the Parthenon Marbles via the establishment of a new independent body,https://petition.parliament.uk/petitions/300016,open,173
Bring the pay scales of Crime Scene Investigators in line with police officers. ,https://petition.parliament.uk/petitions/300018,open,260
Revoke the Health and Social Care Act 2012 and renationalise the NHS,https://petition.parliament.uk/petitions/300019,open,24898
Prohibit MPs from voting in parliament when under the influence of alcohol,https://petition.parliament.uk/petitions/300021,open,308
Vets to scan prior to euthanasia for Rescue Back up and confirm keeper details,https://petition.parliament.uk/petitions/300025,open,22880
Hold a referendum on the post-2020 UK-EU relationship with option to rejoin EU,https://petition.parliament.uk/petitions/300026,open,5153
Fund research for childhood cancers with the worst survival rates,https://petition.parliament.uk/petitions/300027,open,23032
Repeal the Vagrancy Act of 1824,https://petition.parliament.uk/petitions/300029,open,63
Pay Carers an allowance equivalent to a fulltime job at the National Living wage,https://petition.parliament.uk/petitions/300032,open,11197
Fund Kuvan (sapropterin) on the NHS for people with PKU,https://petition.parliament.uk/petitions/300034,open,18389
Hold a referendum for devolution in the North of England,https://petition.parliament.uk/petitions/300039,open,47
Make it compulsory for all leisure centres to carry out checks under Sarah's law,https://petition.parliament.uk/petitions/300041,open,1281
Legal rights for ancient trees,https://petition.parliament.uk/petitions/300050,open,8424
"Require restaurants to show total prices, inclusive of service charges, in menus",https://petition.parliament.uk/petitions/300052,open,90
"Introduce a minimum sentence for carrying a knife, equal to carrying a firearm.",https://petition.parliament.uk/petitions/300054,open,15649
Coroners must be lawfully obligated to statistically record veteran suicides,https://petition.parliament.uk/petitions/300055,open,7687
Allow those who suffer from Coeliac Disease to join the Armed Forces,https://petition.parliament.uk/petitions/300056,open,298
Remove the East Anglia franchise from the Greater Anglia company,https://petition.parliament.uk/petitions/300057,open,329
"New ""UK Person"" status for nationals of countries that prohibit dual nationality",https://petition.parliament.uk/petitions/300058,open,383
Publish the Russia report,https://petition.parliament.uk/petitions/300059,open,55737
Make chronic kidney disease testing available for all new-borns. ,https://petition.parliament.uk/petitions/300061,open,667
Give consumers a statutory right to opt out of receiving paper correspondence,https://petition.parliament.uk/petitions/300064,open,37
Make the 6 Nations a culturally protected event.,https://petition.parliament.uk/petitions/300069,open,7543
Make pet theft crime a specific offence with custodial sentences.,https://petition.parliament.uk/petitions/300071,open,14936
Increase pay for NHS healthcare workers and recognise their work,https://petition.parliament.uk/petitions/300073,open,152905
"Change the law covering sale of services to preclude ""automatic renewal clause""",https://petition.parliament.uk/petitions/300074,open,110
Hold an inquiry into how the police handle historic sexual abuse cases.,https://petition.parliament.uk/petitions/300075,open,446
"Regulate wildlife food so it’s safer for our UK hedgehogs, mammals & birds",https://petition.parliament.uk/petitions/300077,open,1433
No capital gains tax on money used for social care fees,https://petition.parliament.uk/petitions/300078,open,11
Reduce student debt for student nurses and midwives,https://petition.parliament.uk/petitions/300079,open,5209
End 'other children a paying parent supports' deductions to Child Maintenance.,https://petition.parliament.uk/petitions/300088,open,68
Give the British Nationals (Overseas) of Hong Kong full British citizenship.,https://petition.parliament.uk/petitions/300091,open,6957
MPs resigning or leaving their political party should trigger a by election. ,https://petition.parliament.uk/petitions/300092,open,100
"We call on DEFRA, to reinstate the ban on the use of metaldehyde slug pellets.",https://petition.parliament.uk/petitions/300098,open,5298
Make Hedgehogs a Protected Species,https://petition.parliament.uk/petitions/300100,open,45350
Introduce Mandatory Ethnicity Pay Gap Reporting,https://petition.parliament.uk/petitions/300105,open,1321
Suspend sanctions against Iran for the duration of the coronavirus pandemic,https://petition.parliament.uk/petitions/300109,open,14287
Schedule General Elections to be every 4 years.,https://petition.parliament.uk/petitions/300112,open,85
Sack South Western Railway and hand over running of South Western to TfL,https://petition.parliament.uk/petitions/300113,open,447
Make it an offence to create & distribute fakenews for political/financial gain,https://petition.parliament.uk/petitions/300115,open,303
Revoke the TV licence using legislation,https://petition.parliament.uk/petitions/300118,open,15786
Fund more school places for children with SEN,https://petition.parliament.uk/petitions/300119,open,290
Decrease the Foreign Aid budget once we have left the EU.,https://petition.parliament.uk/petitions/300120,open,259
Highway Code Rules 163 and 215 to be made law. Pass horses wide and slow. ,https://petition.parliament.uk/petitions/300122,open,23179
CANZUK: Enter talks with Australia to join the Trans-Tasman Travel Agreement,https://petition.parliament.uk/petitions/300123,open,491
Access Protection Markings to be Enforced by Law,https://petition.parliament.uk/petitions/300127,open,23
Review the National Curriculum for history & include the Holocaust as a subject,https://petition.parliament.uk/petitions/300133,open,67
The Legalisation of Euthanasia in the UK,https://petition.parliament.uk/petitions/300134,open,862
Don’t criminalise trespass,https://petition.parliament.uk/petitions/300139,open,18181
Impose sanctions on China over its treatment of Uyghur Muslims,https://petition.parliament.uk/petitions/300146,open,478
"Allow child benefit to be claimed on household income, not individual income.",https://petition.parliament.uk/petitions/300149,open,192
Ban all single use plastic,https://petition.parliament.uk/petitions/300152,open,977
Stop the migration of people to Universal Credit,https://petition.parliament.uk/petitions/300154,open,62
Ban Smacking in England,https://petition.parliament.uk/petitions/300156,open,123
Call for Right to Appeal/Reverse DVSA Examiner’s Decisions on ALL Driving Tests,https://petition.parliament.uk/petitions/300157,open,27
"Ban pelagic trawlers, attach pingers to all boats, stop slaughter of dolphins.",https://petition.parliament.uk/petitions/300164,open,3358
Haydn's Law – All children 16 and under to wear a helmet when riding a bicycle,https://petition.parliament.uk/petitions/300165,open,3005
Repeal the 2013 and 2017 HS2 Hybrid Bills halting all HS2 works immediately.,https://petition.parliament.uk/petitions/300170,open,22164
Extend the Gambling Act to cover Loot Boxes,https://petition.parliament.uk/petitions/300171,open,3795
Publish new carbon budgets linked to the Paris Agreement and Climate Change Act,https://petition.parliament.uk/petitions/300178,open,1923
Equal (50/50) rights for both parents in the event of a separation.,https://petition.parliament.uk/petitions/300183,open,1889
Make it Law to Label Non-Religiously Slaughtered Meat Products.,https://petition.parliament.uk/petitions/300185,open,2128
Compulsory random drug testing to protect children and vulnerable adults,https://petition.parliament.uk/petitions/300188,open,48
"Ensure, where possible, government contracts are awarded to UK companies",https://petition.parliament.uk/petitions/300193,open,2057
Make the death penalty an option where intent to kill can be proven,https://petition.parliament.uk/petitions/300195,open,95
We ask the Government to have an NHS National Database Centre,https://petition.parliament.uk/petitions/300199,open,137
Make cannabis legal for recreational use for ages 21+,https://petition.parliament.uk/petitions/300201,open,2834
Parliament to protect housing benefit payments during Coronavirus.,https://petition.parliament.uk/petitions/300204,open,477
All halal and kosher certified products are to be prominently labelled as such.,https://petition.parliament.uk/petitions/300205,open,1206
Make nurseries exempt from business rates to support the childcare sector,https://petition.parliament.uk/petitions/300210,open,11114
Ban spitting in the street especially in light of the covid-19 threat,https://petition.parliament.uk/petitions/300213,open,54
Independent CCTV monitoring  in English abattoirs,https://petition.parliament.uk/petitions/300221,open,970
Ban All Pheasant Shooting in England and The Rearing Of Game Birds For Shooting.,https://petition.parliament.uk/petitions/300222,open,204
Ban the live export of animals,https://petition.parliament.uk/petitions/300225,open,73
Require all broadband providers to support a common router standard,https://petition.parliament.uk/petitions/300226,open,84
Ban discrimination in private rental sector towards people on benefits.,https://petition.parliament.uk/petitions/300229,open,68
Review how Social Services operate and bring in procedures to protect parents,https://petition.parliament.uk/petitions/300231,open,1580
Make the legal age for social media users to 18+,https://petition.parliament.uk/petitions/300232,open,106
Release the Home Office's Grooming Gang Review in full,https://petition.parliament.uk/petitions/300239,open,125639
Pass law to ensure no unsaleable goods are destroyed but donated to good causes.,https://petition.parliament.uk/petitions/300242,open,269
Ban the advertising and endorsement of Internal Combustion Engine Vehicles.,https://petition.parliament.uk/petitions/300243,open,29
Replace the current press self regulatory system with a statutory regulator,https://petition.parliament.uk/petitions/300246,open,733
Help independent businesses creating regeneration in struggling High Streets.,https://petition.parliament.uk/petitions/300250,open,89
Introduce Human Trafficking into the secondary school curriculum,https://petition.parliament.uk/petitions/300256,open,36
Ban non-stun slaughter in the UK. ,https://petition.parliament.uk/petitions/300257,open,8046
Change the voting system from First Past The Post to Instant Runoff Voting,https://petition.parliament.uk/petitions/300258,open,47
Introduce the topic of Body Dysmorphic Disorder into the national curriculum.,https://petition.parliament.uk/petitions/300259,open,27
Remove MPs 'special' income tax exemption for accommodation expenses,https://petition.parliament.uk/petitions/300261,open,176
Change the Sexual Offences Act so women can be charged with rape against males,https://petition.parliament.uk/petitions/300270,open,17969
Increase salary for school teachers.,https://petition.parliament.uk/petitions/300271,open,103
Introduce a form of proportional representation for all UK elections,https://petition.parliament.uk/petitions/300274,open,3528
Reverse the decision to support new onshore wind farms,https://petition.parliament.uk/petitions/300276,open,505
Make General Elections bank holidays,https://petition.parliament.uk/petitions/300278,open,133
Add Environmental Conservation to the national curriculum for all schools,https://petition.parliament.uk/petitions/300279,open,232
Subject the Child Maintenance Service to review and ensure it's fit for purpose,https://petition.parliament.uk/petitions/300281,open,687
Introduce a minimum Wage (fee) for Gig-Economy Workers,https://petition.parliament.uk/petitions/300282,open,35
Ban all advertising for online gambling sites,https://petition.parliament.uk/petitions/300285,open,404
Run a nationwide information campaign to reduce roadside litter.,https://petition.parliament.uk/petitions/300286,open,344
Rejoin the EU under Article 49 TEU,https://petition.parliament.uk/petitions/300297,open,16649
Repeal the Fixed Term Parliaments Act.,https://petition.parliament.uk/petitions/300300,open,143
Restore the concept of Free Speech and abolish hate speech laws.,https://petition.parliament.uk/petitions/300305,open,158
Make the Life in the UK test questions more relevant to actual life in the UK.,https://petition.parliament.uk/petitions/300306,open,298
Call a Referendum on Irish Unity,https://petition.parliament.uk/petitions/300307,open,19
Fund the creation of a new hospital between Shrewsbury and Telford,https://petition.parliament.uk/petitions/300309,open,595
Grant cats the same status under the Road Traffic Act 1988 as dogs,https://petition.parliament.uk/petitions/300310,open,783
Hold a referendum to scrap the UK's policy of Net Zero CO2 by 2050,https://petition.parliament.uk/petitions/300316,open,6586
Create a national database of people banned from keeping animals,https://petition.parliament.uk/petitions/300317,open,1778
Legislate on the use of Vegan labelling,https://petition.parliament.uk/petitions/300324,open,829
A motion for the introduction of a Digital Data Dividend (The DDD),https://petition.parliament.uk/petitions/300327,open,1197
"Make the licensing and monitoring of Animal rescues, compulsory.",https://petition.parliament.uk/petitions/300335,open,44
Include self-employed in statutory sick pay during Coronavirus,https://petition.parliament.uk/petitions/300336,open,697103
Appoint an Independent Ombudsman/Regulator for the Veterinary Profession.,https://petition.parliament.uk/petitions/300339,open,150
Raise national speed limit to 80 mph on motorways and dual carriageways,https://petition.parliament.uk/petitions/300342,open,38
Support British Food Producers by ensuring that marks of origin remain,https://petition.parliament.uk/petitions/300353,open,129
Make it law that all local councils should have annual road checks in their area,https://petition.parliament.uk/petitions/300356,open,68
Make it mandatory for Police & CPS to provide counselling to ALL victims of CSA,https://petition.parliament.uk/petitions/300359,open,576
Make all parcel delivery businesses equip drivers with cameras,https://petition.parliament.uk/petitions/300362,open,43
Ban the use of peat in gardening and horticulture,https://petition.parliament.uk/petitions/300368,open,2750
Stop Minting 1p & 2p Coins ,https://petition.parliament.uk/petitions/300369,open,28
Add the British National Anthem to the National Curriculum,https://petition.parliament.uk/petitions/300371,open,1195
Abolish (or raise threshold on) luxury car tax for Ultra Low Emission Vehicles,https://petition.parliament.uk/petitions/300373,open,41
Give UK Citizens’ Family Equal Immigration Rights to that of EU Citizens’ Family,https://petition.parliament.uk/petitions/300377,open,34
Require employers to pay workers on a weekly basis.,https://petition.parliament.uk/petitions/300379,open,28
"Provide all nhs Staff with full pay, off sick, if they have coronavirus 19.",https://petition.parliament.uk/petitions/300380,open,193
Please allow veterinarians to use emergency lights when attending emergencies,https://petition.parliament.uk/petitions/300392,open,225
Abolish the House of Lords,https://petition.parliament.uk/petitions/300395,open,248
No prosecution for parents that remove child from school during a pandemic.,https://petition.parliament.uk/petitions/300399,open,89544
Fund better support for women experiencing pregnancy loss and miscarriage,https://petition.parliament.uk/petitions/300401,open,402
Close Schools/Colleges down for an appropriate amount of time amidst COVID19.,https://petition.parliament.uk/petitions/300403,open,682929
Ban trade deals with countries that deny climate change or not meeting targets.,https://petition.parliament.uk/petitions/300405,open,41
Revise the NPPF to include the protection of all but particularly old hedgerows.,https://petition.parliament.uk/petitions/300407,open,1744
Scrap all  election deposits to open up democracy,https://petition.parliament.uk/petitions/300410,open,107
Extend the transition; delay negotiations until after the coronavirus outbreak,https://petition.parliament.uk/petitions/300412,open,64776
Create charge for use of non-biodegradable material,https://petition.parliament.uk/petitions/300421,open,48
Ensure all royal visits around the UK are fully funded by the Royal Household.,https://petition.parliament.uk/petitions/300422,open,3553
The Government should fund free TV licences for all over-75s.,https://petition.parliament.uk/petitions/300425,open,147
"Change approach to COV-19 - if schools have ""confirmed"" cases they should close.",https://petition.parliament.uk/petitions/300426,open,3054
Make The Masters and The Open golf tournaments Category A free-to-air,https://petition.parliament.uk/petitions/300427,open,699
Remove the protected status of badgers.,https://petition.parliament.uk/petitions/300435,open,194
Increase the success criteria for all future referendums to 60% of the vote,https://petition.parliament.uk/petitions/300437,open,57
Support the Bill for a June Bank Holiday (United Kingdom Day).,https://petition.parliament.uk/petitions/300447,open,96
Call for the UK government to formally recognise the State of Palestine,https://petition.parliament.uk/petitions/300450,open,1541
Include gardening in the National Curriculum,https://petition.parliament.uk/petitions/300453,open,292
Return the Chagos Islands to Mauritius,https://petition.parliament.uk/petitions/300456,open,59
Revoke IR35 Legislation that is causing significant damage to UK businesses,https://petition.parliament.uk/petitions/300458,open,1502
Appoint an independent panel to conduct a Public Inquiry into the DVSA,https://petition.parliament.uk/petitions/300462,open,10
Remove mandatory financial advice clause for Defined Benefit Pension transfers.,https://petition.parliament.uk/petitions/300464,open,12
Introduce a licensing scheme to control the purchase and ownership of animals,https://petition.parliament.uk/petitions/300467,open,34
Ban wearing face coverings in public places.,https://petition.parliament.uk/petitions/300471,open,2483
To block Huawei equipment to be used in 5G network,https://petition.parliament.uk/petitions/300472,open,9041
Hold a public inquiry into the 2016 EU membership referendum,https://petition.parliament.uk/petitions/300473,open,831
Legalise Cannabis for recreational and medicinal purposes,https://petition.parliament.uk/petitions/300475,open,1358
Make nit nurses mandatory in schools,https://petition.parliament.uk/petitions/300478,open,36
Abolish the Supreme Court and return power to the Lords of Appeal in Ordinary.,https://petition.parliament.uk/petitions/300498,open,723
Make the prorogation of Parliament non justiciable by any court in the land.,https://petition.parliament.uk/petitions/300506,open,26
Ban Horses From Public Roads,https://petition.parliament.uk/petitions/300521,open,32
Require universities to reimburse students' tuition fees during strike action,https://petition.parliament.uk/petitions/300528,open,135118
Continue the Red Diesel Exemption Status for Legitimate UK Industry & Business.,https://petition.parliament.uk/petitions/300530,open,618
The UK should ban the importation of Shark Fins.,https://petition.parliament.uk/petitions/300535,open,2749
Introduce a Pet Removal/Protection Order for victims of Domestic Abuse,https://petition.parliament.uk/petitions/300537,open,236
Keep the BBC License Fee and save the BBC.,https://petition.parliament.uk/petitions/300549,open,133
Corrections and clarifications in UK media to be as prominent as original story,https://petition.parliament.uk/petitions/300557,open,954
Make university fees free,https://petition.parliament.uk/petitions/300560,open,265
Replace Breed Specific Legislation with a new statutory framework,https://petition.parliament.uk/petitions/300561,open,42085
Call the government to reduce UK University tuition fees from £9250 to £3000,https://petition.parliament.uk/petitions/300566,open,121
Urge India and UN to send UN Peacekeepers to Kashmir and carry out a plebiscite,https://petition.parliament.uk/petitions/300570,open,1025
Require phones to receive security updates for 5 years,https://petition.parliament.uk/petitions/300575,open,44
Fund more support for mental health.,https://petition.parliament.uk/petitions/300585,open,82
Create a separate English Parliament,https://petition.parliament.uk/petitions/300587,open,89
Ensure high quality university lecturing by making pedagogy training mandatory,https://petition.parliament.uk/petitions/300591,open,52
Extend the franchise (voting age) to include those who are 16-17 years old.,https://petition.parliament.uk/petitions/300596,open,257
Remove VAT on Energy Efficiency Measures To Help Meet 2050 Emissions Target,https://petition.parliament.uk/petitions/300597,open,42
Negotiate full membership of the future Erasmus+ education and youth programme,https://petition.parliament.uk/petitions/300598,open,35
Keep the UK's membership of the EU Convention on Human Rights,https://petition.parliament.uk/petitions/300602,open,881
Ban Consumption Of Dogs & Cats in the UK,https://petition.parliament.uk/petitions/300610,open,198
Impose requirements on schools to shorten the length of the school day to 4hours,https://petition.parliament.uk/petitions/300614,open,16
Require recycling systems in NHS clinical areas for plastic healthcare waste,https://petition.parliament.uk/petitions/300615,open,45
Reform child maintenance and benefit calculations to be fair and prevent poverty,https://petition.parliament.uk/petitions/300620,open,34
Close all universities down for an appropriate amount of time amidst COVID-19,https://petition.parliament.uk/petitions/300628,open,123684
Move the capital of the UK.,https://petition.parliament.uk/petitions/300630,open,61
Advise people to avoid shaking hands during COVID-19,https://petition.parliament.uk/petitions/300632,open,8
Stop Forestry England granting licenses for Fox & Hare hunts,https://petition.parliament.uk/petitions/300634,open,7067
Tougher sentences for animal abusers to include a lifetime ban on owning pets,https://petition.parliament.uk/petitions/300644,open,142
Abolish Homework in all schools,https://petition.parliament.uk/petitions/300653,open,1092
Abolish the mandatory 0.7% GDP Foreign Aid target and spend our money at home,https://petition.parliament.uk/petitions/300662,open,8338
Remove the minimum earnings threshold for Statutory Sick Pay,https://petition.parliament.uk/petitions/300669,open,2888
Ban MMA liquid use in the beauty industry,https://petition.parliament.uk/petitions/300673,open,58
Create a statutory body for the regulation of political advertising,https://petition.parliament.uk/petitions/300695,open,49
All drivers to take a refresher course every 10 years.,https://petition.parliament.uk/petitions/300698,open,44
Ban plastic charity bags being delivered to every household,https://petition.parliament.uk/petitions/300699,open,49
Ensure balance and fairness in political reporting,https://petition.parliament.uk/petitions/300700,open,46
Provide the neighbourhood location of each new COVID 19 case on a live feed.,https://petition.parliament.uk/petitions/300723,open,83
Ban isolation booths in schools.,https://petition.parliament.uk/petitions/300755,open,30
Coronavirus: Free Hand sanitisers for everyone.,https://petition.parliament.uk/petitions/300758,open,67
Introduce limits on per customer purchases in all supermarkets,https://petition.parliament.uk/petitions/300766,open,564
Make it compulsory for food products to have environmental impact traffic lights,https://petition.parliament.uk/petitions/300770,open,572
Double Child Benefit Payments and increase annually in line with Inflation Rise.,https://petition.parliament.uk/petitions/300774,open,1900
Create a Sikh regiment in the British army,https://petition.parliament.uk/petitions/300775,open,16
Providing Government funding for pilot training.,https://petition.parliament.uk/petitions/300784,open,49
Ban animal testing for cosmetics companies and hair and body products.,https://petition.parliament.uk/petitions/300798,open,75
Any future free trade deals must include freedom of movement of people,https://petition.parliament.uk/petitions/300810,open,100
Introduce Visitation Rights/Contact Orders for Siblings.,https://petition.parliament.uk/petitions/300811,open,10
Ban parking charges in motorway rest areas/service stations,https://petition.parliament.uk/petitions/300814,open,73
Add the UEFA Champions League to the Protected Events List,https://petition.parliament.uk/petitions/300816,open,66
Propose full world multilateral disarmament in five years at the United Nations,https://petition.parliament.uk/petitions/300818,open,70
"To ban the sale, use, ownership and manufacture of glue traps.",https://petition.parliament.uk/petitions/300839,open,2055
Revoke the bedroom tax,https://petition.parliament.uk/petitions/300849,open,70
Allow homebuyers who haven’t owned in the last 10 years the stamp duty exemption,https://petition.parliament.uk/petitions/300868,open,31
Ban gambling games based on entertainment TV shows,https://petition.parliament.uk/petitions/300871,open,13
Allow SORN vehicles to be parked on the public road.,https://petition.parliament.uk/petitions/300883,open,27
