Petition,URL,State,Signatures Count
Provide 'safe supply' of drugs to people with addiction during COVID-19 shutdown,https://petition.parliament.uk/petitions/308229,open,31
Create a right to paid leave for women and men following all miscarriages,https://petition.parliament.uk/petitions/308243,open,128
Relax hunting regulations during Covid-19 outbreak,https://petition.parliament.uk/petitions/308284,open,14
Reform Covid19 income support schemes to pay 75% of wages and give 5% to the NHS,https://petition.parliament.uk/petitions/308296,open,10
Ban All Commercial Flights On Sundays,https://petition.parliament.uk/petitions/308349,open,32
Ban the sale of palm oil products in the UK ,https://petition.parliament.uk/petitions/308368,open,7
Fund paid parental leave for all employed parents of school aged children,https://petition.parliament.uk/petitions/308376,open,14
"Suspend student loan repayments for doctors, nurses and midwives during COVID-19",https://petition.parliament.uk/petitions/308456,open,34
Add Locksmiths to the Key Workers List during COVID-19,https://petition.parliament.uk/petitions/308520,open,22
Allow certain learner drivers to drive unsupervised for a limited period,https://petition.parliament.uk/petitions/308523,open,685
Prevent unqualified practitioners from performing beauty and hair treatments,https://petition.parliament.uk/petitions/308539,open,14
"During Covid-19 pandemic, make PPE on prescription for those most at risk.",https://petition.parliament.uk/petitions/308558,open,13
Help international healthcare professionals to join the NHS,https://petition.parliament.uk/petitions/308572,open,174
Freeze student loan payments and interest accrual for Covid-19,https://petition.parliament.uk/petitions/308579,open,184
Designate a day for the recognition of our NHS and all Emergency Services.,https://petition.parliament.uk/petitions/308614,open,69
Translate UK Government and NHS Advice on COVID - 19.,https://petition.parliament.uk/petitions/308653,open,10
Prohibit companies from delivering leaflets to houses until the lockdown ends.,https://petition.parliament.uk/petitions/308690,open,17
"Provide financial help to zoos, aquariums, & rescue centres during the pandemic.",https://petition.parliament.uk/petitions/308733,open,3938
Call on all remaining countries to ban whaling completely.,https://petition.parliament.uk/petitions/308741,open,23
Provide airport key workers with masks for personal protection,https://petition.parliament.uk/petitions/308833,open,23
Pay 80% wages to parents caring for high risk children.,https://petition.parliament.uk/petitions/308860,open,23
Increase exemptions on cash gifts from inheritance tax during Covid-19,https://petition.parliament.uk/petitions/308883,open,8
Make the Monday after Mothering Sunday 2021 an extra bank holiday.,https://petition.parliament.uk/petitions/308891,open,83
Identify and reward all key workers due to Covid-19,https://petition.parliament.uk/petitions/308903,open,64
"Hold a 2-minute silence each year to the lives lost, from the Coronavirus.",https://petition.parliament.uk/petitions/308923,open,13
Urge the Chinese government to stop the annual Yulin Dog Eating Festival,https://petition.parliament.uk/petitions/308926,open,27
Close construction sites because of Covid19.,https://petition.parliament.uk/petitions/308933,open,5456
Introduce Fines for people wasting NHS time during the Corona virus Outbreak,https://petition.parliament.uk/petitions/308960,open,15
Fund free books for children who have lost access to libraries due to the Corona,https://petition.parliament.uk/petitions/308961,open,7
Close all food stores on a Sunday during this lockdown,https://petition.parliament.uk/petitions/308974,open,7
All products sold in the UK to be clearly labelled with country of origin,https://petition.parliament.uk/petitions/309019,open,30
Provide 80% pay to all members of a household with a vulnerable person,https://petition.parliament.uk/petitions/309049,open,89
Require garages to only open for key workers during Covid19,https://petition.parliament.uk/petitions/309077,open,12
Pay Key Workers 2 weeks full pay if they have to isolate.,https://petition.parliament.uk/petitions/309104,open,90
Instruct all local Councils to suspend all live planning applications submitted.,https://petition.parliament.uk/petitions/309176,open,37
Include the UK's Volunteer Police officers in Schedule 7 of the Coronavirus Bill,https://petition.parliament.uk/petitions/309193,open,21
Implement a windfall tax on UK billionaires to fund effort to fight Covid-19,https://petition.parliament.uk/petitions/309220,open,731
Pay self-employed workers 80% of gross income during Covid-19,https://petition.parliament.uk/petitions/309231,open,382
Move all bank holidays to a time after Coronavirus Lockdown,https://petition.parliament.uk/petitions/309243,open,467
Provide alternative means for conducting weddings during Covid Pandemic,https://petition.parliament.uk/petitions/309262,open,142
Require schools to allow children the option to retake their year next year,https://petition.parliament.uk/petitions/309265,open,746
Offer 80% financial support to persons in the 'Construction Industry Scheme',https://petition.parliament.uk/petitions/309281,open,37
Lockdown food shops to stop spreading viruses,https://petition.parliament.uk/petitions/309291,open,7
Help for working parents with <5yo who can't work remotely as caring for them,https://petition.parliament.uk/petitions/309305,open,9
Delay the ban on Menthol Cigarettes until after the COVID-19 Pandemic,https://petition.parliament.uk/petitions/309316,open,39
Close the Borders of the United Kingdom to Prevent the Spread of Coronavirus.,https://petition.parliament.uk/petitions/309332,open,2181
"Fund all medical degrees to support future doctors and nurses
 
",https://petition.parliament.uk/petitions/309404,open,15
Temporarily remove landfill tax,https://petition.parliament.uk/petitions/309425,open,21
Mandatory jail sentence for assaulting (eg. spitting/coughing) emergency worker,https://petition.parliament.uk/petitions/309432,open,12
Extend access to an NHS funded pension to Retail Community Pharmacists,https://petition.parliament.uk/petitions/309462,open,943
Cut student loan's interest rate to properly reflect Bank of England's base rate,https://petition.parliament.uk/petitions/309558,open,51
Ban online gambling immediately in the UK,https://petition.parliament.uk/petitions/309612,open,90
Change restrictions on furloughed workers so they can still work and contribute,https://petition.parliament.uk/petitions/309635,open,18
Repeal the Human Rights Act and update treason laws,https://petition.parliament.uk/petitions/309681,open,713
Fund increased pay for lower band nurses and care assistants,https://petition.parliament.uk/petitions/309726,open,33
"Pay NHS Agency Nurses, Doctors and Healthcare staff a wage if they self isolate",https://petition.parliament.uk/petitions/309771,open,16
Allocate funds to enable testing for everyone with COVID-19 type symptoms.,https://petition.parliament.uk/petitions/309815,open,21
Give parents the right to see their child unless there is a valid reason,https://petition.parliament.uk/petitions/309849,open,106
Exempt golf courses from the list of venues required to close due to Covid-19,https://petition.parliament.uk/petitions/309851,open,308
"Extend £25,000 cash grants to nurseries during Covid-19 crisis.",https://petition.parliament.uk/petitions/309856,open,20
Keep electronic proceedings for non-molestation orders after Covid-19 pandemic,https://petition.parliament.uk/petitions/309880,open,50
Fund work-based learning providers on same basis as colleges,https://petition.parliament.uk/petitions/309911,open,22
Consider passing a Good Samaritan Act during CV-19,https://petition.parliament.uk/petitions/309920,open,22
Introduce fines for non-emergency 999 calls,https://petition.parliament.uk/petitions/309968,open,25
Require MOT services to close to reduce spread of Covid-19,https://petition.parliament.uk/petitions/309972,open,9
6 Month Road Tax Exemption Due To UK Lockdown,https://petition.parliament.uk/petitions/309981,open,9
One days isolation every year to remember those we have lost,https://petition.parliament.uk/petitions/309988,open,30
Require a referendum on the sale of any Government-owned company or assets,https://petition.parliament.uk/petitions/310007,open,14
Withhold financial support to employers making staff redundant during Covid-19,https://petition.parliament.uk/petitions/310053,open,28
Pay international students weekly wage equal to 20 hrs to meet monthly expenses,https://petition.parliament.uk/petitions/310054,open,24
Suitable equipment to protect our front-line police officers from COVID-19,https://petition.parliament.uk/petitions/310079,open,7
Commission a Memorial Plaque to honour and remember UK victims of the Covid-19,https://petition.parliament.uk/petitions/310097,open,17
Give financial support to childcare establishments staying open during Covid-19,https://petition.parliament.uk/petitions/310107,open,7
"Free prescriptions for all carers, emergency personnel, NHS workers and police",https://petition.parliament.uk/petitions/310109,open,63
Support the healthcare workers by waiving the university fees they have to pay,https://petition.parliament.uk/petitions/310140,open,14
Automatic life ban for drink and drug drivers at first offence,https://petition.parliament.uk/petitions/310145,open,7
Join the Joint European Procurement Initiative.,https://petition.parliament.uk/petitions/310166,open,19
RAF Red Arrows to fly over London with NHS blue & white smoke,https://petition.parliament.uk/petitions/310183,open,19
Make it easier for those self-isolating to sign a Will,https://petition.parliament.uk/petitions/310188,open,9
National Service for NHS.,https://petition.parliament.uk/petitions/310190,open,11
Close all the courts down to stop the spread of COVID-19.,https://petition.parliament.uk/petitions/310205,open,26
"Immediate 25% pay rise to all healthcare professionals,fire fighters and police.",https://petition.parliament.uk/petitions/310216,open,25
Ban the sale of tobacco during the covid-19 outbreak,https://petition.parliament.uk/petitions/310248,open,26
Stop culling immediately and start widespread vaccination of badgers now,https://petition.parliament.uk/petitions/310307,open,4760
Stop All UK Deportation Activity during this Corona Virus Pandemic,https://petition.parliament.uk/petitions/310313,open,21
Require businesses to turn off lighting in empty offices during Covid-19,https://petition.parliament.uk/petitions/310317,open,11
Suspend limitations on the number of hours visa holders can work during Covid-19,https://petition.parliament.uk/petitions/310318,open,12
Bring back Sundays being a day of rest.,https://petition.parliament.uk/petitions/310336,open,38
Close all shops including supermarkets during covid 19,https://petition.parliament.uk/petitions/310341,open,18
Scrap in-country visa Extension fees,https://petition.parliament.uk/petitions/310356,open,164
UK Government to set up a Covid-19 Select Committee,https://petition.parliament.uk/petitions/310359,open,8
Home Office to offer one year visa extensions without applications being made.,https://petition.parliament.uk/petitions/310387,open,606
Allow paramedic prescribers to prescribe controlled drugs,https://petition.parliament.uk/petitions/310404,open,749
Set a minimum mot testing fee after covid-19 to help businesses to recover,https://petition.parliament.uk/petitions/310422,open,22
Cover 80% of wages for people who are having to shield for 12 weeks.,https://petition.parliament.uk/petitions/310424,open,15
Remove the £50k earnings limit for self-employed to access government funding,https://petition.parliament.uk/petitions/310455,open,1176
For self employed new mums to not be discriminated against in the 80% gov help,https://petition.parliament.uk/petitions/310461,open,58
Ban all garden waste fires during Coronavirus Pandemic in residential areas.,https://petition.parliament.uk/petitions/310468,open,14
"Provide COVID19 income support for the newly self-employed, without HMRC records",https://petition.parliament.uk/petitions/310471,open,11760
Coronavirus Support Package for Directors / Shareholders of small Limited Co's.,https://petition.parliament.uk/petitions/310515,open,61253
Increase National Insurance by 5 pence to Increase Salaries for all NHS Workers,https://petition.parliament.uk/petitions/310518,open,10
For the sake of wildlife & forests ban the release of balloons and sky lanterns.,https://petition.parliament.uk/petitions/310556,open,15
Write off all student loans for all NHS staff fighting COVID19,https://petition.parliament.uk/petitions/310559,open,2357
Offer financial support for out of work Seafarers during the COVID-19 pandemic,https://petition.parliament.uk/petitions/310568,open,18
Pay keyworkers 80% of wages if they or their family are ill or self-isolate,https://petition.parliament.uk/petitions/310570,open,16
Fund hotel accommodation for key workers during Covid19.,https://petition.parliament.uk/petitions/310594,open,21
Pay all NHS Staff at least the Real Living Wage!,https://petition.parliament.uk/petitions/310615,open,9
Reimburse international NHS workers the cost of the NHS surcharge this year.,https://petition.parliament.uk/petitions/310628,open,13
Pay NHS nurses & newly qualified teachers a starting salary of £35k.,https://petition.parliament.uk/petitions/310629,open,136
Introduce Compensation for seasonal workers due to Covid-19,https://petition.parliament.uk/petitions/310649,open,8
Pay those who had job offers retracted 80% of the wage they would have earned.,https://petition.parliament.uk/petitions/310654,open,35
Change the Furlough Support Scheme to include new hires after 28th February.,https://petition.parliament.uk/petitions/310679,open,11489
Ensure all prison workers are issued protective gear during this pandemic,https://petition.parliament.uk/petitions/310683,open,99
Abolish Stamp Duty on all transactions during Corona Virus pandemic,https://petition.parliament.uk/petitions/310695,open,209
Link pay rises for the emergency services + public sector to same % as MPs,https://petition.parliament.uk/petitions/310753,open,14
Provide accreditation for volunteers in Government-supported Covid-19 schemes,https://petition.parliament.uk/petitions/310798,open,28
Permanent Basic Income for Healthcare workers.,https://petition.parliament.uk/petitions/310801,open,17
Have a complete lock down to control the spread of the virus,https://petition.parliament.uk/petitions/310805,open,94
Do not count time outside of the UK during COVID-19 against ILR applicants,https://petition.parliament.uk/petitions/310806,open,19
Offer 0% Emergency Loans to Stranded Citizens for flights and accommodation,https://petition.parliament.uk/petitions/310809,open,8
Extend Tier-4 visas and waive third-term tuition fee for international students,https://petition.parliament.uk/petitions/310825,open,6029
Bring forward COVID-19 Self-employment grants to April 2020,https://petition.parliament.uk/petitions/310898,open,2942
Create/use alternative method for verifying identity for UC claims and GOV help,https://petition.parliament.uk/petitions/310930,open,25
Suspend sanctions to Universal Credit to help families and people in hardship,https://petition.parliament.uk/petitions/310979,open,6
Provide a rescue package for UK scientific research,https://petition.parliament.uk/petitions/311031,open,9
Covid bail outs for companies in exchange for carbon-reducing commitments.,https://petition.parliament.uk/petitions/311059,open,324
Give single parents the right to stay at home due to Covid-19,https://petition.parliament.uk/petitions/311118,open,23
Allow employees to claim the 80% income support directly from the Government,https://petition.parliament.uk/petitions/311183,open,8
Hold a royal commission into the state of the NHS at the start of Covid19 crisis,https://petition.parliament.uk/petitions/311195,open,10
Offer a British Farming Grant to Farmers who cannot get the Small Business Grant,https://petition.parliament.uk/petitions/311207,open,104
"Do not use phone data to track us without our permission, regardless of use",https://petition.parliament.uk/petitions/311296,open,13
"Help Asylum Seekers in UK
during the Covid-19 Outbreak.",https://petition.parliament.uk/petitions/311322,open,22
"Provide pensions to all who lose their husband, wife or partner during Covid-19",https://petition.parliament.uk/petitions/311355,open,11
Consider paying commission and bonus as part or furlough payment,https://petition.parliament.uk/petitions/311380,open,42
Add mobile phone & computer retailers/repairers to list of essential businesses,https://petition.parliament.uk/petitions/311455,open,21
Ban selling drinks bottles that aren’t made out of a sustainable material.,https://petition.parliament.uk/petitions/311520,open,72
Allow furloughed charity employees to volunteer for their charity,https://petition.parliament.uk/petitions/311559,open,1664
"Close footpaths, bridleways & right of ways through farmers land during Covid-19",https://petition.parliament.uk/petitions/311581,open,6
Halt Trident renewal and spend the funds on fighting the coronavirus.,https://petition.parliament.uk/petitions/311638,open,1198
"Cancel HS2 and use the money for the NHS and local economies, post Covid-19.",https://petition.parliament.uk/petitions/311642,open,1258
Use all revenue from lockdown fines for NHS PPE.,https://petition.parliament.uk/petitions/311666,open,11
Prevent family courts and social services making decisions based on hearsay,https://petition.parliament.uk/petitions/311739,open,72
Scrap the 48 hour limit on average weekly working time for mobile workers,https://petition.parliament.uk/petitions/311747,open,21
Close all non essential online stores/warehouses,https://petition.parliament.uk/petitions/311765,open,60
All police fines collected for unnecessary travel should go to the NHS.,https://petition.parliament.uk/petitions/311882,open,20
Debate the Chinese government’s handling of Covid-19,https://petition.parliament.uk/petitions/311905,open,22
Fund free TV access for hospital patients during Covid-19 outbreak,https://petition.parliament.uk/petitions/311947,open,8
Support family members of non-UK NHS staff to attend university,https://petition.parliament.uk/petitions/311959,open,7
Give HGV Drivers a 6 month exemption from CPC through Covid-19 Crisis,https://petition.parliament.uk/petitions/311971,open,12
Remove the 50% earnings barrier so all self employed workers to receive support.,https://petition.parliament.uk/petitions/311987,open,4003
Ban alcohol sales in the UK during the pandemic.,https://petition.parliament.uk/petitions/312023,open,7
COVID-19: Commandeer production of British-made PPE for frontline staff,https://petition.parliament.uk/petitions/312024,open,21
Investigate NHS Supply Chain performance providing PPE to frontline staff.,https://petition.parliament.uk/petitions/312054,open,158
Increase UK contribution to SDG 6: Ensure access to water and sanitation for all,https://petition.parliament.uk/petitions/312104,open,16
Extend the 12month 'giving notice' period for weddings postponed due to COVID-19,https://petition.parliament.uk/petitions/312109,open,5327
Introduce a new offence of using Covid-19/Coronavirus for the purpose of fraud,https://petition.parliament.uk/petitions/312188,open,8
Provide Financial Help to Veterinary Practices during Covid-19,https://petition.parliament.uk/petitions/312231,open,10
Remove savings cap on Universal Credit for Covid-19 related Self Employed claims,https://petition.parliament.uk/petitions/312283,open,125
Allow companies to furlough their Schedule D workers under the CJRS,https://petition.parliament.uk/petitions/312285,open,174
Award posthumous medals to NHS and other frontline workers; victims of covid-19.,https://petition.parliament.uk/petitions/312389,open,132
Indefinite Leave to Remain for NHS Staff,https://petition.parliament.uk/petitions/312565,open,3675
Remove firms discretion and obligate firms to furlough employees where eligible.,https://petition.parliament.uk/petitions/312611,open,829
Citizenship for all immigrant NHS and social care workers - Covid19,https://petition.parliament.uk/petitions/312894,open,128
Delay 5G in the UK until there’s been an independent investigation,https://petition.parliament.uk/petitions/312997,open,43989
We need a new act of Parliament - Recall of Local Government Councillors.,https://petition.parliament.uk/petitions/313243,open,28
Create a National Health Insurance Tax for the NHS,https://petition.parliament.uk/petitions/313361,open,9
Remove the criteria for men who have sex with men to wait before donating blood,https://petition.parliament.uk/petitions/313693,open,20
VAT refunds for SMEs,https://petition.parliament.uk/petitions/313807,open,188
Citizenship to all immigrant key workers,https://petition.parliament.uk/petitions/313825,open,322
Enable the Government to access Bank of England GRANTS to fund Public Services!,https://petition.parliament.uk/petitions/314487,open,17
Free transport for post 16 to any further education establishment,https://petition.parliament.uk/petitions/314495,open,37
Encourage credit agencies to show consideration to negative transactions,https://petition.parliament.uk/petitions/314622,open,27
Extend proposed Graduate visa route to 2019-20 batch of students due to COVID19,https://petition.parliament.uk/petitions/314710,open,1463
Requisition capacity from the defence sector to produce medical equipment.,https://petition.parliament.uk/petitions/314993,open,21
End lockdown to prevent further economic damage to the UK’s economy.,https://petition.parliament.uk/petitions/315979,open,269
Reward our healthcare heroes now for risking their lives to fight Covid-19.,https://petition.parliament.uk/petitions/318741,open,4001
Fair and Equal voting rights for young people across the UK,https://petition.parliament.uk/petitions/318810,open,866
