Petition,URL,State,Signatures Count
Reform arrangements for benefits for people with lifelong disabilities,https://petition.parliament.uk/petitions/575154,open,69
Prioritise brownfield development in law to protect our green belt and farmland,https://petition.parliament.uk/petitions/575169,open,7974
Prohibit the publication of addresses of defendants and convicted offenders,https://petition.parliament.uk/petitions/575185,open,209
Remove the VAT on all laptops for all children home learning,https://petition.parliament.uk/petitions/575204,open,12
Allow Disabled People to Keep All Their Benefits if They Move in With a Partner,https://petition.parliament.uk/petitions/575206,open,229
Do not build an undersea tunnel from Britain to Northern Ireland,https://petition.parliament.uk/petitions/575213,open,28
Lift HGV parking ban in Kent so drivers can have their legally required breaks.,https://petition.parliament.uk/petitions/575232,open,2744
Fund free Covid-19 tests for overseas relatives of terminally ill people,https://petition.parliament.uk/petitions/575290,open,15
Provide coronavirus vaccination passports for UK citizens,https://petition.parliament.uk/petitions/575297,open,144
Fund parental leave for self-employed parents equivalent to that for employees,https://petition.parliament.uk/petitions/575326,open,37
Investigate press coverage of Covid-19 outbreak as part of any public inquiry,https://petition.parliament.uk/petitions/575336,open,1871
Require local authorities to compost all food waste,https://petition.parliament.uk/petitions/575348,open,88
Keep all lockdown restrictions for longer than March 8th,https://petition.parliament.uk/petitions/575357,open,10
Increase penalties for illegal off-road driving,https://petition.parliament.uk/petitions/575361,open,281
Removing all restrictions on opening and closing times for licenced premises,https://petition.parliament.uk/petitions/575367,open,9
Allow university students graduating in summer to have an in-person graduation,https://petition.parliament.uk/petitions/575368,open,398
Increase funding to provide support and research into Tourettes Syndrome,https://petition.parliament.uk/petitions/575370,open,13170
Fund a Government anti-flytipping advertising campaign,https://petition.parliament.uk/petitions/575382,open,27
Require schools to provide online classes as an option to all children,https://petition.parliament.uk/petitions/575392,open,14
Prevent Social Housing landlords increasing rent this financial year,https://petition.parliament.uk/petitions/575436,open,7
Relax visit-visa time restriction for foreign family members of UK residents.,https://petition.parliament.uk/petitions/575441,open,34
Ban battery chicken farms,https://petition.parliament.uk/petitions/575458,open,613
"Agree to hold a public inquiry to examine the true, full, effects of Lockdowns.",https://petition.parliament.uk/petitions/575462,open,15550
Increase the sentence for child sexual abuse to 25 years,https://petition.parliament.uk/petitions/575469,open,17
Enable Dental Care Professionals to claim an NHS pension,https://petition.parliament.uk/petitions/575494,open,2944
"Don’t send students back until mid April, to ensure a definite decrease in cases",https://petition.parliament.uk/petitions/575503,open,24
Fund study of Allied Health Professional University courses,https://petition.parliament.uk/petitions/575504,open,19
Lower the price of the £210 COVID Home Test Kits for travellers entering the UK,https://petition.parliament.uk/petitions/575509,open,27896
Make it illegal to video or take photos of a disabled person without permission,https://petition.parliament.uk/petitions/575513,open,9
Suspend No Recourse to Public Funds visa conditions,https://petition.parliament.uk/petitions/575517,open,13692
Kristian Johnsons Law. Life sentences for Death by Careless & Dangerous Driving.,https://petition.parliament.uk/petitions/575522,open,713
Make it law that ANY refunds from now on must be INSTANT.,https://petition.parliament.uk/petitions/575525,open,23
Increase funding for Child and Adolescent Mental Health Services,https://petition.parliament.uk/petitions/575532,open,1571
Ban fire and rehire employment tactics,https://petition.parliament.uk/petitions/575544,open,13037
Redistribute unrequired medical supplies to prevent waste and offer aid,https://petition.parliament.uk/petitions/575561,open,215
Introduce an independent regulator of the Child Maintenance Service,https://petition.parliament.uk/petitions/575575,open,163
Do not impose new free speech conditions on higher education,https://petition.parliament.uk/petitions/575600,open,37
Increase tax threshold for NHS/care/teachers & home schooling self-employed,https://petition.parliament.uk/petitions/575605,open,10
Prohibit employers from requiring employees to have a Covid-19 vaccine,https://petition.parliament.uk/petitions/575607,open,15477
Scrap quarantine for vaccinated people arriving in the UK,https://petition.parliament.uk/petitions/575612,open,132
Toughen penalties for restaurants failing to allow delivery couriers toilet use,https://petition.parliament.uk/petitions/575617,open,77
Ryan's Law: Widen definition of 'death by dangerous driving',https://petition.parliament.uk/petitions/575620,open,89773
Legalize cannabis for recreational and medical use,https://petition.parliament.uk/petitions/575625,open,663
Require a “none of the above” option for all elections/referendums,https://petition.parliament.uk/petitions/575629,open,14
Reintroduce The Eat Out To Help Out Scheme To Save The Hospitality Industry.,https://petition.parliament.uk/petitions/575642,open,67
Dogs that kill or maim any another animal should have to wear a muzzle in public,https://petition.parliament.uk/petitions/575661,open,15
Increase vaccination priority for moderate risk (clinically vulnerable) people,https://petition.parliament.uk/petitions/575707,open,158
Establish a mandatory licensing system for animal rescue homes,https://petition.parliament.uk/petitions/575719,open,789
Introduce a Universal Basic Income in the next Budget,https://petition.parliament.uk/petitions/575729,open,36
Pass a law for no referendums on the constitution for at least 30 years,https://petition.parliament.uk/petitions/575739,open,233
End the academic year at Easter for this year’s Upper Sixth and Year 11,https://petition.parliament.uk/petitions/575753,open,1654
Classify Covid-19 as an Occupational Disease,https://petition.parliament.uk/petitions/575754,open,291
Remove Ultra Small-Volume Vehicle Manufacturers from 2035 decarbonisation target,https://petition.parliament.uk/petitions/575759,open,46
Grant UK citizenship to Commonwealth & Nepalese Armed Forces veterans,https://petition.parliament.uk/petitions/575760,open,307
Require all cemeteries to have CCTV,https://petition.parliament.uk/petitions/575771,open,66
Scrap plans to write off historic child support debts.,https://petition.parliament.uk/petitions/575775,open,796
Regulate the naming of cosmetic and beauty products based on their ingredients,https://petition.parliament.uk/petitions/575776,open,203
Make long covid an occupational illness,https://petition.parliament.uk/petitions/575778,open,100
To remove the UAE off the ‘Red List’ by the Summer,https://petition.parliament.uk/petitions/575787,open,11703
Make regenerative farming methods mandatory,https://petition.parliament.uk/petitions/575792,open,36
Outlaw discrimination against those who do not get a Covid-19 vaccination,https://petition.parliament.uk/petitions/575801,open,18323
Require schools across England to start the school day at 10am.,https://petition.parliament.uk/petitions/575809,open,10
Make verified ID a requirement for opening a social media account.,https://petition.parliament.uk/petitions/575833,open,172509
Review how babies with Tongue Tie are diagnosed and treated,https://petition.parliament.uk/petitions/575834,open,946
Review the role and structure of the CAA following the UK’s exit from the EU,https://petition.parliament.uk/petitions/575835,open,424
Provide free basic wifi to all homes in England.,https://petition.parliament.uk/petitions/575842,open,19
Delay the return of school to the 22nd of march to keep students and staff safe,https://petition.parliament.uk/petitions/575843,open,29
Evenly spread the environmental charges applied to domestic gas and electricity.,https://petition.parliament.uk/petitions/575844,open,126
Tougher Laws/Penalties to tackle theft of Catalytic Converters ,https://petition.parliament.uk/petitions/575859,open,371
Lower citizenship fees for children under 18,https://petition.parliament.uk/petitions/575871,open,17
Provide funding for nature reserves in towns,https://petition.parliament.uk/petitions/575879,open,23
Give pre-settled EU students access to home fees,https://petition.parliament.uk/petitions/575937,open,85
Mark Allen's Law - we want throwline stations around all bodies of open water,https://petition.parliament.uk/petitions/575967,open,3756
Offer all students the full maintenance loan no matter what their parents earn.,https://petition.parliament.uk/petitions/575973,open,22
Abolish or reduce immigration fees for Commonwealth Service Personnel,https://petition.parliament.uk/petitions/575976,open,16
Increase VAT threshold to £1m turnover or £85k profit to help small businesses.,https://petition.parliament.uk/petitions/575994,open,16
Scrap the Voter ID requirement introduced in the Election Integrity Bill,https://petition.parliament.uk/petitions/576024,open,33
Ensure Scots living in the UK have a vote in any future independence referendum,https://petition.parliament.uk/petitions/576028,open,56
Make beavers a protected species to protect them,https://petition.parliament.uk/petitions/576035,open,13
Impose a 50p surcharge on clothes hangers,https://petition.parliament.uk/petitions/576036,open,19
Settled Status for EU citizens who contributed as key workers during Covid-19.,https://petition.parliament.uk/petitions/576050,open,11
Fund a Lunar colony.,https://petition.parliament.uk/petitions/576079,open,18
Increase sentences for crimes relating to bodily harm of another individual,https://petition.parliament.uk/petitions/576088,open,19
Expand Bounce Back Loan eligibility to businesses established since March 2020,https://petition.parliament.uk/petitions/576120,open,6
Remove those from the line of succession whose permanent residence is not the UK,https://petition.parliament.uk/petitions/576122,open,21
"All Mobility Scooters, Electric Scooters, and Cyclists, to be insured.",https://petition.parliament.uk/petitions/576131,open,24
Allow driving tests to be temporarily replaced by instructor examinations.,https://petition.parliament.uk/petitions/576153,open,11
Stop providing Government responses to petitions that get over 10k signatures,https://petition.parliament.uk/petitions/576157,open,15
Create a fund for e-fuel technology research and deployment ,https://petition.parliament.uk/petitions/576193,open,13
Increase awareness of Juvenile Idiopathic Arthritis in UK schools,https://petition.parliament.uk/petitions/576198,open,923
Allow all foster children over the age of 12 the choice of who to live with,https://petition.parliament.uk/petitions/576214,open,19
Fund free dental care for cancer patients in receipt of PIP or ESA,https://petition.parliament.uk/petitions/576215,open,9
Extend the forced Embryo Destruction time limit during the COVID-19 pandemic,https://petition.parliament.uk/petitions/576216,open,7
Exempt outdoor worship from any pandemic restrictions,https://petition.parliament.uk/petitions/576218,open,33
Reduce period for children (under 18) to settle in the UK to 5 years' residence,https://petition.parliament.uk/petitions/576223,open,26
Extend Embryo Destruction statutory cooling-off period by 1-year due to COVID,https://petition.parliament.uk/petitions/576251,open,8
Permit leisure flying and allow flight schools to reopen.,https://petition.parliament.uk/petitions/576274,open,7
Ban the advertising of gambling businesses on social media platforms.,https://petition.parliament.uk/petitions/576307,open,22
Begin distributing 50% of UK vaccine supplies to poorer countries immediately.,https://petition.parliament.uk/petitions/576325,open,23
"""Chairman"" be replaced by ""Chair"" in the Companies Act 2006.",https://petition.parliament.uk/petitions/576337,open,24
Create a rent cap of £700 PCM and give extra protections to renters,https://petition.parliament.uk/petitions/576340,open,47
"Put more funding into music, drama, and dance education.",https://petition.parliament.uk/petitions/576363,open,22
Enable those lacking capacity to stand trial to be registered as sex offenders,https://petition.parliament.uk/petitions/576383,open,709
Allow driving tests to resume subject to negative lateral flow tests,https://petition.parliament.uk/petitions/576408,open,33
Establish a permanent UK climate citizens assembly,https://petition.parliament.uk/petitions/576448,open,104
Seek to conclude UK/France reciprocal agreement on exchange of driving licences,https://petition.parliament.uk/petitions/576455,open,14961
Ease gathering restrictions on religious festivals and holy days,https://petition.parliament.uk/petitions/576482,open,2973
Prioritise key workers for theory/practical driving tests,https://petition.parliament.uk/petitions/576502,open,16
Make June 22nd (or the day after Nightclubs reopen) a bank holiday,https://petition.parliament.uk/petitions/576510,open,9
Open zoos up alongside outside sports and activities,https://petition.parliament.uk/petitions/576514,open,99
Make stirring up hatred based on disability a specific criminal offence,https://petition.parliament.uk/petitions/576546,open,134
Increase curriculum content about water safety as part of swimming lessons,https://petition.parliament.uk/petitions/576563,open,6671
Extend maternity exemption certificate expiration date for births during covid.,https://petition.parliament.uk/petitions/576570,open,68
Weddings to be allowed from the 17th of May with a maximum of 150,https://petition.parliament.uk/petitions/576593,open,33
Allow families to take children out of school for a holiday this year only,https://petition.parliament.uk/petitions/576618,open,12
"More funding & legal changes to improve, preserve and protect salmon & sea trout",https://petition.parliament.uk/petitions/576622,open,19
Offer Group B streptococcus (GBS) test to all pregnant women,https://petition.parliament.uk/petitions/576661,open,29
Ensure access to free chickenpox vaccines for adults not previously infected,https://petition.parliament.uk/petitions/576665,open,13
Allow people to register with more than 1 GP,https://petition.parliament.uk/petitions/576670,open,1033
Make British Sign Language (BSL) a compulsory subject in the national curriculum,https://petition.parliament.uk/petitions/576713,open,17
Require adverts to state when person's features have been enhanced or distorted,https://petition.parliament.uk/petitions/576724,open,1103
Bring in mandatory life sentences for online grooming of a child,https://petition.parliament.uk/petitions/576759,open,67
Ban “Gain of Function” research on viruses and bacteria in the UK,https://petition.parliament.uk/petitions/576773,open,14
Cancel Easter school holidays to allow kids to stay in school,https://petition.parliament.uk/petitions/576789,open,11
Extend the mortgage guarantee scheme to cover 100% mortgages,https://petition.parliament.uk/petitions/576792,open,19
Do not make it mandatory to wear a mask in the classroom,https://petition.parliament.uk/petitions/576843,open,4268
"Remove recommendation that face coverings be used in classrooms
",https://petition.parliament.uk/petitions/576845,open,26
Allow Cornish wedding vows,https://petition.parliament.uk/petitions/576865,open,126
Prioritise blind and partially sighted for Covid-19 vaccination,https://petition.parliament.uk/petitions/576883,open,96
Make lying in the House of Commons a criminal offence,https://petition.parliament.uk/petitions/576886,open,6063
Require all workplaces to have at least one Mental Health First Aider,https://petition.parliament.uk/petitions/576887,open,192
Ban the sale and release of sky Lanterns & Balloons,https://petition.parliament.uk/petitions/576889,open,34
Ban battery rabbit farming,https://petition.parliament.uk/petitions/576893,open,1784
Include ‘North African’ as an ethnic group in the 2021 census,https://petition.parliament.uk/petitions/576910,open,118
Fund a memorial monument of all the people that have died from COVID 19,https://petition.parliament.uk/petitions/576933,open,12
Make Covid-19 vaccination available to all outpatients needing surgery,https://petition.parliament.uk/petitions/576949,open,242
Restart driving tests immediately from April 2021,https://petition.parliament.uk/petitions/576966,open,107
Increase funding to ensure all adults in England have access to an NHS dentist,https://petition.parliament.uk/petitions/576982,open,15
Offer breast screenings for cancer to women from the age of 30,https://petition.parliament.uk/petitions/576989,open,25
Ban the advertising of products which are not plant-based and cruelty-free,https://petition.parliament.uk/petitions/576991,open,49
Open all zoos from 8th March 2021,https://petition.parliament.uk/petitions/576999,open,27
Require government ministers who break the law to be removed from post,https://petition.parliament.uk/petitions/577013,open,483
Fund IVF for same sex couples,https://petition.parliament.uk/petitions/577043,open,1321
Require supermarkets to have defibrillators on site,https://petition.parliament.uk/petitions/577044,open,51
New Bank Holiday last Monday of October to celebrate multi-cultural Britain,https://petition.parliament.uk/petitions/577058,open,20
Make it mandatory for social services workers to wear a body camera,https://petition.parliament.uk/petitions/577074,open,647
Make household bonfires illegal,https://petition.parliament.uk/petitions/577087,open,97
Add fruit allergies to allergen requirements for food businesses,https://petition.parliament.uk/petitions/577088,open,31
Change the legal drink drive alcohol limit to ZERO.,https://petition.parliament.uk/petitions/577093,open,13
Prohibit the publication of names of defendants prior to conviction,https://petition.parliament.uk/petitions/577124,open,13
To take Portugal off the travel Red List,https://petition.parliament.uk/petitions/577159,open,25219
Set a date for when non-practical university students can return to campus,https://petition.parliament.uk/petitions/577166,open,2158
Introduce a 'litter tax' on all single-use packaging,https://petition.parliament.uk/petitions/577169,open,322
Require post-1960 light aircraft be fitted with silencers or mufflers,https://petition.parliament.uk/petitions/577198,open,75
Allow university students to return home for the Easter Holiday,https://petition.parliament.uk/petitions/577200,open,49
Grant citizenship to asylum seekers living in the UK for more than 7 years,https://petition.parliament.uk/petitions/577227,open,607
Organise and fund a 6-week 'Summer of Fun' for children and young people,https://petition.parliament.uk/petitions/577275,open,22
"Extend 30 hrs free childcare for 3 & 4 year olds to those earning over £100,000",https://petition.parliament.uk/petitions/577291,open,13
Launch a judge-led public inquiry into the Covid-19 pandemic,https://petition.parliament.uk/petitions/577292,open,6999
Remove the hazard perception from the theory test,https://petition.parliament.uk/petitions/577298,open,6
Create a digital driving licence,https://petition.parliament.uk/petitions/577299,open,13
Add Yoga to the School Curriculum,https://petition.parliament.uk/petitions/577303,open,3085
Prioritise front line workers aged 40+ for COVID-19 vaccination,https://petition.parliament.uk/petitions/577308,open,9
Publish monthly data of Aircraft activity by postcode,https://petition.parliament.uk/petitions/577316,open,38
Stop large public events being held until everyone is offered a COVID-19 vaccine,https://petition.parliament.uk/petitions/577365,open,13
Move May Bank Holiday(s) to June or July after Lockdown restrictions are lifted.,https://petition.parliament.uk/petitions/577379,open,10
"Confirm arrangements for 2022 GCSE, A-level and BTEC exams by summer 2021",https://petition.parliament.uk/petitions/577380,open,20
The 2030 ban on diesel/petrol cars must apply to all fossil fuel hybrid cars too,https://petition.parliament.uk/petitions/577399,open,903
"Reform rules on Ministerial office, the House of Lords and political donations",https://petition.parliament.uk/petitions/577408,open,14
Enact the socio-economic duty in the Equality Act and make EIAs mandatory,https://petition.parliament.uk/petitions/577411,open,13
Provide compensation for flooding caused by former mines,https://petition.parliament.uk/petitions/577414,open,1717
Require the Smokefree National Helpline be on cigarette and tobacco packaging,https://petition.parliament.uk/petitions/577416,open,8
Require Planning Permission for laying of Astroturf Lawns / Artificial Grass,https://petition.parliament.uk/petitions/577436,open,2595
Increase minimum and maximum sentences for all sexual offences,https://petition.parliament.uk/petitions/577443,open,19677
Allow hospitality businesses to reclaim costs of the Digital Services Tax,https://petition.parliament.uk/petitions/577449,open,51
Make the spreading of misinformation about a civil or health crisis an offence,https://petition.parliament.uk/petitions/577457,open,11
"£20pw increase for Disabled and Pensioners, backdated to March 2020",https://petition.parliament.uk/petitions/577472,open,14
Reduce the Easter school holiday to one week,https://petition.parliament.uk/petitions/577483,open,18
Allow museums and galleries to open from 12 April 2021,https://petition.parliament.uk/petitions/577489,open,4075
Increase speed limit of mobility scooters and allow passengers,https://petition.parliament.uk/petitions/577491,open,10
Lateral Flow Test (LFT) made compulsory in Secondary Schools for all.,https://petition.parliament.uk/petitions/577492,open,9
Remove VAT on air pilot training ,https://petition.parliament.uk/petitions/577500,open,364
Create a compensation scheme for remanded prisoners found not guilty,https://petition.parliament.uk/petitions/577516,open,51
Stop the proposed reduction of foreign aid to the Yemen,https://petition.parliament.uk/petitions/577527,open,356
Mandatory community service for litter droppers.,https://petition.parliament.uk/petitions/577555,open,17
Make it legal to carry non-lethal self defence weapons,https://petition.parliament.uk/petitions/577568,open,31654
Make mountain hares a protected species in the Wildlife and Countryside Act 1981,https://petition.parliament.uk/petitions/577569,open,2707
Require all new vans sold in the UK to be factory fitted with a Cat 1 alarm,https://petition.parliament.uk/petitions/577573,open,380
Scrap the compulsory £210 home test kit when arriving in U.K.,https://petition.parliament.uk/petitions/577580,open,43114
Remove the otter’s protected species status,https://petition.parliament.uk/petitions/577582,open,4869
Increase UK aid for Yemen from for 2021 up to £300 million,https://petition.parliament.uk/petitions/577588,open,56
End surveillance of welfare claimants,https://petition.parliament.uk/petitions/577590,open,12
Bring Partner and Spouse Visa Requirements in Line with BNO Visas,https://petition.parliament.uk/petitions/577594,open,7
Fund NHS testing for adults with Dyslexia,https://petition.parliament.uk/petitions/577602,open,18
Stop the importation of honey bees into GB from the EU via Northern Ireland,https://petition.parliament.uk/petitions/577603,open,15624
Phase out the usage of gill nets within UK waters,https://petition.parliament.uk/petitions/577610,open,49
Add funeral mourners to the travel exemption list for testing on days 2 and 8.,https://petition.parliament.uk/petitions/577611,open,28
Make COVID-19 tests during quarantine free or optional,https://petition.parliament.uk/petitions/577612,open,24
Permanently increase Business Rates relief to 100% for all Charity Retail Shops,https://petition.parliament.uk/petitions/577617,open,7
Make the theft of lifesaving equipment an aggravated offence.,https://petition.parliament.uk/petitions/577620,open,446
Make it mandatory for local councils in England to have a weapons amnesty bin.,https://petition.parliament.uk/petitions/577621,open,73
Close the border for horse travel to stop EHV,https://petition.parliament.uk/petitions/577626,open,23
Extend EU Citizens' Deadline to Apply for UK (Pre-) Settled Status till 2023,https://petition.parliament.uk/petitions/577648,open,536
Increase the level of Additional Restrictions Grants for eligible businesses,https://petition.parliament.uk/petitions/577659,open,62
Make psychology a mandatory subject in the secondary school curriculum,https://petition.parliament.uk/petitions/577667,open,59
Introduce new rules for party political campaign material,https://petition.parliament.uk/petitions/577714,open,34
Require local authorities to fund specific domestic abuse services for women,https://petition.parliament.uk/petitions/577718,open,10088
Permanently Abolish Mandatory Foreign Aid target and spend our money at home,https://petition.parliament.uk/petitions/577720,open,246
Bring the fourth SEISS grant payment forward to March,https://petition.parliament.uk/petitions/577730,open,328
Repatriate refugees when their country of origin is safe,https://petition.parliament.uk/petitions/577739,open,4755
Require drivers involved in accidents to contact emergency services immediately,https://petition.parliament.uk/petitions/577742,open,119
Urge the UN to intervene in Myanmar with a peace keeping force,https://petition.parliament.uk/petitions/577765,open,9163
Fund attachment aware and trauma informed training for elected politicians,https://petition.parliament.uk/petitions/577779,open,8
