Petition,URL,State,Signatures Count
Cancel all exams and coursework tasks this academic year,https://petition.parliament.uk/petitions/570192,open,8
"Fund widespread Covid-19 T cell testing, including for those offered vaccination",https://petition.parliament.uk/petitions/570195,open,92
Review freshwater rod fishing bylaws reduce daily limit of course fish taken.,https://petition.parliament.uk/petitions/570198,open,35
Fund more support and awareness for pelvic floor prolapses in women,https://petition.parliament.uk/petitions/570199,open,778
Extend the Victim code 2006 to include Victims of Anti-Social Behaviour,https://petition.parliament.uk/petitions/570205,open,15
Extend validity of UK residents driving with international license by 11 months,https://petition.parliament.uk/petitions/570227,open,50
Prohibit any exams from taking place during the Covid-19 outbreak,https://petition.parliament.uk/petitions/570228,open,724
"Provide free face masks for everyone, and free N95 masks for vulnerable people",https://petition.parliament.uk/petitions/570237,open,28
Offer EU musicians a free 90 day visa to work in the UK,https://petition.parliament.uk/petitions/570306,open,2121
Cancel BTEC summer exams,https://petition.parliament.uk/petitions/570314,open,141
Provide Covid testing kits for private nurseries and early years settings,https://petition.parliament.uk/petitions/570316,open,2202
Exempt people on the autistic spectrum or with ADHD from NHS prescription charge,https://petition.parliament.uk/petitions/570318,open,81
Introduce a mandatory Sex Education GCSE ,https://petition.parliament.uk/petitions/570324,open,26
Revoke HC1043 changes that try to stop refugees from finding safety in the UK,https://petition.parliament.uk/petitions/570329,open,260
Fund costs of replacement consumables for Community Public Access Defibrillators,https://petition.parliament.uk/petitions/570331,open,310
Require the media give retractions equal prominence to the original article,https://petition.parliament.uk/petitions/570341,open,69
Do not charge capital gains tax on cryptoassets,https://petition.parliament.uk/petitions/570346,open,104
Implement Quarantine Hotels for all UK arrivals from overseas.,https://petition.parliament.uk/petitions/570364,open,195
Give family and friends a right to compassionate leave for attending a funeral,https://petition.parliament.uk/petitions/570368,open,8
"Free childcare for 2 year olds, for all parents in higher education",https://petition.parliament.uk/petitions/570374,open,11
Windfall tax on extra profits due to lockdowns to fund a bonus for NHS staff,https://petition.parliament.uk/petitions/570416,open,77
Allow people to take a virtual driving test due to Covid,https://petition.parliament.uk/petitions/570427,open,21
Tell students in advance topics on proposed teacher marked tests.,https://petition.parliament.uk/petitions/570499,open,20
Compulsory to display country of manufacture on all goods at point of sale,https://petition.parliament.uk/petitions/570513,open,2810
Reduce VAT to 5% for the Fitness industry to survive.,https://petition.parliament.uk/petitions/570522,open,180
Extend the expiry date on UK passports due to Coronavirus lockdown,https://petition.parliament.uk/petitions/570528,open,16
Make taxation a compulsory part of the National Curriculum,https://petition.parliament.uk/petitions/570531,open,21
Fund research into additional Covid-19 prevention measures,https://petition.parliament.uk/petitions/570535,open,10
Free prescriptions for transplant patients,https://petition.parliament.uk/petitions/570539,open,1013
Permanently change the examination system - no final exams but a final grade.,https://petition.parliament.uk/petitions/570550,open,368
"All worker's rights to be enforceable after 6 months, not 2 years. ",https://petition.parliament.uk/petitions/570553,open,26
Increase Land Access Rights in England to equal The Land Reform (Scotland) Act,https://petition.parliament.uk/petitions/570555,open,506
Extend any Universal Credit uplifts to legacy benefits,https://petition.parliament.uk/petitions/570558,open,170
Extend Security Industry Authority licences by 12 months due to Covid-19,https://petition.parliament.uk/petitions/570596,open,51
Allow adults who have been driving for 15 years or more to pass learners.,https://petition.parliament.uk/petitions/570618,open,12
Resume tractor driving tests,https://petition.parliament.uk/petitions/570631,open,18
"Reverse the vaccine program, start vaccinate secondary school children up to OAP",https://petition.parliament.uk/petitions/570647,open,19
Simplify new Customs procedures for EU and Ireland freight import / export,https://petition.parliament.uk/petitions/570655,open,191
Temporary ban on jogging on pavements,https://petition.parliament.uk/petitions/570666,open,9
"Make every 29 February a ""leap year day"" Bank Holiday",https://petition.parliament.uk/petitions/570669,open,14
Extend the Unduly Lenient Sentence Scheme to cover death by careless driving,https://petition.parliament.uk/petitions/570693,open,9
Provide grants for energy costs for people who are shielding,https://petition.parliament.uk/petitions/570695,open,25
Require food labels to list 'Carbohydrates per unit' alongside 'Carbs per 100g'.,https://petition.parliament.uk/petitions/570708,open,58
Get the UK's carbon emissions to net-zero by 2040.,https://petition.parliament.uk/petitions/570716,open,44
Extension to the £20 weekly Universal Credit uplift for a minimum of 5 years.,https://petition.parliament.uk/petitions/570735,open,37
Allowing the driving theory test in languages ​​other than English across the UK,https://petition.parliament.uk/petitions/570754,open,530
Allow individuals to present public petitions without the support of an MP,https://petition.parliament.uk/petitions/570761,open,31
Pay 15% bonus to public facing NHS staff,https://petition.parliament.uk/petitions/570762,open,38
"Seek freedom of movement within EU, for Brits living in an EU state before 2021.",https://petition.parliament.uk/petitions/570765,open,44
Prohibit gambling unless individuals are registered members of a gambling shop,https://petition.parliament.uk/petitions/570766,open,92
Allow pets to travel in the UK including Northern Ireland without restriction,https://petition.parliament.uk/petitions/570777,open,33
"Do not give consent for another Scottish Independence Referendum
",https://petition.parliament.uk/petitions/570779,open,111079
Increase the length of the Business Interruption Payment on CBILS.,https://petition.parliament.uk/petitions/570806,open,63
Increase statutory protections for protected trees and listed parks,https://petition.parliament.uk/petitions/570807,open,1777
Review rules for the movement of poultry between GB and NI/RoI,https://petition.parliament.uk/petitions/570817,open,1238
Fund a national public awareness campaign about knife crime,https://petition.parliament.uk/petitions/570825,open,15
Permanently reduce the Lifetime ISA (LISA) withdrawal penalty from 25% to 20%.,https://petition.parliament.uk/petitions/570826,open,20107
Issue grants to landlords for lost rental income due to Covid-19,https://petition.parliament.uk/petitions/570831,open,20
Exclude individual motorcyclists from Coronavirus travel restrictions,https://petition.parliament.uk/petitions/570835,open,1231
Allow Group Exercises Classes to start at the same time gyms are opened,https://petition.parliament.uk/petitions/570839,open,834
"Make female sterilisation available on demand to all women aged 16 and over
",https://petition.parliament.uk/petitions/570850,open,31
Make the G7 Summit in June virtual only,https://petition.parliament.uk/petitions/570867,open,32
Immediate ban on the use of diesel cars and make all public transport free,https://petition.parliament.uk/petitions/570873,open,14
ESA claimants to receive same increase as Universal Credit,https://petition.parliament.uk/petitions/570877,open,210
Make driving theory tests available to take online,https://petition.parliament.uk/petitions/570878,open,282
Review barriers to entry to the police as a result of residing outside the UK,https://petition.parliament.uk/petitions/570881,open,8
"Seek To Join The Schengen Area, To allow UK citizens to travel and work freely.",https://petition.parliament.uk/petitions/570890,open,81
Don't ease the lockdown until at least 60-70% of the population is vaccinated.,https://petition.parliament.uk/petitions/570926,open,29
Introduce a legal right for employees to work remotely,https://petition.parliament.uk/petitions/570934,open,24
Ban the culling of male chicks,https://petition.parliament.uk/petitions/570946,open,65
"Government to establish 'Treasury North' in Teesside, Darlington and Hartlepool",https://petition.parliament.uk/petitions/570947,open,57
Require schools to operate a 4 day week,https://petition.parliament.uk/petitions/570949,open,20
Disallow Teacher Assessed Grades lower than a 5 for 2021 GCSEs and A-Levels,https://petition.parliament.uk/petitions/570955,open,19
Ban Smart Motorways,https://petition.parliament.uk/petitions/570967,open,2164
Ban the use of bots for all online purchase,https://petition.parliament.uk/petitions/570971,open,40
Create a UK Wellbeing and Future Generations Act,https://petition.parliament.uk/petitions/570975,open,9
Create an nationally recognised card for carers,https://petition.parliament.uk/petitions/570980,open,11
Allow families to prevent press reporting of a loved one’s suicide or murder,https://petition.parliament.uk/petitions/570997,open,2273
Allow golf courses to open for golfers playing on their own,https://petition.parliament.uk/petitions/571009,open,57
Seek membership of the Customs Union and Single Market (Norway plus),https://petition.parliament.uk/petitions/571016,open,953
Give unmarried long-term co-habiting couples an automatic right to inherit,https://petition.parliament.uk/petitions/571030,open,152
Provide COVID support package for visual artists.,https://petition.parliament.uk/petitions/571033,open,17
Increase research funding into the use of Ivermectin as a treatment for Covid-19,https://petition.parliament.uk/petitions/571040,open,1192
Consider estate agents for the vaccine before being rolled out to all,https://petition.parliament.uk/petitions/571047,open,52
Public inquiry into why international travel was not suspended due to Covid-19,https://petition.parliament.uk/petitions/571065,open,15
Mandatory testing for hereditary conditions for breeding dogs,https://petition.parliament.uk/petitions/571067,open,100
"Use Centre-Assessed-Grades for the 2021 A-Level, AS Level and GCSE grades.",https://petition.parliament.uk/petitions/571073,open,10
Stop using army barracks/camps to house asylum seekers immediately,https://petition.parliament.uk/petitions/571085,open,498
Hold Welsh referendum to return power to the UK government.,https://petition.parliament.uk/petitions/571087,open,68
Extend the A1/A2 transitional period from 2 years to 5 years,https://petition.parliament.uk/petitions/571102,open,54
Make live feeding of all animals a specific criminal offence,https://petition.parliament.uk/petitions/571128,open,18
Remove the ability of Ministers to “call in” planning decisions,https://petition.parliament.uk/petitions/571135,open,20
Allow outdoor motor sports to reopen during lockdown,https://petition.parliament.uk/petitions/571180,open,12
Create a database of all lost and stolen dogs.,https://petition.parliament.uk/petitions/571192,open,390
"Make displaying a “face covering exempt” sign mandatory, for the rightly exempt",https://petition.parliament.uk/petitions/571203,open,321
Create a Youth Poet Laureate for the UK,https://petition.parliament.uk/petitions/571210,open,26
"Lower tuition fees to a minimum £5,000 for University students during covid-19.",https://petition.parliament.uk/petitions/571221,open,456
Ban the use of plastic 6 pack rings in the UK,https://petition.parliament.uk/petitions/571229,open,3792
Make CCTV compulsory in all taxis including school transport taxis,https://petition.parliament.uk/petitions/571231,open,699
Theory test centres should be considered essential and open during restrictions,https://petition.parliament.uk/petitions/571242,open,6
Ban the manufacture of all products containing plastic in the UK,https://petition.parliament.uk/petitions/571254,open,34
Fund free travel on the Mersey Gateway for people working in Runcorn & Widnes,https://petition.parliament.uk/petitions/571274,open,33
Re-introduce the 2017 Tax relief rules on BTL for landlords with only 1 property,https://petition.parliament.uk/petitions/571300,open,17
Bar entry to the UK to anyone convicted of public disorder offences/incitement,https://petition.parliament.uk/petitions/571302,open,15
Grant full diplomatic status to the ambassador to the UK from the EU,https://petition.parliament.uk/petitions/571307,open,165
"Enhance support for the hospitality, events, leisure and entertainment sectors",https://petition.parliament.uk/petitions/571312,open,557
Make all animal hunting illegal for everyone,https://petition.parliament.uk/petitions/571320,open,40
Apply for the UK to join the EFTA,https://petition.parliament.uk/petitions/571323,open,433
Offer an additional year of SFE funding for students impacted by the pandemic,https://petition.parliament.uk/petitions/571327,open,12
Add parental alienation to the curriculum with mandatory training for teachers,https://petition.parliament.uk/petitions/571340,open,338
Give job candidates a legal entitlement to constructive feedback after interview,https://petition.parliament.uk/petitions/571348,open,41
Seek to re-instate the Marginal VAT scheme between GB & EU on Second Hand Goods,https://petition.parliament.uk/petitions/571356,open,1297
Refund driving theory tests that expire during COVID-19 pandemic,https://petition.parliament.uk/petitions/571379,open,16
Allow all parents studying at university to receive the Child Care Grant (CCG).,https://petition.parliament.uk/petitions/571418,open,35
Create a public register of domestic violence/abuse offenders,https://petition.parliament.uk/petitions/571420,open,613
"No hotel quarantine for UK citizens, permanent residents and their families",https://petition.parliament.uk/petitions/571447,open,15460
Seek to exempt goods purchased online for personal use from import tariffs/taxes,https://petition.parliament.uk/petitions/571460,open,12
Grant Payment To Parents Helping Kids During Home Learning,https://petition.parliament.uk/petitions/571483,open,462
Lift the cap on university places for 2021/22 due to impact of COVID-19,https://petition.parliament.uk/petitions/571513,open,22
Make online pornography illegal and require all pornographic content be removed,https://petition.parliament.uk/petitions/571515,open,36
Ban the use of lead weights in fresh water fishing,https://petition.parliament.uk/petitions/571523,open,92
Make it illegal to sell dogs without a licence,https://petition.parliament.uk/petitions/571526,open,2240
Require local authorities to publish all FOI request replies online,https://petition.parliament.uk/petitions/571527,open,499
The UK Government should not fine parents for taking children on holiday.,https://petition.parliament.uk/petitions/571533,open,23
Hold a general election in 2021,https://petition.parliament.uk/petitions/571548,open,27
Cancel the school 20/21 year for primary pupils.  Repeat the years in 21/22.,https://petition.parliament.uk/petitions/571550,open,14
"Subsidise household energy costs, during Stay at Home restrictions",https://petition.parliament.uk/petitions/571555,open,43
Change the date that the clocks go forward to Saturday 13th February 2021,https://petition.parliament.uk/petitions/571563,open,7
Increase local authority funding to pay for increase in pay for social workers,https://petition.parliament.uk/petitions/571609,open,256
Allow socially distanced golf for those who have had vaccination,https://petition.parliament.uk/petitions/571635,open,11
Public inquiry into sentencing for child sexual offences,https://petition.parliament.uk/petitions/571641,open,15
Extend the 2 years post-study work visas to 2020 Graduates,https://petition.parliament.uk/petitions/571665,open,1361
Do not enforce mandatory hotel quarantines for international arrivals.,https://petition.parliament.uk/petitions/571682,open,137
Make fines proportionate to income,https://petition.parliament.uk/petitions/571685,open,19
Get rid of the theory test for learner drivers.,https://petition.parliament.uk/petitions/571699,open,7
Require all teachers and TAs to have basic mental health training,https://petition.parliament.uk/petitions/571704,open,23
Require all delivery drivers to use electric vehicles by 2025,https://petition.parliament.uk/petitions/571719,open,15
"To raise the minimum wage for under-18s, to £5.50 or above",https://petition.parliament.uk/petitions/571733,open,23
Change law so that any and all poison or means to kill wild rodents is humane,https://petition.parliament.uk/petitions/571764,open,93
"ALL GCSEs to be optional not compulsory,  allowing equal value to ALL subjects",https://petition.parliament.uk/petitions/571771,open,23
Scrap national exams for Key Stage 4 permanently,https://petition.parliament.uk/petitions/571777,open,25
Require all military sexual assault claims be handled by civilian police,https://petition.parliament.uk/petitions/571811,open,330
Change the title of Special  Schools to Support Schools.,https://petition.parliament.uk/petitions/571855,open,17
Ensure any Assisted Dying Bill includes people suffering with dementia,https://petition.parliament.uk/petitions/571862,open,7
Extend all consumer rights law to private sellers purporting to be businesses,https://petition.parliament.uk/petitions/571871,open,87
Allow interest and charges as a capital expense for sole trader landlords.,https://petition.parliament.uk/petitions/571906,open,31
Fund increased support for people with eating disorders,https://petition.parliament.uk/petitions/571913,open,2676
Seek continued participation in the European Solidarity Corps,https://petition.parliament.uk/petitions/571938,open,480
Remove restrictions on motorcycle training (CBT Course) for critical workers.,https://petition.parliament.uk/petitions/571950,open,61
Make additional funding available for care of dementia patients,https://petition.parliament.uk/petitions/571957,open,19
Adopt a Zero Covid strategy - full lockdown and close borders,https://petition.parliament.uk/petitions/571965,open,5180
Change the two year NQT induction period back to one year.,https://petition.parliament.uk/petitions/571969,open,69
Do not fully re-open schools until all indoor mixing is safe to be resumed,https://petition.parliament.uk/petitions/571980,open,1220
Require petrol stations to have a pay at pump option,https://petition.parliament.uk/petitions/572010,open,13
Ban circumcision at birth unless this risks health of the child,https://petition.parliament.uk/petitions/572020,open,85
Increase funding for flood defences for East Anglia,https://petition.parliament.uk/petitions/572026,open,2016
Extend Help to buy Equity Loan Scheme 2013-2021 deadline due to Covid-19,https://petition.parliament.uk/petitions/572050,open,30
Ban the sale of hamster cages under the size of 620sq inches.,https://petition.parliament.uk/petitions/572052,open,3125
Put a price cap on electric car charging,https://petition.parliament.uk/petitions/572068,open,12
Allow schools to decide what meals they provide,https://petition.parliament.uk/petitions/572070,open,150
Outlaw Smartphones for all under 16's.,https://petition.parliament.uk/petitions/572092,open,8
Do not reduce funding for higher education courses such as media studies,https://petition.parliament.uk/petitions/572094,open,23
Provide emergency funding to safeguard anti-locust operations in East Africa,https://petition.parliament.uk/petitions/572109,open,23
Make the catering at the Glasgow 2021 UN Climate Change Conference plant-based,https://petition.parliament.uk/petitions/572112,open,1456
Allow couples to give notice and marry/civil partnership over video conference,https://petition.parliament.uk/petitions/572121,open,55
Reduce import VAT on Second Hand Goods to 5% the same as Art and Collectables,https://petition.parliament.uk/petitions/572127,open,4761
Keep the £20pw Universal Credit lifeline and extend to those on legacy benefits,https://petition.parliament.uk/petitions/572128,open,11807
Make gazumping illegal in England,https://petition.parliament.uk/petitions/572136,open,125
Allow driving instructors to continue to use simplified expenses on tax returns.,https://petition.parliament.uk/petitions/572138,open,172
Allow zoos and safari parks to open with social distancing measures in place,https://petition.parliament.uk/petitions/572139,open,11
Stop deducting Tax and NI from our NHS workers.,https://petition.parliament.uk/petitions/572153,open,10
Require dog grooming businesses to close and extend grants to these businesses,https://petition.parliament.uk/petitions/572159,open,25
Delay ban on coal and increase funding for transition for those reliant on coal,https://petition.parliament.uk/petitions/572169,open,3894
Make leaving dogs unattended outside shops illegal,https://petition.parliament.uk/petitions/572171,open,20
Tuition Fee Compensation for International Students in UK Universities,https://petition.parliament.uk/petitions/572202,open,34752
"To establish a National Social Care Service, funded through general taxation.",https://petition.parliament.uk/petitions/572206,open,457
Reverse decision to close legal routes for unaccompanied minors seeking asylum,https://petition.parliament.uk/petitions/572209,open,134
Fund training and resources for GPs for Binge Eating Disorder,https://petition.parliament.uk/petitions/572211,open,11
Set a target for 100% renewable energy by 2022,https://petition.parliament.uk/petitions/572218,open,19
Disability changing facilities and decent access in all venues to be law.,https://petition.parliament.uk/petitions/572230,open,98
Release ALL Enhanced prisoners temporarily because of Covid-19,https://petition.parliament.uk/petitions/572245,open,16
Make feeding horses/ponies and livestock a specific criminal offence,https://petition.parliament.uk/petitions/572266,open,8950
Tax reduction/reimbursement for all people working during lockdown,https://petition.parliament.uk/petitions/572273,open,32
Extend the VAT at 5% for hospitality until at least March 2022,https://petition.parliament.uk/petitions/572283,open,17560
Make misogyny and sexism a hate crime,https://petition.parliament.uk/petitions/572287,open,226
Parental rights should be lost if you don't contact your child for a year.,https://petition.parliament.uk/petitions/572289,open,10
Ban communal changing rooms,https://petition.parliament.uk/petitions/572290,open,33
Do not cut UK higher education Arts Funding,https://petition.parliament.uk/petitions/572300,open,45
Base fines for Covid restriction violations on individuals' incomes,https://petition.parliament.uk/petitions/572308,open,12
"Have schools reopen after February half term, in England, as promised.",https://petition.parliament.uk/petitions/572322,open,216
Free prescriptions for all asthma sufferers,https://petition.parliament.uk/petitions/572323,open,86
Make March 23rd an annual National COVID Memorial day from 2022,https://petition.parliament.uk/petitions/572335,open,980
Physical proof of Pre/Settled status for EU nationals in UK,https://petition.parliament.uk/petitions/572353,open,419
Trespassing should be criminal offense.,https://petition.parliament.uk/petitions/572367,open,19
Temporary sweetheart visas for unmarried partners of UK residents from overseas,https://petition.parliament.uk/petitions/572369,open,127
Allow children to retake the school year to catch-up,https://petition.parliament.uk/petitions/572383,open,72
Trees planted in the grounds of every new home and to be maintained by law,https://petition.parliament.uk/petitions/572398,open,72
"Require companies to report on Environment, Social and Governance factors",https://petition.parliament.uk/petitions/572400,open,12
Don’t re-open schools until September,https://petition.parliament.uk/petitions/572418,open,32
Don’t re-open schools until all staff have been vaccinated,https://petition.parliament.uk/petitions/572419,open,41
Raise the Universal Credit allowance for over 18s to match people aged 25 & over,https://petition.parliament.uk/petitions/572422,open,13
Reduce higher rate income tax from 40% to 30% for income under £100k,https://petition.parliament.uk/petitions/572429,open,57
Allow Couples To Get Married During Lockdown (+Tier 3/4) & Allow 8 To Attend,https://petition.parliament.uk/petitions/572432,open,109
"Allow schools, universities, restaurants and shops to open in March",https://petition.parliament.uk/petitions/572449,open,62
Increase funding for NHS transgender services,https://petition.parliament.uk/petitions/572455,open,10637
Mandatory dog training and “How to be a responsible owner” courses,https://petition.parliament.uk/petitions/572467,open,98
Fund means-tested broadband for low income households,https://petition.parliament.uk/petitions/572476,open,17
"Make it compulsory to submit ID on social
media to help end online abuse.",https://petition.parliament.uk/petitions/572480,open,67
Allow weddings for couples who can't live together for religious reasons,https://petition.parliament.uk/petitions/572508,open,251
Do not require deed polls to be enrolled to serve as a proof of name change,https://petition.parliament.uk/petitions/572534,open,47
"Deposit scheme on  glass, plastic, steel, aluminium bottles and cans.",https://petition.parliament.uk/petitions/572535,open,35
Publish in full online ALL publicly funded contracts with private providers.,https://petition.parliament.uk/petitions/572549,open,165
Place Defibrillators and handheld Face pumps into all schools.,https://petition.parliament.uk/petitions/572576,open,45
