Petition,URL,State,Signatures Count
"Allow all hospitality to open for mobile key workers. 
",https://petition.parliament.uk/petitions/562660,open,14
Run an awareness campaign on cycle paths and sharing the highway with cyclists ,https://petition.parliament.uk/petitions/562667,open,26
Devolve broadcasting and regulation of the media to the Welsh Government,https://petition.parliament.uk/petitions/562676,open,835
Put in place law restricting domestic cats from free-roaming,https://petition.parliament.uk/petitions/562684,open,29
Prioritise vaccinations for people with a learning disability,https://petition.parliament.uk/petitions/562694,open,26093
Publish the security evaluation outcomes of ALL 5G venders.,https://petition.parliament.uk/petitions/562695,open,166
Extend the Animal Welfare Act to protect all animals including invertebrates,https://petition.parliament.uk/petitions/562697,open,139
Do not scrap the Fixed-term Parliaments Act 2011,https://petition.parliament.uk/petitions/562728,open,23
Take back responsibility for funding free licences for over 75s from the BBC,https://petition.parliament.uk/petitions/562729,open,11506
Hold a public inquiry into the use of DNACPR orders during the Covid-19 outbreak,https://petition.parliament.uk/petitions/562740,open,164
Make it compulsory for councils to scan deceased animals found on road side,https://petition.parliament.uk/petitions/562742,open,87
Fund preventative mental health sessions in schools and workplaces,https://petition.parliament.uk/petitions/562785,open,964
Require Licenses to Keep Chameleons,https://petition.parliament.uk/petitions/562788,open,320
Make service providers of telecoms responsible for financial loss through fraud,https://petition.parliament.uk/petitions/562797,open,12
Teach Health and Social Care as a compulsory KS3 subject,https://petition.parliament.uk/petitions/562802,open,9
"Grade GCSEs and A-levels on coursework, with no exams, from 2021 onwards",https://petition.parliament.uk/petitions/562814,open,87
Keep the £20 a week UC increase for 1 more year,https://petition.parliament.uk/petitions/562816,open,439
Make access to food a legal right - no one in the UK should go hungry,https://petition.parliament.uk/petitions/562838,open,47458
Increase tax on private flights,https://petition.parliament.uk/petitions/562841,open,32
Reduce working time required for rest breaks ,https://petition.parliament.uk/petitions/562848,open,23
Make frontline NHS health workers top priority for Covid-19 vaccination,https://petition.parliament.uk/petitions/562854,open,1497
Give recent graduates the option to bubble with their families during Covid-19,https://petition.parliament.uk/petitions/562860,open,12
Fund a nationwide programme of tunnel building under main roads ,https://petition.parliament.uk/petitions/562884,open,19
Make Media Studies a compulsory subject in UK schools (from an early age).,https://petition.parliament.uk/petitions/562911,open,24
Ban plastics in schools,https://petition.parliament.uk/petitions/562920,open,21
Abolish the Dangerous Dogs Act,https://petition.parliament.uk/petitions/562925,open,135
Make Universal Credit accessible for Students that lost their jobs due to COVID,https://petition.parliament.uk/petitions/562929,open,37
Fund GPs to offer annual testicular cancer checks,https://petition.parliament.uk/petitions/562948,open,24
Reform housing and immigration system to address racial inequalities,https://petition.parliament.uk/petitions/562986,open,133
Automatic British Citizenship for UK Military Service by non British Nationals,https://petition.parliament.uk/petitions/563016,open,641
Reimburse cost of VAT on materials and expenses to all PPE supplied free to NHS,https://petition.parliament.uk/petitions/563023,open,2859
Allow indoor theatre and live events in Tier 3 areas if they are covid-secure!,https://petition.parliament.uk/petitions/563047,open,14
Create a rent Cap law for London  Similar to the Berlin and Barcelona examples,https://petition.parliament.uk/petitions/563051,open,51
"Make it unlawful to require titular gender/marital status (Mr, Mrs, Miss, Ms)",https://petition.parliament.uk/petitions/563055,open,47
Abolish requiring local authorities to consult Parish Councils for planning.,https://petition.parliament.uk/petitions/563076,open,12
Fund free TV access for NHS hospital patients,https://petition.parliament.uk/petitions/563086,open,33
Regulate and licence all retired greyhound kennel premises,https://petition.parliament.uk/petitions/563089,open,22253
Exempt CO2 neutral Efuel & other cleaner fuel cars from 2030 petrol & diesel ban,https://petition.parliament.uk/petitions/563118,open,984
Help the Rohingya refugees by pressuring Bangledeshi Government,https://petition.parliament.uk/petitions/563119,open,59
Fund adrenoleukodystrophy (ALD) screening for children at birth.,https://petition.parliament.uk/petitions/563123,open,6677
Allow shisha bars to operate in Tiers 1 & 2,https://petition.parliament.uk/petitions/563152,open,136
Ban non biodegradable chewing/bubble gum from being sold in the UK,https://petition.parliament.uk/petitions/563157,open,140
Permit remote learning surrounding relaxed Covid rule periods.,https://petition.parliament.uk/petitions/563168,open,22
Fund a public awareness campaign that cycling on the pavement is illegal,https://petition.parliament.uk/petitions/563185,open,9
Reintroduce Capital Punishment for Crimes Against Humanity,https://petition.parliament.uk/petitions/563198,open,53
Increase sentences relating to knife crime,https://petition.parliament.uk/petitions/563199,open,9027
Change the NHS Learning Support Fund to include Nursing Associate Students.,https://petition.parliament.uk/petitions/563217,open,162
Abolish income tax for under-18s,https://petition.parliament.uk/petitions/563247,open,13
Stop allowing prisoners to be released before the end of their sentence,https://petition.parliament.uk/petitions/563263,open,335
Revoke 23rd September date so redundancies before can be re-hired & furloughed,https://petition.parliament.uk/petitions/563267,open,22
Seek Europe-wide Visa-free work permit for Touring professionals and Artists,https://petition.parliament.uk/petitions/563294,open,285913
Prioritise BAME communities for the COVID-19 vaccine ,https://petition.parliament.uk/petitions/563297,open,196
Change the law so that Independent Trusts are regulated,https://petition.parliament.uk/petitions/563299,open,56
"Work with the French Government, to protect/save international rail travel.",https://petition.parliament.uk/petitions/563302,open,1075
Ongoing 100% business rate relief for all Early Years settings in England,https://petition.parliament.uk/petitions/563306,open,2223
Fund Fibreoptic internet cable for every house in England,https://petition.parliament.uk/petitions/563308,open,21
MPs to wear facemasks in debating chamber unless they are speaking,https://petition.parliament.uk/petitions/563311,open,28
Introduce mandatory registration of white goods to improve product recalls,https://petition.parliament.uk/petitions/563331,open,18
Enact law for visiting rights for designated relatives of care home residents,https://petition.parliament.uk/petitions/563332,open,1695
Review the Care Leaver Strategy and implement opportunity-based changes.,https://petition.parliament.uk/petitions/563338,open,27
Increase the age for a UK dependent visa to 21,https://petition.parliament.uk/petitions/563341,open,10
Require proof of vaccination to work in care homes and healthcare,https://petition.parliament.uk/petitions/563353,open,142
We should increase the pay of our NHS staff by 25%.,https://petition.parliament.uk/petitions/563356,open,76
The Government should explore options to make NurOwn available for MND,https://petition.parliament.uk/petitions/563367,open,93
Increase funding for aftercare support for people with eating disorders,https://petition.parliament.uk/petitions/563369,open,90
Stop work on HS2 immediately and hold a new vote to repeal the legislation,https://petition.parliament.uk/petitions/563380,open,153681
Put a permanent stop to Tier 2 visas for migrant workers,https://petition.parliament.uk/petitions/563390,open,19
Bring Public Sector Jobs To Bradford,https://petition.parliament.uk/petitions/563400,open,513
Reform military joining standards in relation to historic medical conditions,https://petition.parliament.uk/petitions/563415,open,26
Stop private medical insurance premiums from being a taxable benefit,https://petition.parliament.uk/petitions/563437,open,11
Close schools in areas of tier 3,https://petition.parliament.uk/petitions/563445,open,50
Protect the title of Sonographer.,https://petition.parliament.uk/petitions/563461,open,1706
Require the Union Flag to be flown on public buildings and schools!,https://petition.parliament.uk/petitions/563467,open,5658
Urge the Indian Government to ensure safety of protestors & press freedom,https://petition.parliament.uk/petitions/563473,open,116300
Prioritise 18-25s & people at high risk get covid vaccination first,https://petition.parliament.uk/petitions/563476,open,27
Help fund local hospices!,https://petition.parliament.uk/petitions/563497,open,14
Require regulation of dog swimming pools.,https://petition.parliament.uk/petitions/563508,open,119
Impose trade sanctions on countries which have introduced anti-LGBT legislation,https://petition.parliament.uk/petitions/563509,open,57
"Introduce a ""France style""  repair and longevity label on electronic products.",https://petition.parliament.uk/petitions/563523,open,48
Allow all employees to have furlough calculated using the new minimum wage.,https://petition.parliament.uk/petitions/563524,open,66
Provide DNA sequencing of urine cultures on the NHS,https://petition.parliament.uk/petitions/563531,open,14
Make it illegal for employers to discriminate on the basis of appearance,https://petition.parliament.uk/petitions/563540,open,38
Introduce a statutory bereavement policy into primary and secondary schools.,https://petition.parliament.uk/petitions/563542,open,1813
Reopen the RoATP for new Employer Provider Applications,https://petition.parliament.uk/petitions/563546,open,7
Properties that have had an offer excepted will have the STLD holiday honoured,https://petition.parliament.uk/petitions/563565,open,112
Allow stamp duty relief for any property which exchanged by the end of March,https://petition.parliament.uk/petitions/563568,open,18
Fund improved online education by schools and colleges due to Covid-19,https://petition.parliament.uk/petitions/563573,open,21
Review how domestic abuse cases are investigated and prosecuted.,https://petition.parliament.uk/petitions/563602,open,2584
Legally recognise Emotional Support Animals (ESAs) ,https://petition.parliament.uk/petitions/563612,open,698
Expedite the Covid-19 vaccination of terminally ill patients,https://petition.parliament.uk/petitions/563620,open,147
Reform the law so that drug addicts are not criminalised,https://petition.parliament.uk/petitions/563628,open,26
Preserve diverse and mature woodlands in view of climate change.,https://petition.parliament.uk/petitions/563636,open,85
Provide disadvantaged children with a connected laptop to access home learning,https://petition.parliament.uk/petitions/563639,open,165
Include Punjabi as an ethnicity option on Government documents,https://petition.parliament.uk/petitions/563651,open,233
Offer Indefinite Leave to Remain to all NHS and social care workers,https://petition.parliament.uk/petitions/563652,open,15768
Make it easier to become a deputy for a person with severe learning disabilities,https://petition.parliament.uk/petitions/563685,open,465
Increase minimum and maximum sentences for pet theft,https://petition.parliament.uk/petitions/563711,open,4530
Make Strangles a Notifiable Disease,https://petition.parliament.uk/petitions/563745,open,361
Stop the funding cut for salaried route into primary teaching,https://petition.parliament.uk/petitions/563789,open,27
"Lift restrictions on all social gatherings such as proms, graduations, weddings",https://petition.parliament.uk/petitions/563793,open,203
Fund a national awareness campaign about the COVID vaccines,https://petition.parliament.uk/petitions/563804,open,28
Do not start mass testing in schools or require asymptomatic students to isolate,https://petition.parliament.uk/petitions/563806,open,20070
Require sentences for sexual offences to be served consecutively,https://petition.parliament.uk/petitions/563841,open,719
Introduce Dog Licensing and Registration,https://petition.parliament.uk/petitions/563854,open,326
Grant wraparound and holiday care providers urgent financial support,https://petition.parliament.uk/petitions/563892,open,11318
Keep gyms open during Tier 4 lockdown,https://petition.parliament.uk/petitions/563904,open,180130
Urge the US Government to stop January federal executions,https://petition.parliament.uk/petitions/563926,open,18
Fund additional mental health support services for university students,https://petition.parliament.uk/petitions/563936,open,2342
Send UK aid to the islands of Fiji.,https://petition.parliament.uk/petitions/563938,open,22
Continue the ban on the use of Neonicotinoids,https://petition.parliament.uk/petitions/563943,open,90259
Move Leeds to tier 2 for Christmas,https://petition.parliament.uk/petitions/563950,open,8
Set future dates for national lockdown circuit breakers.,https://petition.parliament.uk/petitions/563952,open,14
Work to establish a global Severance Guarantee Fund for clothing supply chains,https://petition.parliament.uk/petitions/563954,open,16
Make temperature checks mandatory in all shops.,https://petition.parliament.uk/petitions/563955,open,20
Extra Bank Holiday when Covid restrictions are finally lifted,https://petition.parliament.uk/petitions/563958,open,64
Remove restaurant & pub closures & relax rules on the hospitality industry.,https://petition.parliament.uk/petitions/563959,open,54
Don't criminalise paying for sex. ,https://petition.parliament.uk/petitions/563987,open,7305
Ensure schools get additional staff and facilities for in school covid testing,https://petition.parliament.uk/petitions/563990,open,224
Make Emotional and Psychological Abuse of Children a Specific criminal Offence,https://petition.parliament.uk/petitions/563997,open,831
Make it compulsory for all ages to wear cycle helmets,https://petition.parliament.uk/petitions/563998,open,96
Support the proposal to suspend patents for COVID-19 vaccines,https://petition.parliament.uk/petitions/564005,open,3590
Lower the cost of British Citizenship applications to £372.,https://petition.parliament.uk/petitions/564011,open,20514
Employers to pay for employee's break times.,https://petition.parliament.uk/petitions/564047,open,28
Dangerous Drivers must be banned for Life automatically. Make roads Safer,https://petition.parliament.uk/petitions/564069,open,31
Ban Brazilian Butt Augmentations,https://petition.parliament.uk/petitions/564075,open,10
Give people on the autistic spectrum the opportunity to join the armed forces,https://petition.parliament.uk/petitions/564082,open,29
Ban local councils from charging for rubble and diy waste materials,https://petition.parliament.uk/petitions/564097,open,33
Require a licence to buy pet rodents to ensure appropriate care,https://petition.parliament.uk/petitions/564114,open,122
Fund Vitamin D Public Health Campaign - Raise awareness to BAME & at risk groups,https://petition.parliament.uk/petitions/564133,open,1302
Increase the DWP Christmas bonus for benefit claimants in line with inflation,https://petition.parliament.uk/petitions/564140,open,77
Under 16 smartphone ban,https://petition.parliament.uk/petitions/564143,open,15
Free Laser Eye Surgery for curable eyesight conditions NHS,https://petition.parliament.uk/petitions/564144,open,24
Independent review of the NHS dental contract,https://petition.parliament.uk/petitions/564154,open,10934
"Prioritise COVID-19 vaccines for first responders (police, fire, ambulance)",https://petition.parliament.uk/petitions/564155,open,68736
Close the borders until coronavirus is defeated,https://petition.parliament.uk/petitions/564165,open,2533
Christmas in July - 2 extra days off on Friday 23rd and Monday 26th July 2021,https://petition.parliament.uk/petitions/564171,open,303
Create UK Bank Holidays on 25th and 28th June 2021 in lieu of Christmas 2020,https://petition.parliament.uk/petitions/564183,open,146
Allow Christmas meets for up to 6 households for 5 days 23rd - 27th 2020,https://petition.parliament.uk/petitions/564201,open,14
Reinstate the 5-day relaxation of COVID restrictions over Christmas,https://petition.parliament.uk/petitions/564204,open,31
Close schools in Tier 4 areas,https://petition.parliament.uk/petitions/564209,open,194799
Require negative covid test to enter the UK,https://petition.parliament.uk/petitions/564229,open,50216
"Restore Pre-Decimalisation Pounds, Shillings, and Pence Currency (£sd) System",https://petition.parliament.uk/petitions/564233,open,19
Remove exemptions for places of worship during lockdown and future restrictions,https://petition.parliament.uk/petitions/564236,open,118
"Allow Christmas celebrations on either the 24th, 25th or 26th December",https://petition.parliament.uk/petitions/564244,open,463
Add Height and Weight to The Equality Act 2010,https://petition.parliament.uk/petitions/564247,open,46
Move Christmas to 25th February 2021,https://petition.parliament.uk/petitions/564250,open,9
Fund driving theory resits caused by coronavirus restrictions.,https://petition.parliament.uk/petitions/564297,open,89
Allow families to have Christmas day together in all tiers,https://petition.parliament.uk/petitions/564312,open,219
Close schools and colleges in areas under tier 4,https://petition.parliament.uk/petitions/564318,open,88
Align Coercive Control and Self-Defence to Create a New Defence to Murder,https://petition.parliament.uk/petitions/564322,open,306
Allow driving tests and lessons to continue in Tier 4,https://petition.parliament.uk/petitions/564326,open,5613
"After the vaccine roll-out to high risk groups, remove ALL covid-19 restrictions",https://petition.parliament.uk/petitions/564347,open,11636
Creation of a temporary bank holiday.,https://petition.parliament.uk/petitions/564363,open,12
"Close down Hardware, DIY Stores and Garden centres in Tier 4 areas",https://petition.parliament.uk/petitions/564366,open,114
Allow couples to get married in tier 4 with only two witnesses.,https://petition.parliament.uk/petitions/564368,open,247
Allow existing and planned weddings for all in tier 4 to go ahead.,https://petition.parliament.uk/petitions/564376,open,41
Exempt the terminally ill from Covid restrictions on household mixing.,https://petition.parliament.uk/petitions/564387,open,929
Do not deduct carers allowance pound for pound as its not work!,https://petition.parliament.uk/petitions/564403,open,109
Government to provide 5 day notice of changes to COVID19 restrictions,https://petition.parliament.uk/petitions/564420,open,10
Recall Parliament now to scrutinise new Christmas coronavirus restrictions,https://petition.parliament.uk/petitions/564421,open,12264
Urge Sri Lanka to allow the burial of Covid victims to respect religious beliefs,https://petition.parliament.uk/petitions/564427,open,6071
Consider setting pension age in line with life expectancy,https://petition.parliament.uk/petitions/564432,open,71
Add Tier 4 areas as a priority in the Covid-19 vaccine rollout plan,https://petition.parliament.uk/petitions/564437,open,12
Make it an offence for retailers to ask customers to remove their face covering,https://petition.parliament.uk/petitions/564451,open,10
Increase funding for public transport to make it cheaper than private transport,https://petition.parliament.uk/petitions/564454,open,50
Revoke the 29 day notice period for weddings rearranged due to Covid,https://petition.parliament.uk/petitions/564455,open,16
All key workers  to be higher up the list for coronavirus vaccine,https://petition.parliament.uk/petitions/564466,open,7907
Create extra bank holidays to make up for those that took place under COVID.,https://petition.parliament.uk/petitions/564471,open,20
Defer Christmas & Boxing Day holidays of 2020 to summer of 2021,https://petition.parliament.uk/petitions/564476,open,58
Allow dog grooming within all tiers and any future lockdown,https://petition.parliament.uk/petitions/564490,open,1070
Extra bank holiday next Christmas to make up for this Christmas (Covid 19),https://petition.parliament.uk/petitions/564505,open,23
Promptly create an awareness campaign detailing effects of COVID19 on children.,https://petition.parliament.uk/petitions/564509,open,3087
"Increase funding to the NHS to recruit enough staff, fund beds and equipment",https://petition.parliament.uk/petitions/564512,open,46
Request a short term extension to the Brexit transition period,https://petition.parliament.uk/petitions/564523,open,24
Create legislation to prevent COVID-19 & vaccine misinformation on social media,https://petition.parliament.uk/petitions/564524,open,822
Publish vaccination numbers by priority category and UK areas,https://petition.parliament.uk/petitions/564526,open,63
Keep estate agents closed in tier 4 and lockdowns,https://petition.parliament.uk/petitions/564530,open,4250
Give babies of 2020 the chance of free nursery hours,https://petition.parliament.uk/petitions/564537,open,150
Include Endometriosis and PCOS to the Secondary National Curriculum,https://petition.parliament.uk/petitions/564549,open,2857
Fund the provision of more allotment sites,https://petition.parliament.uk/petitions/564572,open,1630
Ban non-medical professionals from giving injections for aesthetic procedures,https://petition.parliament.uk/petitions/564579,open,1638
Recognise trained footwear fitters as providers of healthcare support services,https://petition.parliament.uk/petitions/564580,open,423
Increase funding for urgent research into devastating motor neurone disease,https://petition.parliament.uk/petitions/564582,open,104737
Close UK Airports for Commercial Travel,https://petition.parliament.uk/petitions/564592,open,83
"Set a 5-year plan to lead the UK to self-sustainability, less reliance on others",https://petition.parliament.uk/petitions/564594,open,23
Require GP’s to complete health assessment forms for voluntary roles for free.,https://petition.parliament.uk/petitions/564600,open,36
Increase funding for 'under cover' outdoor sports facilities during wet weather,https://petition.parliament.uk/petitions/564607,open,9
"Allow all UK Citizens to pay ""Home fee status"" university fees  after Dec 2020",https://petition.parliament.uk/petitions/564612,open,42
Review plans for a Category C prison at Full Sutton,https://petition.parliament.uk/petitions/564623,open,1284
Mandatory reporting by health professionals of drivers with health conditions.,https://petition.parliament.uk/petitions/564630,open,12
Close all schools until after February half-term to stop the spread of Covid-19,https://petition.parliament.uk/petitions/564640,open,476
Review the use of forceps in the delivery of babies,https://petition.parliament.uk/petitions/564653,open,535
"Keep all indoor fitness facilities open in all tiers, including tier 4",https://petition.parliament.uk/petitions/564667,open,176
Create an extra bank holiday at Easter 2021 to let people make up for Xmas,https://petition.parliament.uk/petitions/564669,open,13
Abolish time limits for legal cases involving pensions,https://petition.parliament.uk/petitions/564683,open,14
Increase the number of Bank Holidays/Public Holidays ,https://petition.parliament.uk/petitions/564695,open,40
Cancel GCSE and A-levels in 2021 replace with Course Work and Teacher Assessment,https://petition.parliament.uk/petitions/564696,open,157701
Enable legal recognition of people helping someone with financial transactions,https://petition.parliament.uk/petitions/564701,open,951
Fund refunds for people who were unable to travel in Tier 4,https://petition.parliament.uk/petitions/564732,open,8
Ban rollout of vaccines where manufacturer has been indemnified from liability,https://petition.parliament.uk/petitions/564743,open,4784
Create a “PHS (Pet Health Service)” Scheme paid for by pet owners,https://petition.parliament.uk/petitions/564754,open,24
Make regular Covid-19 testing available to all fire fighters,https://petition.parliament.uk/petitions/564759,open,44
Replace votes in the House of Commons with public votes using a voting app,https://petition.parliament.uk/petitions/564773,open,39
Extend the Furlough Support Scheme to include new hires after 30th October.,https://petition.parliament.uk/petitions/564785,open,6612
Offer citizenship to key workers that already have a settled status,https://petition.parliament.uk/petitions/564791,open,369
Extend rights to Indefinite Leave to Remain for non-UK NHS workers,https://petition.parliament.uk/petitions/564809,open,712
Include public transport workers in priority groups for covid 19 vaccination,https://petition.parliament.uk/petitions/564819,open,12328
Issue a US-style Covid-19 payment to support individuals and stimulate economy,https://petition.parliament.uk/petitions/564824,open,38
Allow all non-UK NHS workers to become UK citizens for free,https://petition.parliament.uk/petitions/564829,open,266
Complete the changeover to the metric system,https://petition.parliament.uk/petitions/564845,open,256
Extend CJRS cut-off so employers can claim furlough payments for new employees,https://petition.parliament.uk/petitions/564852,open,404
Introduce licences that are required to set up social media accounts,https://petition.parliament.uk/petitions/564882,open,22
Decide now to make the 2021 elections all-postal whilst there is still time,https://petition.parliament.uk/petitions/564891,open,31
