Petition,URL,State,Signatures Count
Require practical GCSEs to involve practical work that contributes to the grade.,https://petition.parliament.uk/petitions/329523,open,11
Review Social Services and set up an independent body to review complaints,https://petition.parliament.uk/petitions/574372,open,13
Increase the HMRC Mileage Rate from 45p/mile to 60p/mile,https://petition.parliament.uk/petitions/600966,open,38137
Mandate standard fuel be ethanol-free & allow lower VAT for fuel with ethanol,https://petition.parliament.uk/petitions/604051,open,17
Fund free childcare for all from 3 months to school age,https://petition.parliament.uk/petitions/604838,open,24
Abolish liquid restrictions for operating aircrew passing security,https://petition.parliament.uk/petitions/605222,open,682
Create a national pass for people with diagnosed hidden disabilities,https://petition.parliament.uk/petitions/605552,open,84
Increase funding to ensure all adults in England have access to an NHS dentist,https://petition.parliament.uk/petitions/605814,open,318
Extend ban on smoking in indoor public places to e-cigarettes and fund research,https://petition.parliament.uk/petitions/606054,open,25
Make local authorities responsible for providing lorry parking,https://petition.parliament.uk/petitions/606082,open,37
Make 'outing' someone's sexuality and/or gender identity a criminal offence.,https://petition.parliament.uk/petitions/606120,open,91
Prevent schools from being able to discriminate against transgender pupils,https://petition.parliament.uk/petitions/606146,open,86
Fund graves for babies regardless of gestational age,https://petition.parliament.uk/petitions/606172,open,354
Government to Give More Power to SFO to Investigate All Financial Institutions,https://petition.parliament.uk/petitions/606376,open,13
Revoke Development Consent for the Riverside Energy Park in SE London,https://petition.parliament.uk/petitions/606479,open,208
Scrap testing requirements for international travel for vaccinated travellers,https://petition.parliament.uk/petitions/606524,open,10
Mandatory training on mental health in all workplaces,https://petition.parliament.uk/petitions/606539,open,18
Allow TV Licence payers to make voluntary additional payments,https://petition.parliament.uk/petitions/606548,open,30
Require all teachers to be trained in supporting children with special needs,https://petition.parliament.uk/petitions/606554,open,297
Subsidise energy prices to offset any increase in the energy price cap,https://petition.parliament.uk/petitions/606586,open,311
End the practice of 'forced adoption' via the family court system,https://petition.parliament.uk/petitions/606589,open,372
Review and reform the Litter Strategy for England,https://petition.parliament.uk/petitions/606595,open,2144
Revise the rules for the Child Benefit High Income Charge’s (CBHIC),https://petition.parliament.uk/petitions/606598,open,256
Develop an Education Health Care Plan template for use by all local authorities,https://petition.parliament.uk/petitions/606602,open,1806
Fund the BBC from general taxation rather than a licence fee,https://petition.parliament.uk/petitions/606617,open,33
Introduce Witness Personal Statements in line with Victim Personal Statements,https://petition.parliament.uk/petitions/606619,open,33
Amend the British Museum Act to allow the acceptance of repatriation requests,https://petition.parliament.uk/petitions/606621,open,38
Changes to both Houses of Parliament.,https://petition.parliament.uk/petitions/606634,open,23
Produce a Farmland Protection Policy to regulate the loss of farmland to solar,https://petition.parliament.uk/petitions/606663,open,8675
End suspended/ non-custodial sentences for men who are violent to girls & womxn,https://petition.parliament.uk/petitions/606685,open,151
Make the discarding of syringes in a public place a specific criminal offence,https://petition.parliament.uk/petitions/606693,open,21
Increase the £450k Lifetime ISA (LISA) house price cap in London,https://petition.parliament.uk/petitions/606699,open,909
Extend Skilled Worker visas to non-managerial hospitality workers,https://petition.parliament.uk/petitions/606704,open,295
Allow people living with a partner to make single claims for Universal Credit,https://petition.parliament.uk/petitions/606711,open,140
Allow victims of domestic abuse to apply for ILR from outside the UK,https://petition.parliament.uk/petitions/606736,open,284
Provide N95/FFP2 or better face masks to the clinically extremely vulnerable,https://petition.parliament.uk/petitions/606740,open,136
Mandatory by-election for MPs who resign from their party or lose the whip,https://petition.parliament.uk/petitions/606743,open,579
Overturn the decision to allow the use of neonicotinoid pesticides,https://petition.parliament.uk/petitions/606788,open,9046
Allow all places of business to have adrenaline auto-injectors on site,https://petition.parliament.uk/petitions/606792,open,73
Increase Environment Agency funding for environmental protection,https://petition.parliament.uk/petitions/606795,open,25
Grant a ‘Covid 19 Remembrance’ Bank Holiday in 2022,https://petition.parliament.uk/petitions/606804,open,20
Require sanitary products are made available in all public and workplace toilets,https://petition.parliament.uk/petitions/606807,open,96
Repeal Section 58 Terrorism Act 2000,https://petition.parliament.uk/petitions/606821,open,14
Extend Government funding to Transport for London (TfL) beyond 4 February,https://petition.parliament.uk/petitions/606828,open,20
Make private parking penalties unenforceable through the court system.,https://petition.parliament.uk/petitions/606829,open,82
Do not end legal obligations to self-isolate if people test positive for covid,https://petition.parliament.uk/petitions/606834,open,14009
Don't recognise 'Somaliland' as an independent state,https://petition.parliament.uk/petitions/606842,open,1110
Simplify the language in the driving theory test,https://petition.parliament.uk/petitions/606845,open,412
Make ASD and ADHD screening available to all children of nursery age,https://petition.parliament.uk/petitions/606855,open,41
Ban plastic bags in the UK,https://petition.parliament.uk/petitions/606859,open,249
Allow use of Red Diesel for Charity Tractor runs,https://petition.parliament.uk/petitions/606861,open,86
Enact legislation to ban the use of electric shock collars in England,https://petition.parliament.uk/petitions/606887,open,29
Hold a referendum in Greater Manchester on removing the position of Mayor,https://petition.parliament.uk/petitions/606899,open,10451
Review the euthanasia of animals in the UK and impose reporting requirements,https://petition.parliament.uk/petitions/606922,open,12693
Provide funding for suitable luggage for children being taken into care,https://petition.parliament.uk/petitions/606929,open,334
Require MPs and civil servants report all contact with corporate entities,https://petition.parliament.uk/petitions/606946,open,27
Mandatory anti-racism and microaggression training for teachers,https://petition.parliament.uk/petitions/606950,open,279
Make digital NHS Covid Passes available to all under 16s,https://petition.parliament.uk/petitions/606959,open,16
Make sure the report into 'partygate' is published in full with the evidence,https://petition.parliament.uk/petitions/606960,open,315
Make it a specific criminal offence to leave a child under 4 years old alone,https://petition.parliament.uk/petitions/606963,open,159
Change the Highway Code to recommend cyclists keep left in most circumstances,https://petition.parliament.uk/petitions/606991,open,166
Fully fund sign language lessons for parents of deaf children in early years.,https://petition.parliament.uk/petitions/606995,open,134
Make Skilled Workers eligible for permanent residence after 3 years,https://petition.parliament.uk/petitions/607008,open,26
Ban trail hunting on Ministry of Defence property,https://petition.parliament.uk/petitions/607012,open,1034
Provide funding to support deaf athletes equally alongside Paralympic athletes,https://petition.parliament.uk/petitions/607026,open,979
Create a national online school for pupils unable to attend school premises,https://petition.parliament.uk/petitions/607052,open,639
Introduce new regulatory and financial measures to the Building Safety Bill,https://petition.parliament.uk/petitions/607054,open,432
Increase pay for all NHS workers by 5%,https://petition.parliament.uk/petitions/607055,open,127
Make Mental Health and Well-being a mandatory subject for GCSE students,https://petition.parliament.uk/petitions/607074,open,63
Require a negative covid-19 tests before flights into or out of England,https://petition.parliament.uk/petitions/607089,open,28
Increase efforts to reclaim covid-19 payments lost to fraud,https://petition.parliament.uk/petitions/607090,open,399
Give parents rights to 26-weeks paid leave to give children palliative care,https://petition.parliament.uk/petitions/607093,open,163
Scrap the two-child limit for Universal Credit and Child Tax Credits,https://petition.parliament.uk/petitions/607116,open,55
Publish daily updates on the number of Channel crossings,https://petition.parliament.uk/petitions/607119,open,11049
Introduce 'Skye's Law': Require all sex offenders to stay on register for life,https://petition.parliament.uk/petitions/607147,open,213
Add human trafficking to the secondary school curriculum to spread awareness.,https://petition.parliament.uk/petitions/607151,open,30
Revoke recent changes to the Highway Code ,https://petition.parliament.uk/petitions/607153,open,633
Ban school uniforms in English schools,https://petition.parliament.uk/petitions/607158,open,217
Make legal aid available to all parents seeking access to children,https://petition.parliament.uk/petitions/607170,open,432
"Require BSL and subtitles for parliamentary, government and political broadcasts",https://petition.parliament.uk/petitions/607185,open,210
"Require all NHS, Care and Social Care staff be vaccinated against COVID-19",https://petition.parliament.uk/petitions/607186,open,16
Make it illegal for companies to have different dress codes for men and women,https://petition.parliament.uk/petitions/607196,open,28
"Introduce testing, tax and vehicle registration/MOT requirements for cyclists",https://petition.parliament.uk/petitions/607217,open,256
The Government needs to urgently provide more funding and resources to HMRC.,https://petition.parliament.uk/petitions/607242,open,228
Fund the planting of wildflowers along all public green spaces,https://petition.parliament.uk/petitions/607277,open,75
Fund the provision of more ergonomic furniture in schools,https://petition.parliament.uk/petitions/607282,open,14
Reform the House of Lords so that only the life peers remain as members.,https://petition.parliament.uk/petitions/607304,open,26
Pledge any necessary military support to defend Ukraine,https://petition.parliament.uk/petitions/607314,open,50298
Make it a legal requirement for drivers to stop & report collisions with cats,https://petition.parliament.uk/petitions/607317,open,88010
Require people to have a criminal record check to open a social media account.,https://petition.parliament.uk/petitions/607328,open,859
Scrap University Tuition Fees & Introduce Annual Admin Fee of up to £500,https://petition.parliament.uk/petitions/607329,open,137
Increase funding for mental health support in schools,https://petition.parliament.uk/petitions/607356,open,52
Fund a national memorial in memory of all lives lost to open water,https://petition.parliament.uk/petitions/607371,open,48
List ‘Class’ as a Protected Characteristic in the UK’s Equality Act (2010).,https://petition.parliament.uk/petitions/607386,open,113
Stop ministers from using a private jet for Government business ,https://petition.parliament.uk/petitions/607393,open,32
Increase the 'list price' of cars and motorhomes at which a premium tax applies,https://petition.parliament.uk/petitions/607404,open,15
Introduce a cap for annual rent increases,https://petition.parliament.uk/petitions/607406,open,117
Increase funding to pupil referral units to meet SEND needs,https://petition.parliament.uk/petitions/607411,open,197
Require schools ringfence funding for pupils with Education and Healthcare Plans,https://petition.parliament.uk/petitions/607434,open,205
Charge anyone needing emergency care due to excessive alcohol £100 for treatment,https://petition.parliament.uk/petitions/607437,open,20
Increase funding to improve NHS and ambulance services,https://petition.parliament.uk/petitions/607465,open,134
Ban All Single Use Plastics and Plastic Packaging to Save Our Planet,https://petition.parliament.uk/petitions/607466,open,295
Abolish 'Double Jeopardy' in law,https://petition.parliament.uk/petitions/607494,open,1243
Make it a legal requirement for all drivers to carry their licence when driving,https://petition.parliament.uk/petitions/607497,open,237
Reintroduce Capital Punishment for Crimes Against Humanity,https://petition.parliament.uk/petitions/607499,open,24
Give employees the right to choose who accompanies them to disciplinary meetings,https://petition.parliament.uk/petitions/607501,open,68
Ban the tethering of horses and ponies on roadside and common land,https://petition.parliament.uk/petitions/607503,open,55
Do not reduce maintenance loan entitlements based on household income,https://petition.parliament.uk/petitions/607519,open,35
Prohibit social media companies from removing content that isn’t spam or illegal,https://petition.parliament.uk/petitions/607528,open,29
Scrap all charges for NHS services in England,https://petition.parliament.uk/petitions/607538,open,20
Confirm a timeline for rollout of Veterans ID card to all veterans,https://petition.parliament.uk/petitions/607550,open,45
Legally ban the consumption of alcohol in the workplace,https://petition.parliament.uk/petitions/607554,open,28
NHS Dental Nurses to be entitled to an NHS pension.,https://petition.parliament.uk/petitions/607557,open,43
Urgently & Substantially build up the UK Armed Force's conventional Capabilities,https://petition.parliament.uk/petitions/607559,open,87
Fund support and research for children suffering with UBE2A Deficiency Syndrome ,https://petition.parliament.uk/petitions/607566,open,146
Allow all people with settled status to vote in UK general elections,https://petition.parliament.uk/petitions/607574,open,77
Backdate settled status from beginning of application,https://petition.parliament.uk/petitions/607575,open,36
Make working from home a legal right for disabled workers,https://petition.parliament.uk/petitions/607576,open,20
Withdraw from the Paris agreement related to climate change,https://petition.parliament.uk/petitions/607577,open,74
Exempt UK military personnel from paying Income Tax while abroad.,https://petition.parliament.uk/petitions/607591,open,34
"Introduce a 30% 'Middle rate' of income tax for those earning £50,271 - £80,000.",https://petition.parliament.uk/petitions/607616,open,35
"Stop Collecting ""Tax on Account"" in January",https://petition.parliament.uk/petitions/607618,open,15
Require collection of birth registration data on both parents’ previous children,https://petition.parliament.uk/petitions/607633,open,30
Delay removal of red diesel entitlement from the construction industry,https://petition.parliament.uk/petitions/607637,open,16223
Make lying in Parliament a criminal offence,https://petition.parliament.uk/petitions/607658,open,168
Revoke rules against accusing MPs of deliberate falsehoods in House of Commons,https://petition.parliament.uk/petitions/607678,open,323
Remove the charge for children’s death certificates,https://petition.parliament.uk/petitions/607681,open,138
Do not reform the Human Rights Act,https://petition.parliament.uk/petitions/607712,open,225600
Extend Bereavement Support Payments to unmarried couples who cohabit,https://petition.parliament.uk/petitions/607729,open,37
Cover calorie information on food and drink products,https://petition.parliament.uk/petitions/607734,open,18
Review honey authenticity and current regulation of the honey market,https://petition.parliament.uk/petitions/607735,open,7351
Ban the use of prepayment meters for energy provision.,https://petition.parliament.uk/petitions/607746,open,156
Make Whistleblowing Training compulsory in all public services,https://petition.parliament.uk/petitions/607761,open,62
Raise the smoking age to 21 and increase funding to help smokers quit,https://petition.parliament.uk/petitions/607783,open,32
Allow Pension withdrawal to use as a mortgage deposit,https://petition.parliament.uk/petitions/607822,open,16
Add an additional amount to Universal Credit for energy costs,https://petition.parliament.uk/petitions/607839,open,66
Introduce cash rewards for Olympic medal winners and their coaches,https://petition.parliament.uk/petitions/607841,open,8
Make SEND training mandatory for all teaching staff,https://petition.parliament.uk/petitions/607849,open,28538
"Ban gambling adverts on TV, Radio and social media before 9pm",https://petition.parliament.uk/petitions/607852,open,219
Set up a pilot Drug Consumption Room to establish the benefits of DCR’s.,https://petition.parliament.uk/petitions/607860,open,73
Create a new inheritance tax allowance for gifts towards a child's first home,https://petition.parliament.uk/petitions/607864,open,15
Introduce double green lines for in front of on-street EV charge points,https://petition.parliament.uk/petitions/607880,open,70
Publish data on covid-19 vaccination reactions for children,https://petition.parliament.uk/petitions/607901,open,261
Lift sanctions against Afghanistan to reduce barriers to humanitarian aid,https://petition.parliament.uk/petitions/607904,open,19
Require all Home Office allowed appeals to be implemented within 8 weeks,https://petition.parliament.uk/petitions/607913,open,29
Fund an NHS programme to allow women with Endometriosis to freeze their eggs,https://petition.parliament.uk/petitions/607929,open,1546
Set up an internal complaints process & independent ombudsman for Education,https://petition.parliament.uk/petitions/607930,open,115
Lower family court fees,https://petition.parliament.uk/petitions/607933,open,68
Introduce a fast-track divorce procedure for victims of domestic abuse,https://petition.parliament.uk/petitions/607947,open,167
Review accessibility of driving tests to those with mental health difficulties,https://petition.parliament.uk/petitions/607957,open,16
Legally recognise Emotional Support Animals (ESA’s),https://petition.parliament.uk/petitions/607965,open,318
Suspend the green levies on domestic fuel immediately.,https://petition.parliament.uk/petitions/607977,open,184
Tax 50% of the Energy Companies profits to help households pay bills.,https://petition.parliament.uk/petitions/607983,open,1857
Reduce VAT to 5% for the Fitness industry to survive,https://petition.parliament.uk/petitions/607991,open,21
Make reversing cameras mandatory on all HGVs.,https://petition.parliament.uk/petitions/607996,open,26
Allow consumers the right to refuse the £200 energy rebate,https://petition.parliament.uk/petitions/608007,open,13719
"Reinstate the pensioners triple lock.
They cannot cope with the price rises.",https://petition.parliament.uk/petitions/608028,open,421
Increase funding for care for people with Spinal Cord Injury,https://petition.parliament.uk/petitions/608032,open,274
Create a Covid Remembrance Public Holiday in 2023,https://petition.parliament.uk/petitions/608036,open,17
Delay the Multiplication Tables Check until it has been consulted on.,https://petition.parliament.uk/petitions/608037,open,3647
Nationalise Energy Companies,https://petition.parliament.uk/petitions/608056,open,1953
Review the diagnosis and treatment of myocarditis on the NHS,https://petition.parliament.uk/petitions/608061,open,261
Enable the public to listen to Air Traffic Control radio in the UK,https://petition.parliament.uk/petitions/608070,open,35
Fund routine testing for Group B Streptococcus during late pregnancy,https://petition.parliament.uk/petitions/608081,open,7699
Automatically remove a Peer of title if found guilty of Child abuse.,https://petition.parliament.uk/petitions/608103,open,38
Return all Utilities to National UK Government Ownership.,https://petition.parliament.uk/petitions/608132,open,59
Fund payments to energy customers to cover price rises by taxing oil companies,https://petition.parliament.uk/petitions/608136,open,86
Change the £200 loan for electric/gas bills to a grant,https://petition.parliament.uk/petitions/608143,open,64
Suspend the foreign aid budget indefinitely,https://petition.parliament.uk/petitions/608150,open,277
Trigger Article 16,https://petition.parliament.uk/petitions/608155,open,51
Extend the right to aquire to rural housing association tenants,https://petition.parliament.uk/petitions/608207,open,20
Fund free autism assessments for all adults,https://petition.parliament.uk/petitions/608230,open,135
Ban Jetskis from coastal waters and inland waterways,https://petition.parliament.uk/petitions/608231,open,1250
Free prescriptions for those with a long term and/or chronic condition.,https://petition.parliament.uk/petitions/608237,open,20046
Make altering property borders without consent a specific criminal offence,https://petition.parliament.uk/petitions/608247,open,15
Provide funding for universal access to Fracture Liaison Services (FLS),https://petition.parliament.uk/petitions/608258,open,5084
Require schools to make uniform optional,https://petition.parliament.uk/petitions/608259,open,69
Give tenants the right to terminate short term tenancies if repairs not made,https://petition.parliament.uk/petitions/608260,open,30
Same-sex couples to use adultery as grounds for divorce,https://petition.parliament.uk/petitions/608266,open,102
Commit to UK natural gas and increase investment,https://petition.parliament.uk/petitions/608274,open,704
Abolish tuition fees for all undergraduate courses,https://petition.parliament.uk/petitions/608283,open,38
Grant amnesty for all asylum seekers waiting for more than 3 years,https://petition.parliament.uk/petitions/608285,open,22
Ban the importation and sale of foie gras,https://petition.parliament.uk/petitions/608288,open,6841
Let international music students earn money by performing during their studies.,https://petition.parliament.uk/petitions/608291,open,80
"Introduce an ""Ecological Damage Tax"" on Astroturf Lawns / Artificial Grass",https://petition.parliament.uk/petitions/608295,open,12980
Legalise Natural Organic Reduction,https://petition.parliament.uk/petitions/608316,open,28
Provide free school meal vouchers to disabled children with authorised absence,https://petition.parliament.uk/petitions/608332,open,264
Create an Operation Rescript medal for Armed Forces supporting Covid-19 response,https://petition.parliament.uk/petitions/608370,open,80
Ban the release of doves in ceremonies,https://petition.parliament.uk/petitions/608407,open,318
Stop DVLA selling personal details to private companies,https://petition.parliament.uk/petitions/608414,open,52
the govt must order a full inquiry into the impacts of all school covid measures,https://petition.parliament.uk/petitions/608423,open,14
Write off all student debt for nurses and midwives,https://petition.parliament.uk/petitions/608425,open,30
Introduce lower rates of income tax for pension income,https://petition.parliament.uk/petitions/608430,open,54
Protect and restore Britain’s lost rainforests,https://petition.parliament.uk/petitions/608460,open,9621
Make university students in England exempt from prescription charges,https://petition.parliament.uk/petitions/608462,open,265
"Create a nationwide regeneration plan run by an independent ""Regeneration Tsar""",https://petition.parliament.uk/petitions/608463,open,84
Increase the national speed limit to 80mph,https://petition.parliament.uk/petitions/608472,open,39
Confirm all subtopics that will be in 2022 GCSE exams,https://petition.parliament.uk/petitions/608477,open,161
Automatically upgrade A2 motorcycle licence to A licence after 2 years,https://petition.parliament.uk/petitions/608482,open,5988
Backpay the £20 covid uplift to people on Legacy Benefits,https://petition.parliament.uk/petitions/608486,open,27155
Fund a national screening programme to detect ovarian cancer,https://petition.parliament.uk/petitions/608491,open,45
Review medical care and treatment for babies with failure to thrive,https://petition.parliament.uk/petitions/608495,open,342
Make it compulsory for schools and workplaces to have recycling bins,https://petition.parliament.uk/petitions/608503,open,52
Require all police conduct complaints & appeals to be referred to the IOPC,https://petition.parliament.uk/petitions/608531,open,23
Require public referendums to approve participation in any armed conflict,https://petition.parliament.uk/petitions/608534,open,62
Create an independent body to regulate the personal development industry,https://petition.parliament.uk/petitions/608536,open,167
Create targeted support for children of parents with a mental illness,https://petition.parliament.uk/petitions/608542,open,763
Recognise the Myanmar National Unity Government,https://petition.parliament.uk/petitions/608543,open,1117
Change Environment Agency rules for part year registration,https://petition.parliament.uk/petitions/608548,open,18
Change petition rules to allow petitions of no confidence in the UK Government,https://petition.parliament.uk/petitions/608550,open,308
Create national standards for advanced information from exam boards in 2022,https://petition.parliament.uk/petitions/608553,open,110
Create rights to withdraw from buying a property 'off-plan' due to delays,https://petition.parliament.uk/petitions/608572,open,78
