Petition,URL,State,Signatures Count
Grant all Ukrainians living in the UK for 5 years Indefinite Leave to Remain,https://petition.parliament.uk/petitions/612308,open,261
Stop changing the clocks - Keep British Summer Time all year,https://petition.parliament.uk/petitions/612319,open,69
Urge the UN Security Council to seek a ceasefire and referendums across Ukraine,https://petition.parliament.uk/petitions/612324,open,75
Fund free public transport for all military veterans,https://petition.parliament.uk/petitions/612325,open,18
Ban the sale of disposable vapes.,https://petition.parliament.uk/petitions/612333,open,912
Grant family visa status to Ukrainian seasonal workers,https://petition.parliament.uk/petitions/612363,open,21
Limit secondary schools days to 5.5 hours ,https://petition.parliament.uk/petitions/612366,open,47
Fund cervical screening at 20 as opposed to 25,https://petition.parliament.uk/petitions/612372,open,1089
Require sanitary bins be provided in men and women's toilets,https://petition.parliament.uk/petitions/612377,open,28
Set stricter legal targets for air quality and increase funding for research,https://petition.parliament.uk/petitions/612379,open,176
License hunting in the UK with Compound bows and Cross bows,https://petition.parliament.uk/petitions/612384,open,160
Fund improved treatment and awareness of Functional Neurological Disorders,https://petition.parliament.uk/petitions/612385,open,4759
"Justice for children incorrectly labelled ""educationally subnormal"" in 1960s/70s",https://petition.parliament.uk/petitions/612398,open,462
Ban abortion after 24 weeks on the grounds of severe disability,https://petition.parliament.uk/petitions/612404,open,27
"Require NHS use an ""opt-in"" system to use patient data for planning or research",https://petition.parliament.uk/petitions/612407,open,22
Reduce VAT For Hair And Beauty Salons to 5%,https://petition.parliament.uk/petitions/612408,open,93
Increase sentences for domestic violence offences,https://petition.parliament.uk/petitions/612413,open,44
End weight checks for primary school aged children,https://petition.parliament.uk/petitions/612418,open,137
Make the period of Ramadan a school holiday,https://petition.parliament.uk/petitions/612422,open,27
Min. 10-year sanctions on Russia if chemical/biological weapons used in Ukraine,https://petition.parliament.uk/petitions/612434,open,22
Take urgent actions to address the extreme cost of living crisis,https://petition.parliament.uk/petitions/612439,open,1195
Require clear sugar and fat warnings on front and back of food packaging,https://petition.parliament.uk/petitions/612467,open,145
Require councils suspend council tax payments for six months,https://petition.parliament.uk/petitions/612558,open,21
Remove offences preventing the humane capture and release of rats,https://petition.parliament.uk/petitions/612610,open,26
Review school start times in line with the needs of adolescents,https://petition.parliament.uk/petitions/612650,open,25
Create an offence of trespass on field of play at a designated sporting event,https://petition.parliament.uk/petitions/612695,open,46
Make parking at work permanently free for all NHS workers,https://petition.parliament.uk/petitions/612699,open,15698
Pay Carer's Allowance in addition to any other benefits or state pension,https://petition.parliament.uk/petitions/612708,open,79
Reform UK passport application tracking and options to fast-track applications,https://petition.parliament.uk/petitions/612738,open,281
Set a target for 70% of UK energy to be renewable by 2030,https://petition.parliament.uk/petitions/612739,open,68
Save UK soil: increase soil organic matter to 3% by 2045 in agricultural land.,https://petition.parliament.uk/petitions/612755,open,53
Fund a public health campaign on cardiopulmonary resuscitation,https://petition.parliament.uk/petitions/612891,open,13
Require schools have at least three physical education lessons a week,https://petition.parliament.uk/petitions/612899,open,16
Make Eid a public holiday,https://petition.parliament.uk/petitions/612985,open,79
Make learning the countries of the world in school part of the curriculum,https://petition.parliament.uk/petitions/613005,open,16
Ban unsolicited mail where a “no junk mail” sign is displayed,https://petition.parliament.uk/petitions/613034,open,32
Do not implement a tracking-based road tax system,https://petition.parliament.uk/petitions/613101,open,438
Lower the standard rate of income tax due to cost of living increases,https://petition.parliament.uk/petitions/613191,open,51
Fast-track access to benefits for terminally ill as soon as diagnosed,https://petition.parliament.uk/petitions/613198,open,11152
Ban LED car headlights and break lights,https://petition.parliament.uk/petitions/613252,open,15
Implement online voting for general elections and referendums in the UK,https://petition.parliament.uk/petitions/613295,open,28
Reform arrangements for practical driving tests to tackle backlog,https://petition.parliament.uk/petitions/613321,open,246
Ban the sale of flying plastic rings to help protect marine wildlife,https://petition.parliament.uk/petitions/613442,open,2935
"Make e-skateboards legal to use on roads, pavements & cycle paths",https://petition.parliament.uk/petitions/613460,open,22
Recognise wrongs against Kashmiri Hindus and support return to Kashmir,https://petition.parliament.uk/petitions/613517,open,16
Ban LGBT+ Conversion Therapy,https://petition.parliament.uk/petitions/613518,open,416
Ensure Trans people are fully protected under any conversion therapy ban,https://petition.parliament.uk/petitions/613556,open,148454
"Prevent anyone who is not a qualified medical doctor using the title ""Dr""",https://petition.parliament.uk/petitions/613599,open,13
Change the Blue Badge parking scheme so people who are 100 automatically qualify,https://petition.parliament.uk/petitions/613602,open,92
Extend the Service Pupil Premium (SPP) to Early Years Foundation Stage (EYFS),https://petition.parliament.uk/petitions/613656,open,161
Add the 9/11 attacks to the national curriculum,https://petition.parliament.uk/petitions/613695,open,15
Review assessment of autistic students to ensure they are not disadvantaged,https://petition.parliament.uk/petitions/613722,open,107
Change the law to allow an individual to have a pets ashes buried with them,https://petition.parliament.uk/petitions/613731,open,25
Don't raise national average target grades in GCSE English Language & Maths.,https://petition.parliament.uk/petitions/613740,open,42
Run the National Lottery solely for the benefit of the NHS,https://petition.parliament.uk/petitions/613742,open,22
Make Monday 21st November 2022 A Bank Holiday as England KO at 1pm in the FIFAWC,https://petition.parliament.uk/petitions/613744,open,27
Require Councils to publish all FOI responses online,https://petition.parliament.uk/petitions/613762,open,35
Review guidance on use of masks in residential care homes,https://petition.parliament.uk/petitions/613767,open,179
Reform assessment of English GCSEs,https://petition.parliament.uk/petitions/613769,open,36
Work internationally to provide army surplus protective clothing to Ukraine,https://petition.parliament.uk/petitions/613822,open,43
Stop Operation Brock & find alternative solution to traffic build-up in Kent,https://petition.parliament.uk/petitions/613834,open,96
Fund grants for installation of solar panels and battery storage for households,https://petition.parliament.uk/petitions/613855,open,77
Reduce tax on petrol cars to reflect lower CO2 emissions from using E10 petrol,https://petition.parliament.uk/petitions/613862,open,22
Set minimum rate for energy companies to pay people who export excess energy,https://petition.parliament.uk/petitions/613896,open,115
Remove duty on motor fuel completely,https://petition.parliament.uk/petitions/613908,open,1838
Extend the Warm Home Discount to everyone with a disability,https://petition.parliament.uk/petitions/613938,open,57
Fund local authorities to refurbish skate parks,https://petition.parliament.uk/petitions/613945,open,14
Make fines for breaching Covid regulations relative to income,https://petition.parliament.uk/petitions/613947,open,17
Create British passport holders only sections at arrival in the UK airports,https://petition.parliament.uk/petitions/613956,open,34
Extend statutory paternity pay to the self-employed,https://petition.parliament.uk/petitions/613969,open,330
Mandatory life sentence for involvement in trafficking women & children for sex,https://petition.parliament.uk/petitions/613981,open,305
Stop the privatisation of Channel 4,https://petition.parliament.uk/petitions/613995,open,5925
Make teaching of age-appropriate sex education compulsory from Year 6,https://petition.parliament.uk/petitions/614004,open,281
Abolish no recourse to public funds (NRPF) visa conditions,https://petition.parliament.uk/petitions/614009,open,98
Require schools to make Friday a part of the school weekend,https://petition.parliament.uk/petitions/614046,open,498
Condemn Chinese government for removing children from parents due to Covid-19,https://petition.parliament.uk/petitions/614048,open,18
Create pension parity for men and women born before 1951/53,https://petition.parliament.uk/petitions/614050,open,28
Require LPAs hold referendums on support for onshore renewables by April 2024,https://petition.parliament.uk/petitions/614053,open,13
Ban hedge cutting and non-essential tree felling between March and August,https://petition.parliament.uk/petitions/614061,open,3184
Increase funding to house and support the homeless,https://petition.parliament.uk/petitions/614065,open,68
VAT Complete Removal.,https://petition.parliament.uk/petitions/614072,open,50
Impose sanctions on Qatar in light of human rights concerns,https://petition.parliament.uk/petitions/614084,open,117
Hold referendum on any privatisation of public service broadcasters,https://petition.parliament.uk/petitions/614093,open,69
Increase the work from home expense flat rates for self-employed people,https://petition.parliament.uk/petitions/614104,open,18
Hold a public inquiry into treatment of care home residents during the pandemic,https://petition.parliament.uk/petitions/614106,open,191
Raise the level of the Feed In Tariff (FIT) for those with home Solar Panels.,https://petition.parliament.uk/petitions/614107,open,58
Create a duty of care for licensed premises in respect of intoxicated customers,https://petition.parliament.uk/petitions/614108,open,79
Review and increase the income thresholds for Free School Meals,https://petition.parliament.uk/petitions/614134,open,22
"Amend the Equality Act so asexuality is an orientation, intersex as a sex.",https://petition.parliament.uk/petitions/614145,open,53
Remove face-to-face assessments for PIP renewals,https://petition.parliament.uk/petitions/614170,open,31
Ban umbrella companies charging employees Employers NI,https://petition.parliament.uk/petitions/614178,open,235
Create a regulator for licences to play live or recorded music,https://petition.parliament.uk/petitions/614190,open,73
Suspend Section 25 of the Landlord and Tenant Act (Grounds C to G),https://petition.parliament.uk/petitions/614202,open,42287
Make school uniform VAT exempt,https://petition.parliament.uk/petitions/614214,open,7525
"Reduce the VAT on reusable menstrual products ""Period Pants"" from 20% to 0%",https://petition.parliament.uk/petitions/614222,open,5818
Fund ESOL courses for Ukrainians arriving to UK,https://petition.parliament.uk/petitions/614223,open,17
Extend the energy price cap to communal heat networks,https://petition.parliament.uk/petitions/614232,open,272
"Make using ""Z"" to show support for the invasion of Ukraine a criminal offence",https://petition.parliament.uk/petitions/614234,open,290
End the TV licence and sell the BBC,https://petition.parliament.uk/petitions/614239,open,174
Exempt workers on minimum wage from Income Tax and National Insurance,https://petition.parliament.uk/petitions/614240,open,44
Replace 2022 GCSE and A-Level exams with teacher assessed grades,https://petition.parliament.uk/petitions/614245,open,21
Create a tax break for workers who were not furloughed during the pandemic,https://petition.parliament.uk/petitions/614264,open,14
Legalise and incentivise uptake of personal electric vehicles,https://petition.parliament.uk/petitions/614282,open,31
Stop investing in new nuclear power in the UK,https://petition.parliament.uk/petitions/614289,open,48
Require schools allow students to wear PE kit for whole day on PE days,https://petition.parliament.uk/petitions/614293,open,201
Require local authorities in England to permit motorcycles in bus lanes,https://petition.parliament.uk/petitions/614294,open,14569
Require schools to have separate toilets for boys and girls,https://petition.parliament.uk/petitions/614296,open,48
"Fund testing for cervical cell changes, regardless negative HPV result",https://petition.parliament.uk/petitions/614301,open,29
Seek to suspend India's membership of the Commonwealth of Nations,https://petition.parliament.uk/petitions/614302,open,17
Revoke the right of registered sex offenders to change their name by deed poll,https://petition.parliament.uk/petitions/614317,open,610
"Require carbohydrates be listed on menus in cafes, restaurants and takeaways",https://petition.parliament.uk/petitions/614328,open,102
Do not sign any WHO Pandemic Treaty unless it is approved via public referendum,https://petition.parliament.uk/petitions/614335,open,154548
Include migraine on the list of medical exemptions for free prescriptions.,https://petition.parliament.uk/petitions/614340,open,149
Abolish 'Non-domiciled' tax status for UK residents,https://petition.parliament.uk/petitions/614344,open,30
Make it illegal to pierce the body of babies or children under the age of 11,https://petition.parliament.uk/petitions/614345,open,62
Make it mandatory for restaurants to donate left-overs to local food banks.,https://petition.parliament.uk/petitions/614352,open,131
Increase long-term funding for NHS services for homeless people,https://petition.parliament.uk/petitions/614358,open,336
Make lying in public office a specific criminal offence,https://petition.parliament.uk/petitions/614361,open,43
Tougher laws against publishing animal cruelty images and/or videos,https://petition.parliament.uk/petitions/614364,open,41
Require domestic cats be kept indoors at all times,https://petition.parliament.uk/petitions/614373,open,38
Review how patients are diagnosed and treated under the Mental Health Act,https://petition.parliament.uk/petitions/614375,open,338
Reinstate the IPC grant Funding which paid social care staff who need to isolate,https://petition.parliament.uk/petitions/614377,open,3956
Seek exemption for US-born living in UK from US tax obligations,https://petition.parliament.uk/petitions/614386,open,15
Remove requirements to display calories on menus,https://petition.parliament.uk/petitions/614396,open,1468
Make it a requirement to label processed meats as a Group 1 carcinogen,https://petition.parliament.uk/petitions/614397,open,316
Impose new restrictions on the placement mobile speed cameras,https://petition.parliament.uk/petitions/614399,open,32
Make all convicted criminals serve their full sentence,https://petition.parliament.uk/petitions/614403,open,36
Remove prostitution from the list of priority offences in the Online Safety Bill,https://petition.parliament.uk/petitions/614408,open,2206
Make a public support of Russian aggression in Ukraine a criminal offence,https://petition.parliament.uk/petitions/614417,open,29
Change the law so anyone over the age of 18 can be adopted.,https://petition.parliament.uk/petitions/614418,open,49
Provide maternity leave and pay for pregnancies terminated after 20 weeks,https://petition.parliament.uk/petitions/614433,open,94
Reduce police funding by £1 billion per year and fund crime prevention instead,https://petition.parliament.uk/petitions/614434,open,31
Make zero hour contracts illegal,https://petition.parliament.uk/petitions/614439,open,38
Apply to join the European Free Trade Agreement (EFTA),https://petition.parliament.uk/petitions/614443,open,38
Mandatory pregnancy warnings on all alcohol containers,https://petition.parliament.uk/petitions/614458,open,307
Fund a manned spaceflight programme,https://petition.parliament.uk/petitions/614470,open,11
The Vegan Petition - Ban Animal Agriculture and Animal Products,https://petition.parliament.uk/petitions/614487,open,467
Seek to replace Russia with Ukraine in the Security Council.,https://petition.parliament.uk/petitions/614488,open,215
Allow all parents to get Healthy Start vouchers,https://petition.parliament.uk/petitions/614500,open,30
Legalise cannabis in the UK,https://petition.parliament.uk/petitions/614503,open,833
Permanently abolish NHS pension abatement rules,https://petition.parliament.uk/petitions/614506,open,2552
Include Hospitality as an option on the Temporary Work - Seasonal Worker visa,https://petition.parliament.uk/petitions/614516,open,154
Set up a national Electric Vehicle (EV) charging network in England,https://petition.parliament.uk/petitions/614529,open,37
Change sentencing for causing death or serious injury by dangerous driving,https://petition.parliament.uk/petitions/614537,open,540
Allow children of dependent parents of an EU citizen sponsor to come to the UK,https://petition.parliament.uk/petitions/614540,open,557
"Devolve control of the  Crown Estate in and around Wales,  to  Welsh Government",https://petition.parliament.uk/petitions/614568,open,91
Stop the bedroom tax,https://petition.parliament.uk/petitions/614575,open,78
Create an emergency fund for victims of failed funeral plan companies.,https://petition.parliament.uk/petitions/614579,open,2120
Support a 'Kyiv Conference' to reform the UN,https://petition.parliament.uk/petitions/614580,open,21
Allow everyone access to the Spring COVID booster,https://petition.parliament.uk/petitions/614584,open,51
Limit details of non-molestation orders being shared with perpetrators,https://petition.parliament.uk/petitions/614591,open,125
Ban non-compostable multi-layer material food packaging by 2030,https://petition.parliament.uk/petitions/614594,open,126
Exempt Zimbabweans from English Language test visa requirements.,https://petition.parliament.uk/petitions/614597,open,123
Keep The Fracking Ban,https://petition.parliament.uk/petitions/614611,open,378
Sanction individuals linked to illegal activities in Sri Lanka.,https://petition.parliament.uk/petitions/614612,open,3897
Increase the single person Council Tax discount to 50%,https://petition.parliament.uk/petitions/614614,open,53
Require council tax discounts for dementia are backdated to the diagnosis date,https://petition.parliament.uk/petitions/614616,open,212
"Cyclist must wear a helmet, hi-vis and have lights on their bike.",https://petition.parliament.uk/petitions/614617,open,111
Hold a public referendum on whether MPs should be able to hold second jobs,https://petition.parliament.uk/petitions/614635,open,17
Require MPs who break the law be removed from office,https://petition.parliament.uk/petitions/614705,open,664
Require a Prime Minister be removed from office if found to have broken the law,https://petition.parliament.uk/petitions/614729,open,422
Ban the religious slaughter of animals without first stunning them,https://petition.parliament.uk/petitions/614742,open,8596
Fund 3 rounds of IVF for all couples who cannot conceive naturally,https://petition.parliament.uk/petitions/614768,open,2487
Decriminalisation of Marijuana and THC products for Medical and Recreational use,https://petition.parliament.uk/petitions/614779,open,328
Reform child maintenance rules for parents who receive and pay maintenance,https://petition.parliament.uk/petitions/614792,open,559
Introduce independent body to enforce the ministerial code on ministers.,https://petition.parliament.uk/petitions/614813,open,53475
Increase the price cap for the Help to Buy ISA scheme outside of London,https://petition.parliament.uk/petitions/614815,open,91
Fund support schemes for survivors of Child Sex Abuse,https://petition.parliament.uk/petitions/614844,open,1342
"Don’t increase student loan interest rate to 12%, and tie to base rate instead",https://petition.parliament.uk/petitions/614853,open,31
Change the way child maintenance is worked out - base on income after deductions,https://petition.parliament.uk/petitions/614861,open,705
"Fund pay rise for police officers in line with inflation, plus 1%",https://petition.parliament.uk/petitions/614869,open,67430
Increase Funds for Non-Animal Research for Cancer ,https://petition.parliament.uk/petitions/614884,open,19
An MP found guilty of breaking any law is automatically subject to recall.,https://petition.parliament.uk/petitions/614888,open,155
Support Homes for Ukraine hosts to accommodate Ukraine Family Visa holders,https://petition.parliament.uk/petitions/614890,open,25
Fund free paediatric first aid and life support classes during pregnancy,https://petition.parliament.uk/petitions/614892,open,35
Automatically suspend PR rights of parent guilty of murdering the other parent.,https://petition.parliament.uk/petitions/614893,open,129661
Require Ferry Companies to Comply With the Equality Act 2010,https://petition.parliament.uk/petitions/614906,open,46
Stop the government's 'one way ticket' plan to send asylum seekers to Rwanda,https://petition.parliament.uk/petitions/614913,open,12543
Make Graduate visa extendable and count towards permanent residency,https://petition.parliament.uk/petitions/614931,open,15676
Seek to relocate the UK Parliament to Rwanda,https://petition.parliament.uk/petitions/614934,open,92
End all national tests in schools until GCSEs and A-Levels,https://petition.parliament.uk/petitions/614946,open,18
Make female hormone health a compulsory part of the curriculum starting age 10,https://petition.parliament.uk/petitions/614968,open,134
"Hold a public inquiry into ""partygate"" and how it has been investigated",https://petition.parliament.uk/petitions/614977,open,533
Provide emergency medical equipment and medicines to Sri Lanka,https://petition.parliament.uk/petitions/614983,open,90
Bring the draft Bereavement Benefits Remedial Order into law. ,https://petition.parliament.uk/petitions/615031,open,711
Create a new MP to represent all UK expats,https://petition.parliament.uk/petitions/615076,open,26
Do not implement EU speed limiter requirements in the UK,https://petition.parliament.uk/petitions/615078,open,24
Remove the restrictions on keeping Siberian chipmunks,https://petition.parliament.uk/petitions/615083,open,44
Make Domestic & Sexual Abuse Policies Mandatory at Higher Education Institutions,https://petition.parliament.uk/petitions/615090,open,83
Make the private slaughter and consumption of cats and dogs illegal,https://petition.parliament.uk/petitions/615095,open,437
Reform the current firearms licensing and renewal system,https://petition.parliament.uk/petitions/615110,open,19
Advanced Nurse Practitioner (ANP/ACP) to Sign Sick note/Med3 Certificate,https://petition.parliament.uk/petitions/615112,open,177
"Do not require a Energy Performance rating of ""C"" for private lets after 2025/28",https://petition.parliament.uk/petitions/615118,open,18
Hold a public inquiry into visa arrangements for Ukrainian refugees,https://petition.parliament.uk/petitions/615147,open,1817
Allow students to choose one exam paper per subject to be replaced with TAGs,https://petition.parliament.uk/petitions/615153,open,11
Change the law so that all copyright only lasts for two years,https://petition.parliament.uk/petitions/615176,open,11
Request a Royal Pardon for the Pendle Witches hung in August 1612,https://petition.parliament.uk/petitions/615190,open,215
"Abolish stamp duty for all first-time buyers, no matter the purchase price",https://petition.parliament.uk/petitions/615206,open,14
Review the fostering system to make it fairer and faster,https://petition.parliament.uk/petitions/615221,open,37
Require age-verification for hook-up apps and websites,https://petition.parliament.uk/petitions/615224,open,204
Create a Government-backed car insurance scheme,https://petition.parliament.uk/petitions/615227,open,11
Make alcohol imports for personal use duty and tax free for UK residents,https://petition.parliament.uk/petitions/615233,open,80
Urge the UN and India to carry out a plebiscite on the future of Kashmir,https://petition.parliament.uk/petitions/615241,open,16
Reduce the legal driving age to 16,https://petition.parliament.uk/petitions/615247,open,32
Give tenants the right to end short term tenancies if pests present,https://petition.parliament.uk/petitions/615259,open,44
Require all educational establishments to have CCTV outside toilets,https://petition.parliament.uk/petitions/615264,open,99
Review NHS care for 16 and 17 year olds,https://petition.parliament.uk/petitions/615267,open,1559
Allow Camping on Farmland for 56 days a year under permitted development,https://petition.parliament.uk/petitions/615270,open,6312
Increase the basic State Pension to align with the new State Pension,https://petition.parliament.uk/petitions/615271,open,915
Make it illegal for over 18s to engage in sexual activity with under 18s,https://petition.parliament.uk/petitions/615281,open,91
Decriminalise Psilocybin for Medical Use.,https://petition.parliament.uk/petitions/615282,open,28
Raise Funeral Payments and give Bereavement Payments to children of the deceased,https://petition.parliament.uk/petitions/615286,open,14
We want the UK Government to appoint a dedicated Minister for Manufacturing.,https://petition.parliament.uk/petitions/615294,open,1204
Require exam bodies and schools to allow calculators during GCSE maths exams,https://petition.parliament.uk/petitions/615300,open,17
