Petition,URL,State,Signatures Count
Require all UK citizens over 14 to carry biometric national identity card,https://petition.parliament.uk/petitions/615305,open,28
"Fund all care needs for dementia sufferers, including care home costs",https://petition.parliament.uk/petitions/615321,open,158
Hold a referendum on using the Additional Member System for General Elections,https://petition.parliament.uk/petitions/615332,open,17
Require Ministers found to break the law be removed from office and lose pension,https://petition.parliament.uk/petitions/615337,open,58
Review planning law relating to camping sites to better meet local needs,https://petition.parliament.uk/petitions/615352,open,45
Ban the racing of horses that are under 4 years old.,https://petition.parliament.uk/petitions/615367,open,3095
Abolish Cafcass and review how parental alienation is assessed in family courts,https://petition.parliament.uk/petitions/615395,open,14
Introduce a ban on import and sale of products made using Russian oil.,https://petition.parliament.uk/petitions/615406,open,15
Require CCTV in all underpasses and train station tunnels,https://petition.parliament.uk/petitions/615418,open,112
Review accessibility to primary care and face to face appointments with GPs,https://petition.parliament.uk/petitions/615422,open,471
Investigate how to improve recruitment and retention in the social care sector,https://petition.parliament.uk/petitions/615432,open,57
"Review the law, sentencing, and rehabilitation of abusive parents",https://petition.parliament.uk/petitions/615459,open,24
Work internationally to create fully digital animal export/import certification ,https://petition.parliament.uk/petitions/615474,open,103
Keep May 30th as a Bank Holiday,https://petition.parliament.uk/petitions/615475,open,14
End military aid to Ukraine to avoid the risk of nuclear war with Russia,https://petition.parliament.uk/petitions/615481,open,422
Have the UK Government recognise the Armenian Genocide,https://petition.parliament.uk/petitions/615490,open,20
Loosen requirements for British citizens to return their pets home from China.,https://petition.parliament.uk/petitions/615497,open,1757
Require men over the age of 50 to be invited for a PSA test,https://petition.parliament.uk/petitions/615500,open,400
Establish a Royal Commission on Tidal Energy and Coastal Defence,https://petition.parliament.uk/petitions/615501,open,58
Require foetal scanning to be offered all women prior to an abortion,https://petition.parliament.uk/petitions/615509,open,219
Make garden bonfires before 5pm illegal,https://petition.parliament.uk/petitions/615514,open,17
We demand that the UK Government declares a Global Climate Emergency,https://petition.parliament.uk/petitions/615537,open,2190
Bar non-domiciled UK residents from standing for election as MPs,https://petition.parliament.uk/petitions/615549,open,30
Remove the minimum 2 years work criteria to claim Constructive dismissal,https://petition.parliament.uk/petitions/615564,open,70
Fund research to find and protect northern white rhinos ,https://petition.parliament.uk/petitions/615583,open,18
Make the Queens Platinum Jubilee a permanent Bank Holiday,https://petition.parliament.uk/petitions/615603,open,93
Increase funding to early years settings which support children with SEN,https://petition.parliament.uk/petitions/615604,open,448
Ban the sale and use of Rodenticides,https://petition.parliament.uk/petitions/615605,open,69
Fund minimum of 10 support centres across England for homeless youth,https://petition.parliament.uk/petitions/615609,open,77
Require training and assesment on spiking for all Personal Licence Holders.,https://petition.parliament.uk/petitions/615617,open,18
Do not reduce staff-child ratios in early years childcare,https://petition.parliament.uk/petitions/615623,open,67571
Make it legal to smoke in pubs after 9pm,https://petition.parliament.uk/petitions/615626,open,28
"Adopt British Double Summer Time, and British Standard Time in winter",https://petition.parliament.uk/petitions/615650,open,14
Review licence fees and financial support for hydro generation,https://petition.parliament.uk/petitions/615664,open,666
Ensure domestic abuse survivors are better protected by CMS post-review,https://petition.parliament.uk/petitions/615671,open,132
"Make it illegal to import, sell or release sky lanterns",https://petition.parliament.uk/petitions/615674,open,180
Keep MOT tests as a yearly requirement,https://petition.parliament.uk/petitions/615690,open,2172
Allow international students to apply for graduate visa before final result,https://petition.parliament.uk/petitions/615705,open,14
Require trigger warnings for all broadcasts related to sexual violence,https://petition.parliament.uk/petitions/615707,open,184
Make relaxed rules for outdoor hospitality and making traffic orders permanent,https://petition.parliament.uk/petitions/615710,open,796
Increase staffing to reduce waiting times for visas,https://petition.parliament.uk/petitions/615711,open,11110
Equalise paternity leave and pay entitlements with maternity leave and pay,https://petition.parliament.uk/petitions/615717,open,55
Reinstate Priority and Superpriority track for Family and Student Visas.,https://petition.parliament.uk/petitions/615721,open,26
Fund biennial full body MRI scans for all NHS patients to screen for cancer,https://petition.parliament.uk/petitions/615738,open,16
Remove 5% VAT rate on gas and electric bills,https://petition.parliament.uk/petitions/615739,open,348
Fund free PCR tests for vulnerable people & their families they reside with,https://petition.parliament.uk/petitions/615771,open,14
"Total ban on the use of electric scooters, except on private land",https://petition.parliament.uk/petitions/615774,open,47
Free NHS Prescriptions for 18 Year Olds and over in Full Time education,https://petition.parliament.uk/petitions/615796,open,22
UK gov buildings should be mandated to fly the Union Flag all year around.,https://petition.parliament.uk/petitions/615797,open,19
Increase funding so road infrastructure in towns and cities is fit for purpose,https://petition.parliament.uk/petitions/615804,open,14
Change DLA to PIP age from 16 years old to 18 years old,https://petition.parliament.uk/petitions/615807,open,99
Make it a legal requirement to state allergens on pet food,https://petition.parliament.uk/petitions/615809,open,20
Make parental alienation a criminal offence,https://petition.parliament.uk/petitions/615816,open,560
Introduce a legal minimum requirement for hamster cages.,https://petition.parliament.uk/petitions/615825,open,87
Ban school uniforms in sex shops and pornography,https://petition.parliament.uk/petitions/615829,open,15428
Require all mobility and cabin scooters to be fitted with seat belts,https://petition.parliament.uk/petitions/615840,open,41
Ban isolation as a punishment in schools.,https://petition.parliament.uk/petitions/615849,open,19
Change legal definition of stillborn to include all delivered babies,https://petition.parliament.uk/petitions/615852,open,17057
Fund training on helping women with endometriosis for NHS staff,https://petition.parliament.uk/petitions/615854,open,160
Support unaccompanied children to enter UK through the Homes for Ukraine scheme,https://petition.parliament.uk/petitions/615863,open,167
Fund air filters and reintroduce measures to protect children and school staff ,https://petition.parliament.uk/petitions/615866,open,2068
"Fund a ""National Railcard"" for all rail travellers",https://petition.parliament.uk/petitions/615875,open,32
Full review of benefits available for people with Chronic & Hidden Disabilities,https://petition.parliament.uk/petitions/615884,open,58
Give elderly and vulnerable adults legal rights to have hospital visitors,https://petition.parliament.uk/petitions/615904,open,487
Introduce Albanian language as a GCSE and A Level,https://petition.parliament.uk/petitions/615921,open,1250
"Remove VAT from all clothes, soap, toilet roll and cleaning products",https://petition.parliament.uk/petitions/615923,open,33
Prevent the use of mobile devices by MPs whilst within the House of Commons.,https://petition.parliament.uk/petitions/615933,open,27
Provide full NHS cover to visiting British citizens who have paid 32years+ NI,https://petition.parliament.uk/petitions/615935,open,12
Make it illegal to disclose personal information from an inquest without consent,https://petition.parliament.uk/petitions/615950,open,167
Reduce the electricity Green Levy for home Heat Pump owners to the same as gas ,https://petition.parliament.uk/petitions/615951,open,48
Rename the early May bank holiday 'Union Day',https://petition.parliament.uk/petitions/615961,open,71
Require large companies to only use responsibly sourced palm oil in products.,https://petition.parliament.uk/petitions/615967,open,77
Minimum 15 yr sentences and driving bans for Death By Dangerous Driving,https://petition.parliament.uk/petitions/615975,open,2718
Review tax collection on flexible pension withdrawals to reduce overpayments,https://petition.parliament.uk/petitions/616006,open,18
Require family court cases with domestic abuse issues to be heard by a judge,https://petition.parliament.uk/petitions/616008,open,80
Require local support services for families affected by substance abuse,https://petition.parliament.uk/petitions/616009,open,346
Fund more free public toilets for every area,https://petition.parliament.uk/petitions/616010,open,74
Abolish all school exams and replace with teacher assessments,https://petition.parliament.uk/petitions/616014,open,30
Scrap VAT on all self-administered Covid test kits,https://petition.parliament.uk/petitions/616019,open,13
Fund Covid LFT kits to be sold to the public at cost price,https://petition.parliament.uk/petitions/616020,open,13
Ban children from all greyhound tracks,https://petition.parliament.uk/petitions/616052,open,58
Require all pregnant women to be offered APS 'sticky blood' testing,https://petition.parliament.uk/petitions/616060,open,147
Automatically grant emergency visas to those seeking an abortion in the UK,https://petition.parliament.uk/petitions/616062,open,6709
Fund free IVF for women with Endometriosis and are in a same sex relationship,https://petition.parliament.uk/petitions/616081,open,666
Bring forward the April 2023 State Pension increase,https://petition.parliament.uk/petitions/616082,open,310
Fund fitness classes and review treatment of cancer patients in recovery ,https://petition.parliament.uk/petitions/616105,open,18
Hold a referendum on sending deadly weapons to Ukraine,https://petition.parliament.uk/petitions/616108,open,155
Make failing to report drink driving with child passengers an offence ,https://petition.parliament.uk/petitions/616113,open,2468
Pass emergency legislation to block challenges to implementation of Rwanda plan,https://petition.parliament.uk/petitions/616114,open,1460
Ban fur farming,https://petition.parliament.uk/petitions/616119,open,199
Fund specialist provision for SEND children in all schools,https://petition.parliament.uk/petitions/616123,open,54
Review how the PHSO handles complaints of medical negligence that lead to death,https://petition.parliament.uk/petitions/616125,open,19
Ban the advertisement of high cost debt - 12 percent plus base rate,https://petition.parliament.uk/petitions/616128,open,708
"Extend Ofsted regulation to all after-school clubs, with annual inspections",https://petition.parliament.uk/petitions/616129,open,35
"Smart motorways to be banned, and for all hard shoulders to be reinstated",https://petition.parliament.uk/petitions/616141,open,496
‘Ralphy’s Law’ – Require hunting dog breeds to be muzzled in public,https://petition.parliament.uk/petitions/616145,open,359
Grant Indefinite Leave to Remain after 5 years residence in UK,https://petition.parliament.uk/petitions/616147,open,19
Make NHS Covid Pass available to 5-11 year olds following positive PCR test,https://petition.parliament.uk/petitions/616162,open,12
Reimburse all losses from missed travel due to Passport Service delays,https://petition.parliament.uk/petitions/616165,open,1043
End mandatory coalition in the Northern Ireland Executive,https://petition.parliament.uk/petitions/616176,open,26
Ban the use of smartphones in the House of Commons chamber,https://petition.parliament.uk/petitions/616179,open,73
Bring in promised legislation to regulate heat networks to give users parity,https://petition.parliament.uk/petitions/616180,open,18
Change the law to allow legal supervised injection facilities to reduce deaths.,https://petition.parliament.uk/petitions/616198,open,16
Make Misogyny a Hate Crime,https://petition.parliament.uk/petitions/616204,open,55
Fund improved diagnostic pathways and support for neurodivergent children,https://petition.parliament.uk/petitions/616260,open,291
Impose a 100% tax on alcohol and gambling advertising to fund support services,https://petition.parliament.uk/petitions/616278,open,62
Reverse the 1.25% NIC increase and remove the upper earnings limit,https://petition.parliament.uk/petitions/616298,open,42
Allow Landlords to Ask for a Higher Deposit from Tenants With Pets,https://petition.parliament.uk/petitions/616299,open,15
Allow unrelated children to enter UK with Ukrainian families,https://petition.parliament.uk/petitions/616309,open,442
Require all electrical installations to be carried out by qualified electricians,https://petition.parliament.uk/petitions/616310,open,440
Increase the National Living Wage to match the London Living Wage ,https://petition.parliament.uk/petitions/616315,open,23
Extend criteria for fast-track passports to British children born overseas,https://petition.parliament.uk/petitions/616317,open,29
Add fire awareness to the national curriculum,https://petition.parliament.uk/petitions/616330,open,21
Ban the sale and use of prong/pinch and shock collars.,https://petition.parliament.uk/petitions/616332,open,151
Make it an offence to intentionally view pornographic material in a public place,https://petition.parliament.uk/petitions/616339,open,119
Create a new body to review & oversee the Code of Conduct for MPs and sanctions,https://petition.parliament.uk/petitions/616356,open,85
Require Ukrainian children be offered school places within 14 days of arrival,https://petition.parliament.uk/petitions/616373,open,170
Strengthen CMS requirements on Receiving Parents and enforcement powers,https://petition.parliament.uk/petitions/616376,open,164
Bring forward the Net Zero emissions target to 2030,https://petition.parliament.uk/petitions/616392,open,71
Require local authorities replace roadside grass with wild flowers,https://petition.parliament.uk/petitions/616394,open,4518
Make the spaying and neutering of pet cats a legal requirement,https://petition.parliament.uk/petitions/616399,open,249
50% reduction in all taxes,https://petition.parliament.uk/petitions/616403,open,15
Give Ukrainian students with Tier4 visa (no work allowed) the permission to work,https://petition.parliament.uk/petitions/616410,open,77
Ban the use of Larsen traps in the UK,https://petition.parliament.uk/petitions/616418,open,25
Cut MLA's salaries to basic Universal Credit rate until an executive is formed,https://petition.parliament.uk/petitions/616423,open,745
Protect minors from harmful diet pills and muscle-building supplements,https://petition.parliament.uk/petitions/616450,open,51
Recognise and convert the Albanian driving license to a UK license,https://petition.parliament.uk/petitions/616466,open,755
Remove the restriction on family awaiting visas from visiting UK as tourists.,https://petition.parliament.uk/petitions/616471,open,14
Do not pass legislation to allow the gene editing of animals and crops,https://petition.parliament.uk/petitions/616480,open,10073
Make a Law that farmers fence of rights of way through fields containing cattle.,https://petition.parliament.uk/petitions/616486,open,13
Paid Overtime to be untaxed.,https://petition.parliament.uk/petitions/616493,open,74
Stop child maintenance payments when the child is being unreasonably withheld.,https://petition.parliament.uk/petitions/616502,open,43
Improve support for students with dyslexia and other learning difficulties,https://petition.parliament.uk/petitions/616514,open,62
Create benefit for full-time carers of disabled children paying £332.50 a week,https://petition.parliament.uk/petitions/616518,open,2431
Lower the basic rate income tax from 20% to 7.5%,https://petition.parliament.uk/petitions/616532,open,43
Stop salary and expenses to MLAs of parties who refuse to nominate ministers,https://petition.parliament.uk/petitions/616536,open,937
"Exempt registered care workers from council tax, while employed as a carer",https://petition.parliament.uk/petitions/616542,open,49
Require advisory age ratings for literature,https://petition.parliament.uk/petitions/616545,open,48
Extend 30 hours free childcare to student midwives/nurses/paramedics,https://petition.parliament.uk/petitions/616557,open,9554
Ban the sale of all medicines to under-18s,https://petition.parliament.uk/petitions/616559,open,26
Exempt charities using IPAFFS from ban on importing animals from Eastern Europe,https://petition.parliament.uk/petitions/616575,open,18233
"Lift ban on import of rescue animals from Romania, Ukraine, Belarus and Poland",https://petition.parliament.uk/petitions/616592,open,11051
Limit parking fines to no more than £10 per hour or similar,https://petition.parliament.uk/petitions/616593,open,31
Allow dependents of BN(O) VISA holders to work for UK Civil Service,https://petition.parliament.uk/petitions/616596,open,31
Require food & drink to be labelled with suitability for vegans and vegetarians,https://petition.parliament.uk/petitions/616598,open,72
Reverse NI increase for key workers who worked throughout the pandemic,https://petition.parliament.uk/petitions/616600,open,14
Every child arrangement order to automatically include enforcement powers.,https://petition.parliament.uk/petitions/616612,open,18
Make home sellers liable for costs incurred by buyers if they pull out,https://petition.parliament.uk/petitions/616634,open,18
Require the NHS have separate gynaecology units for women who are not pregnant,https://petition.parliament.uk/petitions/616635,open,150
Apply to Join the European Union (EU),https://petition.parliament.uk/petitions/616636,open,6251
Require all civil servants to return pre-pandemic working arrangements,https://petition.parliament.uk/petitions/616641,open,31
Fund free public transport for children,https://petition.parliament.uk/petitions/616644,open,19
Stop MLA's pay in Northern Ireland until the Executive is formed,https://petition.parliament.uk/petitions/616646,open,116
Allow sharing of medical details of 16-17 year olds with parents without consent,https://petition.parliament.uk/petitions/616662,open,20
Make identity theft a specific criminal offence,https://petition.parliament.uk/petitions/616666,open,33
Make ASD and ADHD prescriptions free for adults.,https://petition.parliament.uk/petitions/616671,open,55
Allow vets to fit and use ‘blue lights’ on their vehicle for emergency calls,https://petition.parliament.uk/petitions/616683,open,22
Include 'I am not represented' on all ballot papers.,https://petition.parliament.uk/petitions/616694,open,17
Prevent IPP imprisonment on recall unless found guilty of offences,https://petition.parliament.uk/petitions/616699,open,21
Use indelible ink to help prevent multiple voting in general elections,https://petition.parliament.uk/petitions/616700,open,36
Seek to negotiate mutual recognition of UK and Spanish driving licences,https://petition.parliament.uk/petitions/616713,open,5112
Stop VAT On Vet Bills,https://petition.parliament.uk/petitions/616717,open,4630
Increase funding for schools to support children with disabilities and SEN,https://petition.parliament.uk/petitions/616727,open,24
Hold a referendum on the monarchy when the current monarch's reign ends,https://petition.parliament.uk/petitions/616737,open,973
Implement a policy whereby pensioners receive free dental treatment,https://petition.parliament.uk/petitions/616740,open,456
Fund the drug bevacizumab (Avastin) on the NHS to treat colorectal cancer,https://petition.parliament.uk/petitions/616742,open,19119
Increase funding for NHS transgender services,https://petition.parliament.uk/petitions/616754,open,210
Include parenting skills in the national curriculum,https://petition.parliament.uk/petitions/616768,open,17
Require schools teach students about gender identity by Year 6,https://petition.parliament.uk/petitions/616801,open,58
Make the national curriculum more inclusive of LGBTQIA+ topics,https://petition.parliament.uk/petitions/616802,open,22
Require a licence to own certain dog breeds,https://petition.parliament.uk/petitions/616804,open,61
Allow cyclists under 16 or without a driving licence to cycle on pavements,https://petition.parliament.uk/petitions/616809,open,33
Increase blood test threshold for driving with cannabis in the body,https://petition.parliament.uk/petitions/616815,open,106
Change the law to make it illegal to be naked in a public place.,https://petition.parliament.uk/petitions/616816,open,37
Appoint a Hospitality tsar,https://petition.parliament.uk/petitions/616824,open,12
Suspend any MPs accused of sexual offences pending investigations,https://petition.parliament.uk/petitions/616845,open,2587
Allow trained Paramedics to prescribe controlled drugs,https://petition.parliament.uk/petitions/616848,open,767
Improve awareness of mental health conditions and support for sufferers,https://petition.parliament.uk/petitions/616860,open,32
Ban sale of fireworks to the public and limit sales to licensed displays only,https://petition.parliament.uk/petitions/616868,open,3588
VOTES FOR 16 - Lower the voting age to 16,https://petition.parliament.uk/petitions/616875,open,77
Fund NHS to increase eligibility for the NHS Low Income Scheme (LIS),https://petition.parliament.uk/petitions/616877,open,14
Ban the Use of Shock Collars and Choke Chains on Dogs,https://petition.parliament.uk/petitions/616881,open,26
Set a maximum wholesale price for oil and gas extracted from UK waters,https://petition.parliament.uk/petitions/616885,open,35
Suspend major development applications on green belt and protected land,https://petition.parliament.uk/petitions/616891,open,397
Allow all registered Operating Department Practitioners to prescribe medicines,https://petition.parliament.uk/petitions/616907,open,1096
Hold a national referendum on legalising and decriminalising cannabis.,https://petition.parliament.uk/petitions/616910,open,244
Subsidise a 'basic' amount of electricity for households,https://petition.parliament.uk/petitions/616915,open,172
Base Child Benefit High Income Charge on household income and local wages,https://petition.parliament.uk/petitions/616917,open,43
"Legally recognise genders such as Non-binary, Genderqueer and Intersex",https://petition.parliament.uk/petitions/616943,open,265
Cap profit fuel forecourt operators can make on petrol and diesel to 10p/litre,https://petition.parliament.uk/petitions/616956,open,49
Hold a referendum on the UK's membership of the World Health Organisation,https://petition.parliament.uk/petitions/616964,open,705
Require schools teach students about knife crime in Year 8 and 9,https://petition.parliament.uk/petitions/616968,open,446
Free prescriptions for anyone with a heart condition,https://petition.parliament.uk/petitions/616970,open,17
Require drivers of motorcycles for paid work to have full licence for type,https://petition.parliament.uk/petitions/616972,open,17
Allow tattoos from the age of 16,https://petition.parliament.uk/petitions/616975,open,16
Uphold the will of Parliament & implement the Leveson recommendations and s.40,https://petition.parliament.uk/petitions/616976,open,13
Make mental health first aiders a legal requirement in the workplace.,https://petition.parliament.uk/petitions/616991,open,32
Introduce a tax relief for commuting to and from a single place of work,https://petition.parliament.uk/petitions/616997,open,20
Require homebuilders to have insurance to cover full cost of build over £1k,https://petition.parliament.uk/petitions/617012,open,72
Allow European Union citizens to join the UK Army or Army Reserve,https://petition.parliament.uk/petitions/617022,open,15
Publish a Statement of Compatibility for the Rwandan Asylum Plan,https://petition.parliament.uk/petitions/617030,open,21
Public Order Bill: Remove powers to issue SDPOs for unconvicted protestors,https://petition.parliament.uk/petitions/617040,open,40
Cut the standard VAT rate from 20% to 5%,https://petition.parliament.uk/petitions/617044,open,87
Require publishers to display trigger warnings on title pages of books,https://petition.parliament.uk/petitions/617045,open,113
Require CCTV in supported living and care homes,https://petition.parliament.uk/petitions/617050,open,60
Require online review sites to prevent fraudulent reviews.,https://petition.parliament.uk/petitions/617054,open,45
Do not reform UK data protection laws (GDPR),https://petition.parliament.uk/petitions/617061,open,461
Remove Ofsted’s involvement in counselling services for adopted adults.,https://petition.parliament.uk/petitions/617066,open,27
Ban all unpaid work trials,https://petition.parliament.uk/petitions/617083,open,32
Require Cosmetic Surgery and Non Surgical Aesthetic ads to display a risk logo,https://petition.parliament.uk/petitions/617097,open,599
Ban private schools ,https://petition.parliament.uk/petitions/617101,open,32
Conduct a review into the family court service CAFCAS,https://petition.parliament.uk/petitions/617108,open,51
Introduce a windfall tax on pharmaceutical companies’ Covid-19 related profits,https://petition.parliament.uk/petitions/617111,open,1152
