Petition,URL,State,Signatures Count
Make 'stolen valour' - false claims about military service - a criminal offence,https://petition.parliament.uk/petitions/618793,open,16
Fund free access to period products,https://petition.parliament.uk/petitions/618799,open,78
Review UK foreign policy in light of reports of Israeli apartheid,https://petition.parliament.uk/petitions/618802,open,14432
Make it mandatory for Police & CPS to provide counselling to ALL victims of CSA,https://petition.parliament.uk/petitions/618805,open,115
Increase Legal Aid funding to help clear the backlog of criminal cases,https://petition.parliament.uk/petitions/618811,open,39
Allow members of the public to ask questions at PMQ's in Parliament,https://petition.parliament.uk/petitions/618820,open,32
Review Business Mileage and Fuel Rates Allowance,https://petition.parliament.uk/petitions/618845,open,26
Fund councils to provide more accessible and secure cycle lanes,https://petition.parliament.uk/petitions/618864,open,27
Review how the NHS determine whether people are a healthy weight,https://petition.parliament.uk/petitions/618870,open,18
Ban anyone born after 2008 from buying any tobacco products in their lifetime,https://petition.parliament.uk/petitions/618875,open,172
Increase free childcare for working parents with children under school age,https://petition.parliament.uk/petitions/618895,open,85
Make VAT on Second Hand clothing zero rated,https://petition.parliament.uk/petitions/618896,open,340
Scrap smart motorways and invest savings in the NHS instead,https://petition.parliament.uk/petitions/618910,open,73
Tighter restrictions on companies marketing vape kits at children & young people,https://petition.parliament.uk/petitions/618911,open,422
Save the bees: cut hazardous pesticides and support nature-friendly farming,https://petition.parliament.uk/petitions/618926,open,16217
Do not allow the use of agency workers to replace staff on strike,https://petition.parliament.uk/petitions/618935,open,81
Extend 15 hours free childcare to all 2-year old children,https://petition.parliament.uk/petitions/618939,open,33
Fund free NHS parking permits for student nurses and midwives,https://petition.parliament.uk/petitions/618942,open,135
Publish data on the deaths of health care staff from Covid 19 by ethnicity,https://petition.parliament.uk/petitions/618945,open,32
Ban schools from setting more than four hours of homework a week,https://petition.parliament.uk/petitions/618953,open,17
"Fund evacuation of Afghans, with UK relocation offers, trapped in Afghanistan",https://petition.parliament.uk/petitions/618960,open,945
Remove references to 'gender identity' from relationships education guidance,https://petition.parliament.uk/petitions/618970,open,4529
"Ban petrol leaf blowers which harm human health, animals and the environment",https://petition.parliament.uk/petitions/618978,open,185
"Grant full citizenship to British citizens by descent, and their children",https://petition.parliament.uk/petitions/618999,open,36
Urge China to allow direct flights between the UK and China to resume,https://petition.parliament.uk/petitions/619025,open,11
Condemn the US for overturning legal rights to abortion,https://petition.parliament.uk/petitions/619039,open,56
Require all cyclists and motor cyclists to wear high visibility clothing.,https://petition.parliament.uk/petitions/619054,open,16
Fund research and awareness campaign on Pelvic Organ Prolapse,https://petition.parliament.uk/petitions/619064,open,96
Fund pay rises for teachers in line with inflation,https://petition.parliament.uk/petitions/619072,open,40
Extend the £650 cost of living payments to contributions-based ESA claimants,https://petition.parliament.uk/petitions/619085,open,43
Raise the Pension Credit income threshold to equivalent of National Living Wage,https://petition.parliament.uk/petitions/619088,open,18
Set up sufficient abortion services in Northern Ireland,https://petition.parliament.uk/petitions/619098,open,124
Reduce income tax rates for NHS staff,https://petition.parliament.uk/petitions/619099,open,34
Recognise and convert the Moldovan driving license to a UK license,https://petition.parliament.uk/petitions/619151,open,23
Decriminalise abortion,https://petition.parliament.uk/petitions/619159,open,359
Introduce a ‘Transparency Law’ requiring social workers to wear body cameras,https://petition.parliament.uk/petitions/619166,open,98
Reduce or remove VAT from sales of Automated External Defibrillators (AED),https://petition.parliament.uk/petitions/619171,open,445
Require health professionals notify DVLA of all 'notifiable' medical conditions,https://petition.parliament.uk/petitions/619181,open,132
Exclude US States that restrict abortion rights from any new US-UK trade deal,https://petition.parliament.uk/petitions/619182,open,25
Increase Defence Spending to at least 3% of the United Kingdom’s GDP,https://petition.parliament.uk/petitions/619184,open,15
Make self-defence part of the secondary Physical Education curriculum,https://petition.parliament.uk/petitions/619189,open,64
Remove indemnity from the manufacturers of covid-19 vaccines,https://petition.parliament.uk/petitions/619190,open,7470
To remove or increase the upper earnings limit on Carers Allowance,https://petition.parliament.uk/petitions/619193,open,384
Increase awareness of the dangers of swimming in lakes and rivers,https://petition.parliament.uk/petitions/619230,open,372
Create a higher rate of Carer's Allowance for people providing 70+ hours care,https://petition.parliament.uk/petitions/619232,open,179
Require fuel outlets to display the cost of fuel per gallon,https://petition.parliament.uk/petitions/619244,open,10
Increase funding for diagnosis and treatment of speech and language needs,https://petition.parliament.uk/petitions/619250,open,292
Reduce the content in 2023 GCSE and A Level exams,https://petition.parliament.uk/petitions/619258,open,28
Public inquiry into treatment of people with mental health issues by the DWP,https://petition.parliament.uk/petitions/619267,open,238
Fund bowel cancer screening from age 30,https://petition.parliament.uk/petitions/619283,open,220
Include abortion rights in the Bill of Rights,https://petition.parliament.uk/petitions/619334,open,161089
Ban the sale of Household flea sprays in shops and online.,https://petition.parliament.uk/petitions/619337,open,94
Require polygraph tests of all new and serving police officers,https://petition.parliament.uk/petitions/619354,open,12
Allow parents to bring nursing babies into the Commons Chamber,https://petition.parliament.uk/petitions/619356,open,14
Apply to join the Single Market and Customs Union at the earliest opportunity,https://petition.parliament.uk/petitions/619362,open,2575
Ensure needs of autistic people are met in any future pandemic response,https://petition.parliament.uk/petitions/619371,open,692
Add a legal requirement for insurance companies to verify a policy holder's ID.,https://petition.parliament.uk/petitions/619374,open,15
Increase the threshold at which child benefit is repaid from £50k to £60k,https://petition.parliament.uk/petitions/619386,open,21
Grant legal protection to ancient trees,https://petition.parliament.uk/petitions/619390,open,34
"Scrap university fees for doctors, nurses, etc providing they finish the course.",https://petition.parliament.uk/petitions/619399,open,134
Change the law to prevent protestors outside abortion providers,https://petition.parliament.uk/petitions/619409,open,90
Allow those with 5 years ICT visa to apply for ILR,https://petition.parliament.uk/petitions/619414,open,79
Extend ‘qualifying school’ criteria for free school bus travel,https://petition.parliament.uk/petitions/619430,open,119
Find the time to take the Kept Animals Bill through Parliament and make it law,https://petition.parliament.uk/petitions/619442,open,66200
Commission an independent review of social services to protect children,https://petition.parliament.uk/petitions/619454,open,91
Fund heart screening in the NHS to avoid young people having cardiac arrests,https://petition.parliament.uk/petitions/619461,open,1485
Urge Pakistani Government to ensure free & fair elections & protect human rights,https://petition.parliament.uk/petitions/619463,open,19
End assessments and consider disability benefit claims on medical advice alone,https://petition.parliament.uk/petitions/619481,open,5563
"Require all public buildings to install gender-neutral bathrooms

 ",https://petition.parliament.uk/petitions/619482,open,24
Limit rent charges on new shared ownership properties to ground rent,https://petition.parliament.uk/petitions/619484,open,92
Require full pay for staff off with long-term sickness including cancer,https://petition.parliament.uk/petitions/619495,open,11
Allow A1 motorcycle license holders to use motorcycles with up to 250cc engines,https://petition.parliament.uk/petitions/619496,open,33
Fund all care costs for retired military and service dogs,https://petition.parliament.uk/petitions/619503,open,17
Increase subsidies and grants for homeowners to improve their energy ratings,https://petition.parliament.uk/petitions/619507,open,33
Require health warnings on ultra-processed foods,https://petition.parliament.uk/petitions/619509,open,55
Ban the sale and consumption of alcohol on any government/parliamentary estates,https://petition.parliament.uk/petitions/619523,open,17
"Ban school branding on shirts, polo shirts, trousers and skirts for all schools.",https://petition.parliament.uk/petitions/619526,open,25
Cap energy price increases for small businesses.,https://petition.parliament.uk/petitions/619529,open,4084
Require all EV chargers accept contactless payments by April 2023,https://petition.parliament.uk/petitions/619535,open,50
Ensure fair grading for GCSE students in 2023,https://petition.parliament.uk/petitions/619538,open,35
Require all government agencies and schools to accept cash,https://petition.parliament.uk/petitions/619550,open,1421
Reinstate original plans for Northern Powerhouse Rail line,https://petition.parliament.uk/petitions/619552,open,17
Include Fairtrade bananas in the free fruit for schools scheme.,https://petition.parliament.uk/petitions/619553,open,63
Abolish the benefit cap,https://petition.parliament.uk/petitions/619557,open,15
All children in receipt of Universal Credit to receive free school meals,https://petition.parliament.uk/petitions/619561,open,198
Grant amnesty and automatic ILR to under-18s after 5 years in the UK,https://petition.parliament.uk/petitions/619570,open,11
Ban the sale of cosmetic products that have been tested on animals,https://petition.parliament.uk/petitions/619585,open,35
Make dog attacks on cats a specific criminal offence,https://petition.parliament.uk/petitions/619594,open,406
Funding for mass scale clinical trials and treatment for post covid neuropathy,https://petition.parliament.uk/petitions/619599,open,25
Introduce mandatory drug and alcohol testing for MPs.,https://petition.parliament.uk/petitions/619602,open,46
Regulate and license equestrian livery yards,https://petition.parliament.uk/petitions/619606,open,27
Minimum wage pay for all healthcare students for placement hours worked!,https://petition.parliament.uk/petitions/619609,open,6646
Limit the shooting season of Woodcock,https://petition.parliament.uk/petitions/619615,open,25511
Joint claimants should receive £1300 cost of living payment instead of £650,https://petition.parliament.uk/petitions/619617,open,15
Male circumcision should be made illegal to under 18s unless for medical reasons,https://petition.parliament.uk/petitions/619633,open,25
Hold a referendum on changing the voting system to proportional representation,https://petition.parliament.uk/petitions/619684,open,451
Introduce a cap on the total tax take applied to fuel,https://petition.parliament.uk/petitions/619685,open,30
"Ministers to take a regular competency self assessment, set up by parliament.",https://petition.parliament.uk/petitions/619701,open,10
Require iron content be included on mandatory food nutrition labels.,https://petition.parliament.uk/petitions/619716,open,11
Fund more specialist school places for children with special educational needs,https://petition.parliament.uk/petitions/619720,open,3748
Call an immediate general election to end the chaos of the current government,https://petition.parliament.uk/petitions/619781,open,14516
Revoke policy not to make retrospective award of medals,https://petition.parliament.uk/petitions/619805,open,10
Make each county’s patron saint day a bank holiday for that individual county,https://petition.parliament.uk/petitions/619813,open,9
Ban the sale of energy drinks to under 16s,https://petition.parliament.uk/petitions/619819,open,36
Create a regulator for courier companies and impose stricter penalties,https://petition.parliament.uk/petitions/619832,open,86
Increase legal protections for people undergoing cosmetic surgery,https://petition.parliament.uk/petitions/619840,open,199
Treat Maternity Allowance the same as SMP when claiming other benefits,https://petition.parliament.uk/petitions/619875,open,55
"Fund a railway line to Dunstable, Bedfordshire.",https://petition.parliament.uk/petitions/619900,open,16
Reduce amounts and rights to payments for Ministers leaving office,https://petition.parliament.uk/petitions/619918,open,53
Suspend leaving payments for Ministers leaving office from July-September 2022,https://petition.parliament.uk/petitions/619922,open,16
Give employees a right to two days paid leave a year for religious observations,https://petition.parliament.uk/petitions/619950,open,50
Mandatory SEND training for all local authority education staff,https://petition.parliament.uk/petitions/619965,open,843
Cancel the 2022 House of Commons summer recess,https://petition.parliament.uk/petitions/619968,open,24
"Public Inquiry into the loss of HMS Glorious, Acasta and Ardent",https://petition.parliament.uk/petitions/619976,open,188
Require private car parks issue receipts/tickets stating time paid for,https://petition.parliament.uk/petitions/620014,open,20
If a Prime Minister resigns a general election should be called,https://petition.parliament.uk/petitions/620016,open,317
Ban parents and carers physically punishing their children in England,https://petition.parliament.uk/petitions/620021,open,21
Review handling of rape and sexual offences committed by under 18s,https://petition.parliament.uk/petitions/620030,open,138
Raise minimum wage to £12,https://petition.parliament.uk/petitions/620033,open,52
Set a legal maximum temperature where workers can't be required to work outdoors,https://petition.parliament.uk/petitions/620038,open,43
Fund more NHS Walk-in-Centres to help take pressure off A&E,https://petition.parliament.uk/petitions/620062,open,35
Protect SIA-licensed security workers under Assaults on Emergency Workers Act,https://petition.parliament.uk/petitions/620064,open,104
Create an ‘Adult ADHD strategy’ to improve diagnosis and treatment,https://petition.parliament.uk/petitions/620084,open,1761
Make the NHS Pension scheme tax-unregistered,https://petition.parliament.uk/petitions/620093,open,11356
Revert legislation governing firearms to the Firearms Act 1937,https://petition.parliament.uk/petitions/620102,open,54
Recognise the Isaaq Genocide,https://petition.parliament.uk/petitions/620132,open,160
Require schools to allow students to wear PE kit all day when over 24 degrees,https://petition.parliament.uk/petitions/620136,open,18
Ban gender-based dress codes in schools and workplaces,https://petition.parliament.uk/petitions/620169,open,23
Fund placenta measurements for all pregnant women on the NHS,https://petition.parliament.uk/petitions/620177,open,1256
Fund improved training on and care provision for ME/CFS as recommended,https://petition.parliament.uk/petitions/620200,open,2706
Reinstate 4 year minimum supervision for those on parole under life licence,https://petition.parliament.uk/petitions/620209,open,46
Fund improved facilities for ostomates in disabled toilets,https://petition.parliament.uk/petitions/620218,open,78
Require vets to do a full health check when pets have their jabs,https://petition.parliament.uk/petitions/620226,open,61
Remove penalty points from minimum penalty for speeding,https://petition.parliament.uk/petitions/620235,open,19
Long Covid - increase funding for research and treatment,https://petition.parliament.uk/petitions/620237,open,36
"Add option to vote for "" None of the above"" in all elections",https://petition.parliament.uk/petitions/620251,open,184
Fund expedited treatment for babies born with tongue tie,https://petition.parliament.uk/petitions/620258,open,1291
Require schools teach about Islam as part of religious education,https://petition.parliament.uk/petitions/620259,open,39
Introduce a discounted TV License for students,https://petition.parliament.uk/petitions/620262,open,27
Recognise Teaching Assistants as an important asset to schools by raising wage.,https://petition.parliament.uk/petitions/620264,open,80539
Increase Universal Credit to match National Living Wage and change savings rules,https://petition.parliament.uk/petitions/620275,open,20
Reform education to tackle racism,https://petition.parliament.uk/petitions/620278,open,74
Entertainment for Everyone Charter: Stop Disability Discrimination at Festivals,https://petition.parliament.uk/petitions/620283,open,387
Require Secretaries of State to have relevant qualifications/experience,https://petition.parliament.uk/petitions/620286,open,17
Mandatory Mental Health Training for all educational and early years staff,https://petition.parliament.uk/petitions/620295,open,108
Require binding referendums on petitions that receive over 1 million signatures,https://petition.parliament.uk/petitions/620300,open,302
Set a legal maximum temperature in HGV trucks,https://petition.parliament.uk/petitions/620301,open,37
Require schools provide a halal meat option,https://petition.parliament.uk/petitions/620305,open,74
Ban the production of virgin (new) plastics immediately,https://petition.parliament.uk/petitions/620309,open,45
Give small businesses a grant to repay any outstanding Bounce Back Loans,https://petition.parliament.uk/petitions/620313,open,27
Make the penalty for rape a whole life sentence,https://petition.parliament.uk/petitions/620320,open,22
Make Alternative Dispute Resolution mandatory for the Motor Industry,https://petition.parliament.uk/petitions/620323,open,12
Extend rules on listing ingredients and recall of food for humans to pet food,https://petition.parliament.uk/petitions/620340,open,942
Ban public transport workers from going on strike,https://petition.parliament.uk/petitions/620342,open,12
Launch a full Public Inquiry into child sexual exploitation (CSE) in Oldham,https://petition.parliament.uk/petitions/620383,open,783
Increase mental health care funding for children under 11s,https://petition.parliament.uk/petitions/620397,open,14
Increase the maximum power for an e-bike from 250 watts to 750 watts,https://petition.parliament.uk/petitions/620410,open,12
Provide financial support for schools to install air conditioning in classrooms,https://petition.parliament.uk/petitions/620441,open,13
Set maximum working temperature of 38C in hospitality kitchens,https://petition.parliament.uk/petitions/620442,open,47
Provide legal recognition for assistance animals other than dogs,https://petition.parliament.uk/petitions/620443,open,21
Introduce taxes on aviation kerosene,https://petition.parliament.uk/petitions/620450,open,21
Allow employees to claim unfair dismissal after probation,https://petition.parliament.uk/petitions/620456,open,17
Pay student teachers for their placement and provide bursaries for training,https://petition.parliament.uk/petitions/620461,open,44
Implement recommendations of the Mineworkers’ Pension Scheme report,https://petition.parliament.uk/petitions/620501,open,672
"Fund climate-ready updates to homes, businesses and infrastructure",https://petition.parliament.uk/petitions/620505,open,24
Allow culling of black-backed gulls using a general licence,https://petition.parliament.uk/petitions/620514,open,43
Ban commercial donkey rides,https://petition.parliament.uk/petitions/620523,open,786
Do not fund the BBC through a universal household levy linked to council tax,https://petition.parliament.uk/petitions/620528,open,54
"Work internationally to resettle asylum seekers, not send them to Rwanda",https://petition.parliament.uk/petitions/620541,open,9
Implement mandatory anti-racism training for all police officers,https://petition.parliament.uk/petitions/620546,open,31
Require people to work from home if they can,https://petition.parliament.uk/petitions/620548,open,12
Fund annual heart screenings for under 35s,https://petition.parliament.uk/petitions/620549,open,558
Make sanitary waste disposal facilities a requirement in CDM Regulations,https://petition.parliament.uk/petitions/620550,open,1653
Introduce mandatory minimum sentences for spiking,https://petition.parliament.uk/petitions/620554,open,11
Introduce new rights to compensation and support if trains cancelled or delayed,https://petition.parliament.uk/petitions/620587,open,16
Voucher scheme for those with Coeliacs Disease for gluten-free food,https://petition.parliament.uk/petitions/620602,open,633
Decommission all fossil fuel power stations by 2023,https://petition.parliament.uk/petitions/620604,open,29
Fund replanting of trees lost to forest fires to help combat climate change,https://petition.parliament.uk/petitions/620606,open,30
Set a maximum working temperature at the workplace,https://petition.parliament.uk/petitions/620620,open,15
 Require landlords respond to false fire alarms within 15 minutes,https://petition.parliament.uk/petitions/620631,open,26
Scrap the sugar tax and plans to stop multibuy offers on 'unhealthy' foods,https://petition.parliament.uk/petitions/620658,open,91
Any prospective candidate for MP must have lived in the constituency for 10 year,https://petition.parliament.uk/petitions/620660,open,9
Ban the sale of over the counter medicines which contain codeine,https://petition.parliament.uk/petitions/620668,open,47
Place large environmental taxes on the use of private jets,https://petition.parliament.uk/petitions/620676,open,54
Remove VAT on gym memberships,https://petition.parliament.uk/petitions/620688,open,664
Amend visa restrictions on under 14s from working as sportspersons,https://petition.parliament.uk/petitions/620728,open,82
Make student finance available for all second degrees,https://petition.parliament.uk/petitions/620743,open,16
Make helmets a legal requirement for all self-propelled vehicles,https://petition.parliament.uk/petitions/620744,open,285
Require under 18s be sentenced as adults for all serious offences,https://petition.parliament.uk/petitions/620746,open,220
Make legal aid available to all parties in family courts cases about children,https://petition.parliament.uk/petitions/620757,open,32
Mandatory whole life sentences for child abuse that leads to the child's death,https://petition.parliament.uk/petitions/620759,open,14
Add British Sign Language into the national curriculum,https://petition.parliament.uk/petitions/620767,open,711
"Ban the words ""plant"", ""grass"" & ""tree"" when used to sell plastic substitutes",https://petition.parliament.uk/petitions/620776,open,133
Increase NHS funding to provide more Plasma Donation Centres across England,https://petition.parliament.uk/petitions/620780,open,19
Grant automatic UK citizenship to those born to a British mother before 1983,https://petition.parliament.uk/petitions/620781,open,38
Create separate border control counters for non-UK citizens with residence cards,https://petition.parliament.uk/petitions/620785,open,10
Allow drinks to contain up to 2mg of THC and CBN,https://petition.parliament.uk/petitions/620786,open,9
Stop local councils charging both parents to take their children on holiday,https://petition.parliament.uk/petitions/620795,open,18
Make it a legal requirement that all new homes have solar energy installed.,https://petition.parliament.uk/petitions/620799,open,44
Abolish the House of Lords.,https://petition.parliament.uk/petitions/620819,open,29
Ban the use of greenfield land for solar panels and support uptake elsewhere,https://petition.parliament.uk/petitions/620822,open,802
Grant free prescriptions to people receiving statutory sick pay (SSP),https://petition.parliament.uk/petitions/620826,open,7
Require Jobcentre Plus centres have accessible toilets for customers,https://petition.parliament.uk/petitions/620829,open,22
Set a Minimum Pension Guarantee (MPG) of at least £200 pw for state pensioners,https://petition.parliament.uk/petitions/620839,open,14975
Increase funding for Child and Adolescent Mental Health Services,https://petition.parliament.uk/petitions/620846,open,18
Extend 30 hours free childcare to NHS staff on Skilled Worker visas,https://petition.parliament.uk/petitions/620847,open,9
Increase tax-free overnight subsistence allowance for UK for hauliers,https://petition.parliament.uk/petitions/620865,open,65
To make it law that dogs must be on leads around livestock,https://petition.parliament.uk/petitions/620868,open,764
Establish and Maintain an Aerial firefighting capability to combat wildfires,https://petition.parliament.uk/petitions/620876,open,118
Renationalise water,https://petition.parliament.uk/petitions/620881,open,1885
Introduce a regulator and mandatory licensing for animal groomers,https://petition.parliament.uk/petitions/620883,open,47
Seek to join Schengen to ease travel,https://petition.parliament.uk/petitions/620888,open,1298
Urge Israel to overturn new entry procedure for foreign visitors to Palestine,https://petition.parliament.uk/petitions/620891,open,136
