Petition,URL,State,Signatures Count
Require practical GCSEs to involve practical work that contributes to the grade.,https://petition.parliament.uk/petitions/329523,open,18
Review Social Services and set up an independent body to review complaints,https://petition.parliament.uk/petitions/574372,open,75
Mandate standard fuel be ethanol-free & allow lower VAT for fuel with ethanol,https://petition.parliament.uk/petitions/604051,open,19
Fund free childcare for all from 3 months to school age,https://petition.parliament.uk/petitions/604838,open,28
Amend the British Museum Act to allow the acceptance of repatriation requests,https://petition.parliament.uk/petitions/606621,open,66
Backdate settled status from beginning of application,https://petition.parliament.uk/petitions/607575,open,37
Introduce a fast-track divorce procedure for victims of domestic abuse,https://petition.parliament.uk/petitions/607947,open,182
Fund routine testing for Group B Streptococcus during late pregnancy,https://petition.parliament.uk/petitions/608081,open,7749
Automatically remove a Peer of title if found guilty of Child abuse.,https://petition.parliament.uk/petitions/608103,open,46
Review medical care and treatment for babies with failure to thrive,https://petition.parliament.uk/petitions/608495,open,343
Increase minimum and maximum sentences for sex offences,https://petition.parliament.uk/petitions/608804,open,256
Grant an amnesty for undocumented migrants after 10 years,https://petition.parliament.uk/petitions/608918,open,49
Make the valuation of DC pensions equivalent to DB pensions,https://petition.parliament.uk/petitions/608958,open,17
Make releasing helium balloons and sky lanterns a specific littering offence,https://petition.parliament.uk/petitions/609032,open,115
"Abolish National Insurance and make income tax 12% for all income over £12,570",https://petition.parliament.uk/petitions/609125,open,19
"Ban the Sale, Import and Trade of Animal Fur",https://petition.parliament.uk/petitions/609167,open,54
Extend eligibility for childcare grant to part-time student nurses,https://petition.parliament.uk/petitions/609214,open,26
End the use of Prayer Cards to reserve seats in the House of Commons.,https://petition.parliament.uk/petitions/609262,open,37
Give employees a right to full pay during sick leave,https://petition.parliament.uk/petitions/609305,open,29
Create a new tax for retailers that waste food,https://petition.parliament.uk/petitions/609306,open,17
Continue emergency funding for bus services,https://petition.parliament.uk/petitions/609432,open,90
Reinstate 5% rate of VAT for the hospitality sector,https://petition.parliament.uk/petitions/609482,open,76
Fund ‘Morpeth Diversion’; a fast alignment around the Morpeth Curve on the ECML,https://petition.parliament.uk/petitions/609577,open,69
Sever diplomatic relations with the Russian Federation,https://petition.parliament.uk/petitions/610043,open,1178
"Agree to the publication of the full, unredacted 2020 Russia Report",https://petition.parliament.uk/petitions/610066,open,746
Offer transport to the UK and healthcare to wounded Ukrainians,https://petition.parliament.uk/petitions/610094,open,31
Fund improved benefits and living conditions for asylum seekers,https://petition.parliament.uk/petitions/610115,open,36
Seize frozen Russian assets and give proceeds to Ukraine to help with rebuilding,https://petition.parliament.uk/petitions/610119,open,573
Require local authorities obtain DBS checks before licensing Tattoo Artists,https://petition.parliament.uk/petitions/610127,open,230
Fund routine scans for women to detect Abdominal Aortic Aneurysm (AAA),https://petition.parliament.uk/petitions/610129,open,403
Reform GCSE Mathematics to have 'core' and 'advanced' options,https://petition.parliament.uk/petitions/610161,open,82
"Reduce maximum tuition fees to £7,500 as recommended by the Augar Review 2019",https://petition.parliament.uk/petitions/610164,open,32
Fund more research into diagnosis and treatment of women’s health conditions,https://petition.parliament.uk/petitions/610170,open,245
Council Tax reduction for people on private estates paying management fees,https://petition.parliament.uk/petitions/610177,open,39
Implement the recommendations of the ISC Russia report,https://petition.parliament.uk/petitions/610203,open,677
Legislate to prevent misinformation about the Ukraine conflict on social media,https://petition.parliament.uk/petitions/610238,open,25
Reduce citizenship fees for children,https://petition.parliament.uk/petitions/610242,open,36
Require bus drivers have a 45 minutes break after 4 hours 30 minutes driving,https://petition.parliament.uk/petitions/610244,open,18
Increase funding for existing and new youth clubs,https://petition.parliament.uk/petitions/610248,open,54
Fund the building of communal fallout shelters across the country,https://petition.parliament.uk/petitions/610263,open,36
Make sexual harassment a specific criminal offence,https://petition.parliament.uk/petitions/610269,open,337
Introduce sanctions against Israel for occupation of the West Bank,https://petition.parliament.uk/petitions/610270,open,341
"Remove new protest provisions from Police, Crime, Sentencing and Courts Bill",https://petition.parliament.uk/petitions/610277,open,103
Remove Clause 11 from the Nationality and Borders Bill,https://petition.parliament.uk/petitions/610284,open,1383
Move the state pension age back to 60 for men and women,https://petition.parliament.uk/petitions/610288,open,1163
Ban all imports of Russian oil and gas immediately,https://petition.parliament.uk/petitions/610289,open,812
Facilitate a further Scottish Independence referendum,https://petition.parliament.uk/petitions/610295,open,2520
Exemption for customs documents for all vehicles carrying aid for the Ukraine,https://petition.parliament.uk/petitions/610296,open,36
Provide an energy grant to people with a disability or serious medical condition,https://petition.parliament.uk/petitions/610300,open,16216
Ban import and sale of diamonds from companies owned by the Russian Federation,https://petition.parliament.uk/petitions/610420,open,116
Bring forward legislation to end 'no-fault' section 21 evictions now,https://petition.parliament.uk/petitions/610444,open,37
Do not increase state pension age above 66,https://petition.parliament.uk/petitions/610452,open,35
Change the Sexual Offences Act so women can be charged with rape,https://petition.parliament.uk/petitions/610458,open,473
Reject any future applications to increase passenger numbers at Luton Airport,https://petition.parliament.uk/petitions/610459,open,2012
End immunity & let alleged war crime victims sue states like Russia in UK courts,https://petition.parliament.uk/petitions/610463,open,46
Extend Tax-Free Childcare to people on Skilled Work/Tier 2 visas,https://petition.parliament.uk/petitions/610476,open,16
UK should recognise Somaliland as an independent country,https://petition.parliament.uk/petitions/610487,open,106
Cease all foreign aid to the countries who abstained from condemning Russia.,https://petition.parliament.uk/petitions/610492,open,134
Redirect all foreign aid to Ukraine,https://petition.parliament.uk/petitions/610500,open,44
Establish a statutory public inquiry into British police culture.,https://petition.parliament.uk/petitions/610518,open,24
Reduce land ownership and transactions registration transition period to 28 days,https://petition.parliament.uk/petitions/610522,open,8
Provide Government match funding for all donations to Ukraine,https://petition.parliament.uk/petitions/610531,open,33
Introduce a new import tax on all Russian made goods.,https://petition.parliament.uk/petitions/610536,open,43
Reinstate martial arts onto the activity lists for GCSE and A level,https://petition.parliament.uk/petitions/610540,open,748
Implement arrangements to enable English households to sponsor Ukraine refugees,https://petition.parliament.uk/petitions/610542,open,91
Ensure student nurses are paid for placement hours,https://petition.parliament.uk/petitions/610557,open,13016
Suspend VAT on road fuels to reduce fuel costs,https://petition.parliament.uk/petitions/610567,open,1565
Help volunteers in the UK to join the Ukraine International Legion,https://petition.parliament.uk/petitions/610568,open,58
Temporarily suspend all taxes on all fuels and energy bills,https://petition.parliament.uk/petitions/610585,open,1407
Urge the UN to send a UN Peacekeeping Force to Ukraine immediately.,https://petition.parliament.uk/petitions/610630,open,811
Review how babies with tongue tie are treated & diagnosed,https://petition.parliament.uk/petitions/610642,open,5513
Increase NHS Staff pay by 10%,https://petition.parliament.uk/petitions/610647,open,103
Require petrol stations list country of origin of fuel at the pump,https://petition.parliament.uk/petitions/610651,open,31
Impose additional 20% duty tax on all goods imported from or made in Russia,https://petition.parliament.uk/petitions/610655,open,59
Make Health Education a compulsory separate subject in all schools.,https://petition.parliament.uk/petitions/610659,open,87
"Allow Ukrainians, Russians, Belarussians to extend tourist visas beyond 180 days",https://petition.parliament.uk/petitions/610661,open,240
Do not implement proposed changes to student loans,https://petition.parliament.uk/petitions/610674,open,42
Offer second boosters to every person over 50 or clinically vulnerable,https://petition.parliament.uk/petitions/610713,open,523
Review and fund improved testing and treatment for urinary tract infections,https://petition.parliament.uk/petitions/610771,open,4430
Extend family visas for non-UK parents when health and social care paid by child,https://petition.parliament.uk/petitions/610792,open,203
Ease entry restrictions for companion animals of Ukrainian refugees,https://petition.parliament.uk/petitions/610793,open,300
"Allow 16s and over to work 3 hours on a school day, but not during school hours",https://petition.parliament.uk/petitions/610795,open,24
Introduce mandatory registration & licensing of anyone who breeds/sells animals,https://petition.parliament.uk/petitions/610847,open,39
Electrify the Chiltern Mainline from Birmingham to London,https://petition.parliament.uk/petitions/610857,open,21
Hold a referendum on the UK meeting net zero much earlier than 2050.,https://petition.parliament.uk/petitions/610860,open,140
Fund OPTUNE brain cancer treatment for NHS patients,https://petition.parliament.uk/petitions/610898,open,35514
Increase statutory maternity pay for working mothers to 6 months at 90%,https://petition.parliament.uk/petitions/610900,open,2612
Do not raise VED on Motorcycles,https://petition.parliament.uk/petitions/610911,open,135
Require all schools give GCSE and A Level students study leave before exams,https://petition.parliament.uk/petitions/610932,open,16
"Require all public rights of way be accessible to pedestrians, horses & bicycles",https://petition.parliament.uk/petitions/610936,open,18193
Reward and fund relocation of Russian soldiers who actively surrender in Ukraine,https://petition.parliament.uk/petitions/610939,open,24
Increase minimum wage for licensed security workers to £15 an hour,https://petition.parliament.uk/petitions/610944,open,11267
Fund extra security and higher fencing on bridges for public safety,https://petition.parliament.uk/petitions/610954,open,35
"Remove the Thameslink, Southern and Great Northern fail franchise from GTR",https://petition.parliament.uk/petitions/610957,open,16
Make Graduate Visa Count Towards Settlement,https://petition.parliament.uk/petitions/610977,open,119
Increase funding for school meals so schools can invest in healthier foods,https://petition.parliament.uk/petitions/610990,open,36
Extend the Ukraine Family Scheme to non-Ukrainian nationals fleeing Ukraine,https://petition.parliament.uk/petitions/610995,open,210
Introduce grants for home battery storage systems,https://petition.parliament.uk/petitions/610997,open,318
Delay rebated fuel duty changes on Red Diesel until supply and pricing is stable,https://petition.parliament.uk/petitions/611004,open,34
Increase student maintenance loans in line with increased living costs,https://petition.parliament.uk/petitions/611017,open,89
Online retailers to state countries of manufacture and origin on all products.,https://petition.parliament.uk/petitions/611037,open,27
Allow Ukrainian refugees to obtain a UK visa in Calais,https://petition.parliament.uk/petitions/611039,open,13
"Invest in coal, oil, gas and nuclear to help achieve energy independence",https://petition.parliament.uk/petitions/611068,open,89
Return the Chagos Islands to Mauritius,https://petition.parliament.uk/petitions/611070,open,111
Ban development on agricultural land to increase food self-sufficiency,https://petition.parliament.uk/petitions/611113,open,22257
"Make videoing a sexual act, for any purpose, without consent a voyeurism offence",https://petition.parliament.uk/petitions/611117,open,976
Exempt UK military personnel travelling to fight for Ukraine from prosecution,https://petition.parliament.uk/petitions/611142,open,20
Commission NICE to Review Guidelines on Chronic Pain (Published April 2021),https://petition.parliament.uk/petitions/611150,open,14839
Ban the manufacture and sale of plastic bottles,https://petition.parliament.uk/petitions/611193,open,160
Create a statutory Mental Health & Wellbeing Policy for all schools & colleges,https://petition.parliament.uk/petitions/611264,open,53
Ensure households housing refugees do not lose the 25% single person discount,https://petition.parliament.uk/petitions/611292,open,99
Set up a funding scheme for scientists fleeing the war in Ukraine,https://petition.parliament.uk/petitions/611299,open,383
Review arrangements for production and delivery of Biometric Residence Permits,https://petition.parliament.uk/petitions/611312,open,11
Do not reduce funding for Covid research,https://petition.parliament.uk/petitions/611322,open,3758
Delay the April NI increase given the impact of the fuel crisis on UK households,https://petition.parliament.uk/petitions/611326,open,37
All schools to be issued a portrait of Her Majesty the Queen this Jubilee Year,https://petition.parliament.uk/petitions/611335,open,1565
Extend Ukraine Family Scheme to all Ukrainians on UK work and student visas ,https://petition.parliament.uk/petitions/611341,open,261
Reform UK Parliament behaviour - Make “Shouting / Jeering etc” unacceptable.,https://petition.parliament.uk/petitions/611354,open,86
Help the homeless by funding a shelter and at least one healthy meal per day,https://petition.parliament.uk/petitions/611379,open,37
"Propose a summit between Russia, Ukraine, EU, US, UK to end the war in Ukraine",https://petition.parliament.uk/petitions/611391,open,38
Create new publicly owned solar energy company to address fuel & climate crisis ,https://petition.parliament.uk/petitions/611416,open,813
Make property offers legally binding like in Scotland,https://petition.parliament.uk/petitions/611430,open,42
Lower the legal age of criminal responsibility to 7,https://petition.parliament.uk/petitions/611436,open,18
Ban new incinerator and pyrolysis sites and invest in waste reduction,https://petition.parliament.uk/petitions/611437,open,1688
Change the Standard Method for calculating local housing need,https://petition.parliament.uk/petitions/611438,open,3233
Off-rolling of pupils should be done through Ofsted or other independent body ,https://petition.parliament.uk/petitions/611448,open,10
Fund extension of NHS LSF bursary for paramedic students with a first degree,https://petition.parliament.uk/petitions/611451,open,413
Amnesty for undocumented migrants after 5 years and ILR after 14 Years,https://petition.parliament.uk/petitions/611472,open,497
Introduce a regulator for private landlords and caps for rent,https://petition.parliament.uk/petitions/611473,open,79
Raise stamp duty land tax (SDLT) thresholds for first-time buyers,https://petition.parliament.uk/petitions/611488,open,44
Make All Animal Hunting Illegal,https://petition.parliament.uk/petitions/611496,open,102
Add sociology to the national curriculum from year 7 to year 9,https://petition.parliament.uk/petitions/611502,open,21
Substantially raise minimum fostering allowances due to current cost of living,https://petition.parliament.uk/petitions/611519,open,1332
Change the law so that possession of a catapult in public becomes an offence,https://petition.parliament.uk/petitions/611526,open,2087
Enable Ofgem to set a Variable Price cap based on Usage and Council Tax Band,https://petition.parliament.uk/petitions/611531,open,38
Ban schools from setting rules about personal appearance of students,https://petition.parliament.uk/petitions/611540,open,55
Extend ‘Homes for Ukraine’ scheme to ALL refugees and asylum seekers,https://petition.parliament.uk/petitions/611550,open,151
Ensure advance information fair grading for A Level exam students in 2023,https://petition.parliament.uk/petitions/611552,open,38
Increase funding for Sure Start children's centres,https://petition.parliament.uk/petitions/611559,open,26
Provide bonuses to NHS staff for their hard work during the Covid pandemic.,https://petition.parliament.uk/petitions/611560,open,19
Implement immediate actions to stop the cost of living catastrophe,https://petition.parliament.uk/petitions/611567,open,475
Seek to suspend Russia as a permanent member of the UN Security Council,https://petition.parliament.uk/petitions/611578,open,79
Introduce an additional tax on products containing palm oil,https://petition.parliament.uk/petitions/611594,open,41
Ensure student paramedics are paid for placement hours,https://petition.parliament.uk/petitions/611599,open,35
Make Ukraine War denial a criminal offence,https://petition.parliament.uk/petitions/611607,open,64
Offer households £350 per month for six months to house the British homeless,https://petition.parliament.uk/petitions/611636,open,27
Abolish time limits on common assaults in cases of domestic violence and abuse,https://petition.parliament.uk/petitions/611638,open,76
Create a ‘Homes for Afghanistan’ refugee scheme,https://petition.parliament.uk/petitions/611646,open,663
Ban smoking and develop a strategy to support people to switch to vaping,https://petition.parliament.uk/petitions/611657,open,72
Do not introduce a pay per mile road tax,https://petition.parliament.uk/petitions/611672,open,120
Review English GCSEs to make them more accessible,https://petition.parliament.uk/petitions/611673,open,14
Extend ‘Harper's Law’ to include social workers,https://petition.parliament.uk/petitions/611674,open,268
Require all new motor vehicles be limited to a maximum speed of 80mph,https://petition.parliament.uk/petitions/611676,open,26
Require exam boards provide advance information about 2023 exam content,https://petition.parliament.uk/petitions/611680,open,634
Prohibit single-sex schools,https://petition.parliament.uk/petitions/611696,open,18
Ban the use of strip search in schools,https://petition.parliament.uk/petitions/611708,open,2790
"Increase the Category B driving license weight limit from 3,500kg to 3,650kg",https://petition.parliament.uk/petitions/611715,open,2079
Require workplaces offer women paid menstrual leave,https://petition.parliament.uk/petitions/611719,open,442
Subsidise electricity costs for Electric Vehicle owners and EV charging points,https://petition.parliament.uk/petitions/611723,open,50
Temporarily limit speed limits to 55mph to help reduce reliance on Russian oil,https://petition.parliament.uk/petitions/611726,open,85
"Encourage global ban on Russian oil and gas, and full ban from SWIFT",https://petition.parliament.uk/petitions/611728,open,29
Require schools close at 1pm on Friday so Muslims can go to mosque,https://petition.parliament.uk/petitions/611729,open,240
Stop all post Brexit payments to the EU,https://petition.parliament.uk/petitions/611732,open,365
"Add carbohydrates per item to “Front of pack” nutrition labelling, for diabetics",https://petition.parliament.uk/petitions/611740,open,31
Prohibit the sale and possession of Nazi memorabilia,https://petition.parliament.uk/petitions/611741,open,37
Extend Help to Buy scheme to people who have previously owned a home abroad,https://petition.parliament.uk/petitions/611758,open,256
Prohibit the unsolicited delivery of plastic bags,https://petition.parliament.uk/petitions/611788,open,29
Change the spouse visa eligibility requirements and application process,https://petition.parliament.uk/petitions/611790,open,1690
Require police offer victim support to all victims of pet theft,https://petition.parliament.uk/petitions/611792,open,500
Ban commercial breeding for laboratories. Implement reform to approve & use NAMs,https://petition.parliament.uk/petitions/611810,open,82539
Create a right for all employees to have essential work travel expenses covered,https://petition.parliament.uk/petitions/611816,open,136
Make it illegal to strip search under 18s without their choice of adult present,https://petition.parliament.uk/petitions/611817,open,277
Ban the Advertising of Meat and All Other Animal Products,https://petition.parliament.uk/petitions/611838,open,33
Ban adverts for charity on TV,https://petition.parliament.uk/petitions/611850,open,27
Review the role of juries in rape trials.,https://petition.parliament.uk/petitions/611864,open,274
Fund Evusheld the preventative COVID19 antibody for immunocompromised,https://petition.parliament.uk/petitions/611884,open,18158
Set the date of the next General Election for 2 May 2023,https://petition.parliament.uk/petitions/611905,open,62
Repeal the Climate Change Act 2008,https://petition.parliament.uk/petitions/611907,open,364
Fund free air travel to the UK for Ukrainian refugees,https://petition.parliament.uk/petitions/611910,open,368
Remove value of homes from ability to pay for social care means test,https://petition.parliament.uk/petitions/611930,open,20
Remove Leptospirosis Vaccine as a requirement for dog day care and boarding,https://petition.parliament.uk/petitions/611936,open,3480
Fund a male suicide prevention campaign ,https://petition.parliament.uk/petitions/611938,open,25
Work internationally to cancel Ukraine’s foreign debt,https://petition.parliament.uk/petitions/611959,open,24
Prohibit transactions in cryptocurrencies in the UK,https://petition.parliament.uk/petitions/611964,open,24
Make polyamorous marriages legal,https://petition.parliament.uk/petitions/611969,open,26
Make LFTs free for people who need to see clinically vulnerable friends & family,https://petition.parliament.uk/petitions/611981,open,244
Keep sanctions until Russia has fully compensated Ukraine,https://petition.parliament.uk/petitions/611996,open,35
Take action to increase driving test availability and enable faster resits,https://petition.parliament.uk/petitions/612009,open,26
Make protection of hedgerows a condition of ELM and BPS subsidies,https://petition.parliament.uk/petitions/612011,open,3799
Set a £30 annual vehicle tax for Electric Vehicles,https://petition.parliament.uk/petitions/612016,open,40
Prevent enforcement of school uniforms if temperatures exceed a certain level,https://petition.parliament.uk/petitions/612028,open,90
Change the marriage law in England/Wales from registered buildings to celebrants,https://petition.parliament.uk/petitions/612033,open,85
Fund research into Topical Steroid Withdrawal (TSW),https://petition.parliament.uk/petitions/612034,open,14397
Create new rights for breastfeeding mothers in the workplace,https://petition.parliament.uk/petitions/612043,open,193
Require pharmaceutical companies to publish full data about clinical trials,https://petition.parliament.uk/petitions/612052,open,23
Provide free bus passes for all over 60's,https://petition.parliament.uk/petitions/612068,open,182
Make anyone lawfully resident in the UK for five years eligible for ILR,https://petition.parliament.uk/petitions/612071,open,72
Allow international students to work more than 20 hours per week,https://petition.parliament.uk/petitions/612081,open,15
Start school at 10am to help teenagers with tiredness,https://petition.parliament.uk/petitions/612113,open,15842
Seek to end the oppression of the Uyghur people in China,https://petition.parliament.uk/petitions/612123,open,480
Stop schools from banning clothing associated with particular religions,https://petition.parliament.uk/petitions/612151,open,154
Increase benefits in line with current levels of inflation,https://petition.parliament.uk/petitions/612152,open,12986
Keep Covid tests free for all NHS staff members,https://petition.parliament.uk/petitions/612157,open,23
Require all ships operating out of UK ports to apply UK employment law,https://petition.parliament.uk/petitions/612163,open,227
Review 2022 marking of BTECs to ensure fairness,https://petition.parliament.uk/petitions/612165,open,14
Add Vehicle Trades (523) occupations to Shortage Occupations List,https://petition.parliament.uk/petitions/612170,open,304
Extend the help to buy scheme beyond March 2023,https://petition.parliament.uk/petitions/612211,open,231
Enable Ukrainian children without passports to enter UK without attending a VAC,https://petition.parliament.uk/petitions/612240,open,818
Increase foreign aid to Sri Lanka during its economic crisis,https://petition.parliament.uk/petitions/612250,open,535
Ban the sale of rabbit cages under 8 square feet,https://petition.parliament.uk/petitions/612255,open,106
Require and fund training on autism for all staff in mainstream schools,https://petition.parliament.uk/petitions/612259,open,174
Require MPs report weekly how much time they spend on second jobs,https://petition.parliament.uk/petitions/612274,open,36
Fund Ayurveda treatment on the NHS as a complementary and alternative medicine,https://petition.parliament.uk/petitions/612296,open,4183
