Petition,URL,State,Signatures Count
‘Ralphy’s Law’ – Require hunting dog breeds to be muzzled in public,https://petition.parliament.uk/petitions/616145,open,354
Grant Indefinite Leave to Remain after 5 years residence in UK,https://petition.parliament.uk/petitions/616147,open,15
Make NHS Covid Pass available to 5-11 year olds following positive PCR test,https://petition.parliament.uk/petitions/616162,open,12
Reimburse all losses from missed travel due to Passport Service delays,https://petition.parliament.uk/petitions/616165,open,840
End mandatory coalition in the Northern Ireland Executive,https://petition.parliament.uk/petitions/616176,open,23
Ban the use of smartphones in the House of Commons chamber,https://petition.parliament.uk/petitions/616179,open,70
Bring in promised legislation to regulate heat networks to give users parity,https://petition.parliament.uk/petitions/616180,open,12
Change the law to allow legal supervised injection facilities to reduce deaths.,https://petition.parliament.uk/petitions/616198,open,14
Make Misogyny a Hate Crime,https://petition.parliament.uk/petitions/616204,open,47
Fund improved diagnostic pathways and support for neurodivergent children,https://petition.parliament.uk/petitions/616260,open,287
Impose a 100% tax on alcohol and gambling advertising to fund support services,https://petition.parliament.uk/petitions/616278,open,58
Reverse the 1.25% NIC increase and remove the upper earnings limit,https://petition.parliament.uk/petitions/616298,open,38
Allow Landlords to Ask for a Higher Deposit from Tenants With Pets,https://petition.parliament.uk/petitions/616299,open,12
Allow unrelated children to enter UK with Ukrainian families,https://petition.parliament.uk/petitions/616309,open,437
Require all electrical installations to be carried out by qualified electricians,https://petition.parliament.uk/petitions/616310,open,427
Increase the National Living Wage to match the London Living Wage ,https://petition.parliament.uk/petitions/616315,open,23
Extend criteria for fast-track passports to British children born overseas,https://petition.parliament.uk/petitions/616317,open,28
Add fire awareness to the national curriculum,https://petition.parliament.uk/petitions/616330,open,17
Ban the sale and use of prong/pinch and shock collars.,https://petition.parliament.uk/petitions/616332,open,135
Make it an offence to intentionally view pornographic material in a public place,https://petition.parliament.uk/petitions/616339,open,114
Create a new body to review & oversee the Code of Conduct for MPs and sanctions,https://petition.parliament.uk/petitions/616356,open,82
Require Ukrainian children be offered school places within 14 days of arrival,https://petition.parliament.uk/petitions/616373,open,168
Strengthen CMS requirements on Receiving Parents and enforcement powers,https://petition.parliament.uk/petitions/616376,open,162
Bring forward the Net Zero emissions target to 2030,https://petition.parliament.uk/petitions/616392,open,60
Require local authorities replace roadside grass with wild flowers,https://petition.parliament.uk/petitions/616394,open,4362
Make the spaying and neutering of pet cats a legal requirement,https://petition.parliament.uk/petitions/616399,open,223
50% reduction in all taxes,https://petition.parliament.uk/petitions/616403,open,14
Give Ukrainian students with Tier4 visa (no work allowed) the permission to work,https://petition.parliament.uk/petitions/616410,open,77
Ban the use of Larsen traps in the UK,https://petition.parliament.uk/petitions/616418,open,21
Cut MLA's salaries to basic Universal Credit rate until an executive is formed,https://petition.parliament.uk/petitions/616423,open,735
Protect minors from harmful diet pills and muscle-building supplements,https://petition.parliament.uk/petitions/616450,open,40
Recognise and convert the Albanian driving license to a UK license,https://petition.parliament.uk/petitions/616466,open,751
Remove the restriction on family awaiting visas from visiting UK as tourists.,https://petition.parliament.uk/petitions/616471,open,14
Do not pass legislation to allow the gene editing of animals and crops,https://petition.parliament.uk/petitions/616480,open,9655
Make a Law that farmers fence of rights of way through fields containing cattle.,https://petition.parliament.uk/petitions/616486,open,13
Paid Overtime to be untaxed.,https://petition.parliament.uk/petitions/616493,open,71
Stop child maintenance payments when the child is being unreasonably withheld.,https://petition.parliament.uk/petitions/616502,open,36
Improve support for students with dyslexia and other learning difficulties,https://petition.parliament.uk/petitions/616514,open,58
Create benefit for full-time carers of disabled children paying £332.50 a week,https://petition.parliament.uk/petitions/616518,open,2376
Lower the basic rate income tax from 20% to 7.5%,https://petition.parliament.uk/petitions/616532,open,38
Stop salary and expenses to MLAs of parties who refuse to nominate ministers,https://petition.parliament.uk/petitions/616536,open,924
"Exempt registered care workers from council tax, while employed as a carer",https://petition.parliament.uk/petitions/616542,open,47
Require advisory age ratings for literature,https://petition.parliament.uk/petitions/616545,open,46
Extend 30 hours free childcare to student midwives/nurses/paramedics,https://petition.parliament.uk/petitions/616557,open,8329
Ban the sale of all medicines to under-18s,https://petition.parliament.uk/petitions/616559,open,26
Exempt charities using IPAFFS from ban on importing animals from Eastern Europe,https://petition.parliament.uk/petitions/616575,open,17412
"Lift ban on import of rescue animals from Romania, Ukraine, Belarus and Poland",https://petition.parliament.uk/petitions/616592,open,9902
Limit parking fines to no more than £10 per hour or similar,https://petition.parliament.uk/petitions/616593,open,24
Allow dependents of BN(O) VISA holders to work for UK Civil Service,https://petition.parliament.uk/petitions/616596,open,23
Require food & drink to be labelled with suitability for vegans and vegetarians,https://petition.parliament.uk/petitions/616598,open,47
Reverse NI increase for key workers who worked throughout the pandemic,https://petition.parliament.uk/petitions/616600,open,14
Every child arrangement order to automatically include enforcement powers.,https://petition.parliament.uk/petitions/616612,open,17
Make home sellers liable for costs incurred by buyers if they pull out,https://petition.parliament.uk/petitions/616634,open,17
Require the NHS have separate gynaecology units for women who are not pregnant,https://petition.parliament.uk/petitions/616635,open,145
Apply to Join the European Union (EU),https://petition.parliament.uk/petitions/616636,open,3893
Require all civil servants to return pre-pandemic working arrangements,https://petition.parliament.uk/petitions/616641,open,30
Fund free public transport for children,https://petition.parliament.uk/petitions/616644,open,15
Stop MLA's pay in Northern Ireland until the Executive is formed,https://petition.parliament.uk/petitions/616646,open,67
Allow sharing of medical details of 16-17 year olds with parents without consent,https://petition.parliament.uk/petitions/616662,open,19
Make identity theft a specific criminal offence,https://petition.parliament.uk/petitions/616666,open,30
Make ASD and ADHD prescriptions free for adults.,https://petition.parliament.uk/petitions/616671,open,50
Allow vets to fit and use ‘blue lights’ on their vehicle for emergency calls,https://petition.parliament.uk/petitions/616683,open,20
Include 'I am not represented' on all ballot papers.,https://petition.parliament.uk/petitions/616694,open,17
Prevent IPP imprisonment on recall unless found guilty of offences,https://petition.parliament.uk/petitions/616699,open,10
Use indelible ink to help prevent multiple voting in general elections,https://petition.parliament.uk/petitions/616700,open,35
Seek to negotiate mutual recognition of UK and Spanish driving licences,https://petition.parliament.uk/petitions/616713,open,4705
Stop VAT On Vet Bills,https://petition.parliament.uk/petitions/616717,open,4426
Increase funding for schools to support children with disabilities and SEN,https://petition.parliament.uk/petitions/616727,open,20
Hold a referendum on the monarchy when the current monarch's reign ends,https://petition.parliament.uk/petitions/616737,open,599
Implement a policy whereby pensioners receive free dental treatment,https://petition.parliament.uk/petitions/616740,open,412
Fund the drug bevacizumab (Avastin) on the NHS to treat colorectal cancer,https://petition.parliament.uk/petitions/616742,open,18080
Increase funding for NHS transgender services,https://petition.parliament.uk/petitions/616754,open,181
Include parenting skills in the national curriculum,https://petition.parliament.uk/petitions/616768,open,15
Require schools teach students about gender identity by Year 6,https://petition.parliament.uk/petitions/616801,open,44
Make the national curriculum more inclusive of LGBTQIA+ topics,https://petition.parliament.uk/petitions/616802,open,14
Require a licence to own certain dog breeds,https://petition.parliament.uk/petitions/616804,open,23
Allow cyclists under 16 or without a driving licence to cycle on pavements,https://petition.parliament.uk/petitions/616809,open,30
Increase blood test threshold for driving with cannabis in the body,https://petition.parliament.uk/petitions/616815,open,97
Change the law to make it illegal to be naked in a public place.,https://petition.parliament.uk/petitions/616816,open,33
Appoint a Hospitality tsar,https://petition.parliament.uk/petitions/616824,open,12
Suspend any MPs accused of sexual offences pending investigations,https://petition.parliament.uk/petitions/616845,open,2491
Allow trained Paramedics to prescribe controlled drugs,https://petition.parliament.uk/petitions/616848,open,755
Improve awareness of mental health conditions and support for sufferers,https://petition.parliament.uk/petitions/616860,open,29
Ban sale of fireworks to the public and limit sales to licensed displays only,https://petition.parliament.uk/petitions/616868,open,2997
VOTES FOR 16 - Lower the voting age to 16,https://petition.parliament.uk/petitions/616875,open,64
Fund NHS to increase eligibility for the NHS Low Income Scheme (LIS),https://petition.parliament.uk/petitions/616877,open,14
Ban the Use of Shock Collars and Choke Chains on Dogs,https://petition.parliament.uk/petitions/616881,open,22
Set a maximum wholesale price for oil and gas extracted from UK waters,https://petition.parliament.uk/petitions/616885,open,23
Suspend major development applications on green belt and protected land,https://petition.parliament.uk/petitions/616891,open,263
Allow all registered Operating Department Practitioners to prescribe medicines,https://petition.parliament.uk/petitions/616907,open,642
Hold a national referendum on legalising and decriminalising cannabis.,https://petition.parliament.uk/petitions/616910,open,184
Subsidise a 'basic' amount of electricity for households,https://petition.parliament.uk/petitions/616915,open,18
Base Child Benefit High Income Charge on household income and local wages,https://petition.parliament.uk/petitions/616917,open,25
"Legally recognise genders such as Non-binary, Genderqueer and Intersex",https://petition.parliament.uk/petitions/616943,open,228
Cap profit fuel forecourt operators can make on petrol and diesel to 10p/litre,https://petition.parliament.uk/petitions/616956,open,42
Hold a referendum on the UK's membership of the World Health Organisation,https://petition.parliament.uk/petitions/616964,open,663
Require schools teach students about knife crime in Year 8 and 9,https://petition.parliament.uk/petitions/616968,open,361
Free prescriptions for anyone with a heart condition,https://petition.parliament.uk/petitions/616970,open,15
Require drivers of motorcycles for paid work to have full licence for type,https://petition.parliament.uk/petitions/616972,open,13
Allow tattoos from the age of 16,https://petition.parliament.uk/petitions/616975,open,13
Uphold the will of Parliament & implement the Leveson recommendations and s.40,https://petition.parliament.uk/petitions/616976,open,10
Make mental health first aiders a legal requirement in the workplace.,https://petition.parliament.uk/petitions/616991,open,30
Introduce a tax relief for commuting to and from a single place of work,https://petition.parliament.uk/petitions/616997,open,20
Require homebuilders to have insurance to cover full cost of build over £1k,https://petition.parliament.uk/petitions/617012,open,67
Allow European Union citizens to join the UK Army or Army Reserve,https://petition.parliament.uk/petitions/617022,open,13
Publish a Statement of Compatibility for the Rwandan Asylum Plan,https://petition.parliament.uk/petitions/617030,open,20
Public Order Bill: Remove powers to issue SDPOs for unconvicted protestors,https://petition.parliament.uk/petitions/617040,open,39
Cut the standard VAT rate from 20% to 5%,https://petition.parliament.uk/petitions/617044,open,80
Require publishers to display trigger warnings on title pages of books,https://petition.parliament.uk/petitions/617045,open,111
Require CCTV in supported living and care homes,https://petition.parliament.uk/petitions/617050,open,56
Require online review sites to prevent fraudulent reviews.,https://petition.parliament.uk/petitions/617054,open,43
Do not reform UK data protection laws (GDPR),https://petition.parliament.uk/petitions/617061,open,370
Remove Ofsted’s involvement in counselling services for adopted adults.,https://petition.parliament.uk/petitions/617066,open,26
Ban all unpaid work trials,https://petition.parliament.uk/petitions/617083,open,27
Require Cosmetic Surgery and Non Surgical Aesthetic ads to display a risk logo,https://petition.parliament.uk/petitions/617097,open,301
Ban private schools ,https://petition.parliament.uk/petitions/617101,open,23
Conduct a review into the family court service CAFCAS,https://petition.parliament.uk/petitions/617108,open,51
Introduce a windfall tax on pharmaceutical companies’ Covid-19 related profits,https://petition.parliament.uk/petitions/617111,open,1102
Allow Driving theory test to expire three years instead of two,https://petition.parliament.uk/petitions/617119,open,82
Anyone aged 17 or below can go to a safe place without parental consent,https://petition.parliament.uk/petitions/617127,open,16
Implement Universal Basic Income to provide  for every citizen.,https://petition.parliament.uk/petitions/617133,open,87
Fund a vaccination programme for wild rabbits against Myxomatosis,https://petition.parliament.uk/petitions/617137,open,24
Recognise Police and Community Support Officers with a Long Service Medal,https://petition.parliament.uk/petitions/617138,open,15
Raise international purchases to £35 without paying VAT,https://petition.parliament.uk/petitions/617143,open,10
Increase statutory maternity pay in line with cost of living crisis,https://petition.parliament.uk/petitions/617155,open,25478
Scrap university tuition fees for Student Nurses and re-introduce full bursary.,https://petition.parliament.uk/petitions/617156,open,70
Allow pyrotechnics in football grounds,https://petition.parliament.uk/petitions/617160,open,11
Reduce the LISA withdrawal penalty.,https://petition.parliament.uk/petitions/617164,open,17
Make disregard for learners' safety an aggravating factor in driving offences,https://petition.parliament.uk/petitions/617180,open,7715
Make recommended size cages law for small animals to stop inadequate housing,https://petition.parliament.uk/petitions/617182,open,343
Give schoolchildren 5 flexible days off school each year,https://petition.parliament.uk/petitions/617186,open,63
Replace nuclear power with hybrid-solar-battery power in the energy strategy,https://petition.parliament.uk/petitions/617194,open,21
Add more Bull Terrier type dogs to the Dangerous Dogs Act,https://petition.parliament.uk/petitions/617217,open,19
Hold a referendum on England becoming independent from the UK,https://petition.parliament.uk/petitions/617218,open,22
Review the public services involved when someone dies to quicken the process,https://petition.parliament.uk/petitions/617223,open,78
Raise the income tax personal allowance to £15000 immediately,https://petition.parliament.uk/petitions/617227,open,136
Stop new planning applications for greenfield sites with 5 failed applications,https://petition.parliament.uk/petitions/617229,open,487
Remove VAT from toothpaste and toilet paper,https://petition.parliament.uk/petitions/617236,open,24
More help for carers: stop deducting carers allowance from Universal Credit,https://petition.parliament.uk/petitions/617244,open,20
Do not impose visa penalties on Russian or Belorussian nationals,https://petition.parliament.uk/petitions/617250,open,11
Increase the income tax personal allowance to £19305,https://petition.parliament.uk/petitions/617256,open,32
Impose sanctions on the US until it bans general firearm ownership for public,https://petition.parliament.uk/petitions/617268,open,22
Remove the ban on prisoners voting from the Representation of the People Act,https://petition.parliament.uk/petitions/617274,open,102
Hold an inquiry into Downing St event on 13 November 2020,https://petition.parliament.uk/petitions/617276,open,555
Enforce the bottle deposit (Pfand) recycling scheme in the UK,https://petition.parliament.uk/petitions/617288,open,71
Remove anti-protest measures from the Public Order Bill,https://petition.parliament.uk/petitions/617312,open,1799
Stop the proposed ban on tethering birds of prey,https://petition.parliament.uk/petitions/617315,open,54
Stop culling badgers now,https://petition.parliament.uk/petitions/617316,open,155
Require online games have child-only servers to help protect children,https://petition.parliament.uk/petitions/617317,open,16
Increase penalties for dog attacks on other dogs or people,https://petition.parliament.uk/petitions/617332,open,87
Pay mentors on the 2022 Government Help to Grow Management Scheme,https://petition.parliament.uk/petitions/617333,open,80
Do not require parents to register home educated children with local authorities,https://petition.parliament.uk/petitions/617340,open,10603
Provide all care-experienced children with a right to be assessed for an EHCP,https://petition.parliament.uk/petitions/617369,open,3200
Make the legal age to buy/use vapes 16 years old,https://petition.parliament.uk/petitions/617391,open,8
Exempt Government Ministers from the £400 energy bill discount,https://petition.parliament.uk/petitions/617400,open,13
Count students as low-income households in Energy Finance Support Package,https://petition.parliament.uk/petitions/617408,open,27
Require solar panels on all building by 2030,https://petition.parliament.uk/petitions/617413,open,16
Cancel the energy bill rebate for second homes,https://petition.parliament.uk/petitions/617415,open,94
Scrap HS2 P1 and use the money to pay for fuel bills (and save the country side),https://petition.parliament.uk/petitions/617417,open,17
Remove VAT on domestic energy bills now.,https://petition.parliament.uk/petitions/617418,open,59
Extend hate crime offences to include targeting people based on their sex,https://petition.parliament.uk/petitions/617422,open,20
Make people on disability benefits eligible for the £650 one off payment.,https://petition.parliament.uk/petitions/617425,open,19574
Increase flat rate (per mileage) for vehicle expenses for self-employed people,https://petition.parliament.uk/petitions/617426,open,17
Fund free Parking and NHS Hospitals For Staff and Patients,https://petition.parliament.uk/petitions/617436,open,14
Establish a not-for-profit state owned energy provider,https://petition.parliament.uk/petitions/617446,open,48
Reverse recent changes to the ministerial code ,https://petition.parliament.uk/petitions/617447,open,78
Make it mandatory for all retailers to show how much VAT consumers have spent.,https://petition.parliament.uk/petitions/617448,open,16
End the UK’s membership of the World Health Organisation,https://petition.parliament.uk/petitions/617450,open,20251
People on Contribution based should be helped the same as income related benefit,https://petition.parliament.uk/petitions/617461,open,16
Commit to not storing US nuclear weapons in the UK,https://petition.parliament.uk/petitions/617472,open,60
Ban advertising of alcohol and require health warnings on all alcohol,https://petition.parliament.uk/petitions/617480,open,25
Enshrine the Ministerial Code in Law ensuring updates are agreed in Parliament.,https://petition.parliament.uk/petitions/617484,open,29
Negotiate and agree with the EU to ease access of UK Musicians to tour Europe.,https://petition.parliament.uk/petitions/617486,open,77
Publish a response to the Regulation of Property Agents working group report,https://petition.parliament.uk/petitions/617493,open,58
Fund cancer immunotherapy treatments beyond 2 years and for rechallenge,https://petition.parliament.uk/petitions/617497,open,1569
Provide baby boxes for all newborn children in England,https://petition.parliament.uk/petitions/617499,open,34
Improve GCSE structure: More focus on coursework rather than the final exams,https://petition.parliament.uk/petitions/617509,open,259
Urgently review Advisory Electricity Rate (AER) for fully electric company cars,https://petition.parliament.uk/petitions/617514,open,162
Include Carers Allowance in the £650 cost of living payment,https://petition.parliament.uk/petitions/617537,open,47
Do not legislate for imperial-only measurements on goods,https://petition.parliament.uk/petitions/617540,open,3033
Relax visa rules for foreign workers for the hospitality sector. ,https://petition.parliament.uk/petitions/617546,open,21
Allow open-book GCSE's for English Literature starting from 2023 and onwards,https://petition.parliament.uk/petitions/617553,open,44
Make pay rises in line with inflation a condition of all Government contracts,https://petition.parliament.uk/petitions/617568,open,16
Urge China to ban the Yulin dog meat festival ,https://petition.parliament.uk/petitions/617570,open,41
Review quality of hospital care for disabled people,https://petition.parliament.uk/petitions/617572,open,55
Require all new builds to have solar panels as condition of planning permission,https://petition.parliament.uk/petitions/617573,open,71
"Add a ""None of the above"" option for General Elections",https://petition.parliament.uk/petitions/617575,open,32
Allow over-11s to change their name by deed poll without parental consent,https://petition.parliament.uk/petitions/617580,open,16
Reform arrangements for restraining orders against convicted domestic abusers,https://petition.parliament.uk/petitions/617588,open,149
Hold a referendum in London on abolishing the position of Mayor,https://petition.parliament.uk/petitions/617592,open,846
Review probable case definitions for Monkeypox,https://petition.parliament.uk/petitions/617594,open,81
"Increase State pensions to £380 a week, and lower retirement age to 60",https://petition.parliament.uk/petitions/617603,open,3612
Ban all non-UK residents from owning more than two residential properties,https://petition.parliament.uk/petitions/617615,open,8
Provide free school meals for ALL school children in England by autumn 2022,https://petition.parliament.uk/petitions/617633,open,460
Enact the Grenfell Inquiry recommendation on Personal Emergency Evacuation Plans,https://petition.parliament.uk/petitions/617645,open,2822
Extend the Help to Buy Equity Loan to people who have already owned property,https://petition.parliament.uk/petitions/617647,open,11
Allow ambulances to utilise green lights to attend urgent medical problems,https://petition.parliament.uk/petitions/617678,open,10
Build a new UK Parliament building and move Parliament to that building,https://petition.parliament.uk/petitions/617679,open,12
Require airlines to refund the full cost of cancelled flights automatically.,https://petition.parliament.uk/petitions/617682,open,168
Provide additional funding for swimming pools due to the energy increases,https://petition.parliament.uk/petitions/617686,open,47
Give the NHS more funding for mental health support,https://petition.parliament.uk/petitions/617699,open,33
Residential Park Home residents should be eligible for £400 electricity grant,https://petition.parliament.uk/petitions/617700,open,8214
Extend 30 hours free childcare to people with no access to public funds,https://petition.parliament.uk/petitions/617714,open,83
Commission a review into police handling of allegations of spiking,https://petition.parliament.uk/petitions/617716,open,212
Add Romanian to the Modern Languages GCSE ,https://petition.parliament.uk/petitions/617718,open,10716
Ban artificial nests for wild breeding raptors ,https://petition.parliament.uk/petitions/617720,open,127
"Address the Energy, Climate and Environment crisis by investing in Renewables",https://petition.parliament.uk/petitions/617729,open,68
Change the name of the BBC to Britain Today,https://petition.parliament.uk/petitions/617730,open,15
Ban horses from roads,https://petition.parliament.uk/petitions/617732,open,10
"Make remote working, where possible, a statutory employment right",https://petition.parliament.uk/petitions/617734,open,23
Negotiate with the EU to allow the use of UK issued pet passports as previously,https://petition.parliament.uk/petitions/617737,open,15
Make resale of Tobacco Related Products a licenced activity,https://petition.parliament.uk/petitions/617739,open,18
Move all Monday bank holidays to a Friday,https://petition.parliament.uk/petitions/617740,open,15
Protect homeowners who use force against intruders from prosecution ,https://petition.parliament.uk/petitions/617746,open,31
